{
  "address": "0xF00B1B0067Df8EacE5f40C3b17855deA6F5F2ebB",
  "abi": [
    {
      "anonymous": false,
      "inputs": [
        {
          "indexed": false,
          "internalType": "uint256",
          "name": "id",
          "type": "uint256"
        },
        {
          "indexed": false,
          "internalType": "address",
          "name": "newCONTROLLER",
          "type": "address"
        }
      ],
      "name": "ControllerChanged",
      "type": "event"
    },
    {
      "anonymous": false,
      "inputs": [
        {
          "indexed": false,
          "internalType": "uint256",
          "name": "TYPE",
          "type": "uint256"
        },
        {
          "indexed": false,
          "internalType": "bool",
          "name": "isElector",
          "type": "bool"
        }
      ],
      "name": "ElectorTypeSet",
      "type": "event"
    },
    {
      "anonymous": false,
      "inputs": [
        {
          "indexed": false,
          "internalType": "uint256",
          "name": "newFee",
          "type": "uint256"
        }
      ],
      "name": "GovernanceTaxUpdated",
      "type": "event"
    },
    {
      "anonymous": false,
      "inputs": [
        {
          "indexed": false,
          "internalType": "uint256",
          "name": "newMaxFee",
          "type": "uint256"
        }
      ],
      "name": "MaxGovernanceTaxUpdated",
      "type": "event"
    },
    {
      "anonymous": false,
      "inputs": [
        {
          "indexed": false,
          "internalType": "address",
          "name": "senate",
          "type": "address"
        },
        {
          "indexed": false,
          "internalType": "uint256",
          "name": "senateExpiry",
          "type": "uint256"
        }
      ],
      "name": "NewSenate",
      "type": "event"
    },
    {
      "anonymous": false,
      "inputs": [
        {
          "indexed": false,
          "internalType": "uint256",
          "name": "id",
          "type": "uint256"
        }
      ],
      "name": "ProposalApproved",
      "type": "event"
    },
    {
      "anonymous": false,
      "inputs": [
        {
          "indexed": false,
          "internalType": "uint256",
          "name": "id",
          "type": "uint256"
        },
        {
          "indexed": false,
          "internalType": "address",
          "name": "CONTROLLER",
          "type": "address"
        },
        {
          "indexed": false,
          "internalType": "uint256",
          "name": "TYPE",
          "type": "uint256"
        },
        {
          "indexed": false,
          "internalType": "uint256",
          "name": "deadline",
          "type": "uint256"
        }
      ],
      "name": "Proposed",
      "type": "event"
    },
    {
      "anonymous": false,
      "inputs": [
        {
          "indexed": false,
          "internalType": "uint256",
          "name": "proposalId",
          "type": "uint256"
        },
        {
          "indexed": false,
          "internalType": "uint256",
          "name": "electorId",
          "type": "uint256"
        }
      ],
      "name": "Vote",
      "type": "event"
    },
    {
      "inputs": [],
      "name": "MAX_PROPOSAL_DURATION",
      "outputs": [
        {
          "internalType": "uint32",
          "name": "",
          "type": "uint32"
        }
      ],
      "stateMutability": "view",
      "type": "function"
    },
    {
      "inputs": [],
      "name": "MAX_SENATE_PERIOD",
      "outputs": [
        {
          "internalType": "uint32",
          "name": "",
          "type": "uint32"
        }
      ],
      "stateMutability": "view",
      "type": "function"
    },
    {
      "inputs": [],
      "name": "MIN_PROPOSAL_DURATION",
      "outputs": [
        {
          "internalType": "uint32",
          "name": "",
          "type": "uint32"
        }
      ],
      "stateMutability": "view",
      "type": "function"
    },
    {
      "inputs": [],
      "name": "PERCENTAGE_DENOMINATOR",
      "outputs": [
        {
          "internalType": "uint256",
          "name": "",
          "type": "uint256"
        }
      ],
      "stateMutability": "view",
      "type": "function"
    }
  ],
  "transactionHash": "0x84e748213c2466b614b1912f9d1f15a69e91dc523cce1c61bc6efbf15c5b91e1",
  "receipt": {
    "to": null,
    "from": "0x5297F1EA60D4b60E85eF323DECEc1A907295B6E6",
    "contractAddress": "0xF00B1B0067Df8EacE5f40C3b17855deA6F5F2ebB",
    "transactionIndex": 47,
    "gasUsed": "1549337",
    "logsBloom": "0x00000000000000000000000000000000000000000000000000000000000000000000000000000000000000000000000000000000000000000000000000000000000000000000000000000000000000000000000000000000000000000000000000000000000000000000000000000000000000000000000000000000000000000000000000000000000000000000000000000000000000000000000000000000000000000000000000000000000000000000000000000000000000000000000000000000000000000000000000000000000000000000000000000000000000000000000000000000000000000000000000000000000000000000000000000000",
    "blockHash": "0xd6f6d627dc9846f5ca89c77ebc65ccb07586492bb1e6af92ee20d9288de7b833",
    "transactionHash": "0x84e748213c2466b614b1912f9d1f15a69e91dc523cce1c61bc6efbf15c5b91e1",
    "logs": [],
    "blockNumber": 7845390,
    "cumulativeGasUsed": "12255942",
    "status": 1,
    "byzantium": true
  },
  "args": [],
  "numDeployments": 1,
  "solcInputHash": "ee39b7d5d718f6bdbf221f88cbfb986f",
  "metadata": "{\"compiler\":{\"version\":\"0.8.7+commit.e28d00a7\"},\"language\":\"Solidity\",\"output\":{\"abi\":[{\"anonymous\":false,\"inputs\":[{\"indexed\":false,\"internalType\":\"uint256\",\"name\":\"id\",\"type\":\"uint256\"},{\"indexed\":false,\"internalType\":\"address\",\"name\":\"newCONTROLLER\",\"type\":\"address\"}],\"name\":\"ControllerChanged\",\"type\":\"event\"},{\"anonymous\":false,\"inputs\":[{\"indexed\":false,\"internalType\":\"uint256\",\"name\":\"TYPE\",\"type\":\"uint256\"},{\"indexed\":false,\"internalType\":\"bool\",\"name\":\"isElector\",\"type\":\"bool\"}],\"name\":\"ElectorTypeSet\",\"type\":\"event\"},{\"anonymous\":false,\"inputs\":[{\"indexed\":false,\"internalType\":\"uint256\",\"name\":\"newFee\",\"type\":\"uint256\"}],\"name\":\"GovernanceTaxUpdated\",\"type\":\"event\"},{\"anonymous\":false,\"inputs\":[{\"indexed\":false,\"internalType\":\"uint256\",\"name\":\"newMaxFee\",\"type\":\"uint256\"}],\"name\":\"MaxGovernanceTaxUpdated\",\"type\":\"event\"},{\"anonymous\":false,\"inputs\":[{\"indexed\":false,\"internalType\":\"address\",\"name\":\"senate\",\"type\":\"address\"},{\"indexed\":false,\"internalType\":\"uint256\",\"name\":\"senateExpiry\",\"type\":\"uint256\"}],\"name\":\"NewSenate\",\"type\":\"event\"},{\"anonymous\":false,\"inputs\":[{\"indexed\":false,\"internalType\":\"uint256\",\"name\":\"id\",\"type\":\"uint256\"}],\"name\":\"ProposalApproved\",\"type\":\"event\"},{\"anonymous\":false,\"inputs\":[{\"indexed\":false,\"internalType\":\"uint256\",\"name\":\"id\",\"type\":\"uint256\"},{\"indexed\":false,\"internalType\":\"address\",\"name\":\"CONTROLLER\",\"type\":\"address\"},{\"indexed\":false,\"internalType\":\"uint256\",\"name\":\"TYPE\",\"type\":\"uint256\"},{\"indexed\":false,\"internalType\":\"uint256\",\"name\":\"deadline\",\"type\":\"uint256\"}],\"name\":\"Proposed\",\"type\":\"event\"},{\"anonymous\":false,\"inputs\":[{\"indexed\":false,\"internalType\":\"uint256\",\"name\":\"proposalId\",\"type\":\"uint256\"},{\"indexed\":false,\"internalType\":\"uint256\",\"name\":\"electorId\",\"type\":\"uint256\"}],\"name\":\"Vote\",\"type\":\"event\"},{\"inputs\":[],\"name\":\"MAX_PROPOSAL_DURATION\",\"outputs\":[{\"internalType\":\"uint32\",\"name\":\"\",\"type\":\"uint32\"}],\"stateMutability\":\"view\",\"type\":\"function\"},{\"inputs\":[],\"name\":\"MAX_SENATE_PERIOD\",\"outputs\":[{\"internalType\":\"uint32\",\"name\":\"\",\"type\":\"uint32\"}],\"stateMutability\":\"view\",\"type\":\"function\"},{\"inputs\":[],\"name\":\"MIN_PROPOSAL_DURATION\",\"outputs\":[{\"internalType\":\"uint32\",\"name\":\"\",\"type\":\"uint32\"}],\"stateMutability\":\"view\",\"type\":\"function\"},{\"inputs\":[],\"name\":\"PERCENTAGE_DENOMINATOR\",\"outputs\":[{\"internalType\":\"uint256\",\"name\":\"\",\"type\":\"uint256\"}],\"stateMutability\":\"view\",\"type\":\"function\"}],\"devdoc\":{\"author\":\"Icebear & Crash Bandicoot\",\"details\":\"Contracts relying on this library must initialize GeodeUtils.UniverseALL \\\"fee\\\" variables are limited by PERCENTAGE_DENOMINATOR = 100%Admin functions are already protected Note this library contains both functions called by users(ID) (approveSenate) and admins(GOVERNANCE, SENATE) Note refer to DataStoreUtils before reviewing\",\"kind\":\"dev\",\"methods\":{\"approveProposal(GeodeUtils.Universe storage,DataStoreUtils.DataStore storage,uint256)\":{\"details\":\"Senate should not be able to approve approved proposalsSenate should not be able to approve expired proposalsSenate should not be able to approve SENATE proposals :)\",\"params\":{\"id\":\"given ID proposal that has been approved by Senate\"}},\"approveSenate(GeodeUtils.Universe storage,DataStoreUtils.DataStore storage,uint256,uint256)\":{\"details\":\"pins id as \\\"voted\\\" when approvedincreases \\\"approvalCount\\\" of proposalId by 1 when approved\",\"params\":{\"electorId\":\"should have the voting rights, msg.sender should be the CONTROLLER of given ID\"}},\"changeIdCONTROLLER(DataStoreUtils.DataStore storage,uint256,address)\":{\"details\":\"this operation can not be reverted by the old CONTROLLERin case the current controller wants to remove the need to upgrade to Controller they should provide smt like 0x000000000000000000000000000000000000dEaD\"},\"getCONTROLLERFromId(DataStoreUtils.DataStore storage,uint256)\":{\"details\":\"returns address(0) for empty ids, mandatory\"},\"getGovernance(GeodeUtils.Universe storage)\":{\"returns\":{\"_0\":\"address of GOVERNANCE*\"}},\"getGovernanceTax(GeodeUtils.Universe storage)\":{\"returns\":{\"_0\":\"active GOVERNANCE_TAX, limited by MAX_GOVERNANCE_TAX\"}},\"getMaxGovernanceTax(GeodeUtils.Universe storage)\":{\"returns\":{\"_0\":\"MAX_GOVERNANCE_TAX\"}},\"getNAMEFromId(DataStoreUtils.DataStore storage,uint256)\":{\"details\":\"returns bytes(0) for empty ids, mandatory\"},\"getSenate(GeodeUtils.Universe storage)\":{\"returns\":{\"_0\":\"address of SENATE*\"}},\"getSenateExpiry(GeodeUtils.Universe storage)\":{\"returns\":{\"_0\":\"the expiration date of current SENATE as a timestamp\"}},\"getTYPEFromId(DataStoreUtils.DataStore storage,uint256)\":{\"details\":\"returns uint(0) for empty ids, mandatory\"},\"isUpgradeAllowed(GeodeUtils.Universe storage,address)\":{\"details\":\"address(0) should return falseDO NOT TOUCH, EVER! WHATEVER YOU DEVELOP IN FUCKING 3022*\",\"returns\":{\"_0\":\"True if it is allowed by senate and false if not.\"}},\"newProposal(GeodeUtils.Universe storage,address,uint256,bytes,uint256)\":{\"details\":\"refer to structure of Proposal for explanations of params\"},\"setElectorType(GeodeUtils.Universe storage,DataStoreUtils.DataStore storage,uint256,bool)\":{\"details\":\"can not set with the same value again, preventing double increment/decrements\",\"params\":{\"_TYPE\":\"selected type\",\"isElector\":\"true if selected _type can vote for senate from now on\"}},\"setGovernanceTax(GeodeUtils.Universe storage,uint256)\":{\"details\":\"can not set the fee more than MAX_GOVERNANCE_TAXno need to check PERCENTAGE_DENOMINATOR because MAX_GOVERNANCE_TAX is limited already\",\"returns\":{\"_0\":\"true if the operation was succesful, might be helpful when governance rights are distributed\"}},\"setMaxGovernanceTax(GeodeUtils.Universe storage,uint256)\":{\"details\":\"can not set a fee more than PERCENTAGE_DENOMINATOR (100%)\",\"returns\":{\"_0\":\"true if the operation was succesful\"}}},\"title\":\"GeodeUtils library\",\"version\":1},\"userdoc\":{\"kind\":\"user\",\"methods\":{\"PERCENTAGE_DENOMINATOR()\":{\"notice\":\"PERCENTAGE_DENOMINATOR represents 100%\"},\"approveProposal(GeodeUtils.Universe storage,DataStoreUtils.DataStore storage,uint256)\":{\"notice\":\"type specific changes for reserved_types(1,2,3) are implemented here,  any other addition should take place in Portal, as not related\"},\"approveSenate(GeodeUtils.Universe storage,DataStoreUtils.DataStore storage,uint256,uint256)\":{\"notice\":\"Proposed CONTROLLER is the new Senate after 2/3 of the electors approved NOTE mathematically, min 4 elector is needed for (c+1)*2/3 to work properlyid can not vote if: - approved already - proposal is expired - not its type is elector - not senate proposal\"},\"changeIdCONTROLLER(DataStoreUtils.DataStore storage,uint256,address)\":{\"notice\":\"only the current CONTROLLER can change\"},\"getGovernanceTax(GeodeUtils.Universe storage)\":{\"notice\":\"MAX_GOVERNANCE_TAX must limit GOVERNANCE_TAX even if MAX is changed\"},\"getProposal(GeodeUtils.Universe storage,uint256)\":{\"notice\":\"CONTROLLER Proposals\"},\"isUpgradeAllowed(GeodeUtils.Universe storage,address)\":{\"notice\":\"Get if it is allowed to change a specific contract with the current version.\"},\"newProposal(GeodeUtils.Universe storage,address,uint256,bytes,uint256)\":{\"notice\":\"a proposal can never be overriden.DATASTORE(id) will not be updated until the proposal is approved.\"},\"setElectorType(GeodeUtils.Universe storage,DataStoreUtils.DataStore storage,uint256,bool)\":{\"notice\":\"only elector types can vote for senate\"}},\"notice\":\"Exclusively contains functions responsible for administration of DATASTORE, including functions related to \\\"limited upgradability\\\" with Senate & Proposals.\",\"version\":1}},\"settings\":{\"compilationTarget\":{\"contracts/Portal/utils/GeodeUtilsLib.sol\":\"GeodeUtils\"},\"evmVersion\":\"london\",\"libraries\":{},\"metadata\":{\"bytecodeHash\":\"ipfs\",\"useLiteralContent\":true},\"optimizer\":{\"enabled\":true,\"runs\":200},\"remappings\":[]},\"sources\":{\"contracts/Portal/utils/DataStoreUtilsLib.sol\":{\"content\":\"// SPDX-License-Identifier: MIT\\r\\n\\r\\npragma solidity =0.8.7;\\r\\n\\r\\n/**\\r\\n * @author Icebear & Crash Bandicoot\\r\\n * @title Storage Management Library for dynamic structs, based on data types and ids\\r\\n *\\r\\n * DataStoreUtils is a storage management tool designed to create a safe and scalable\\r\\n * storage layout with the help of ids and keys.\\r\\n * Mainly focusing on upgradable contracts with multiple user types to create a\\r\\n * sustainable development environment.\\r\\n *\\r\\n * In summary, extra gas cost that would be saved with Storage packing are\\r\\n * ignored to create upgradable structs*.\\r\\n *\\r\\n * IDs are the representation of a user with any given key as properties.\\r\\n * Type for ID is not mandatory, not all IDs should have an explicit type.\\r\\n * Thus there is no checks of types or keys.\\r\\n *\\r\\n * @notice distinct id and key pairs return different storage slots\\r\\n *\\r\\n */\\r\\nlibrary DataStoreUtils {\\r\\n    /**\\r\\n     * @notice Main Struct for reading and writing data to storage for given (id, key) pairs\\r\\n     * @param allIdsByType optional categorization for given ID, requires direct access, type => id[]\\r\\n     * @param uintData keccak(id, key) =>  returns uint256\\r\\n     * @param bytesData keccak(id, key) => returns bytes\\r\\n     * @param addressData keccak(id, key) =>  returns address\\r\\n     * @dev any other storage type can be expressed as bytes\\r\\n     */\\r\\n    struct DataStore {\\r\\n        mapping(uint256 => uint256[]) allIdsByType;\\r\\n        mapping(bytes32 => uint256) uintData;\\r\\n        mapping(bytes32 => bytes) bytesData;\\r\\n        mapping(bytes32 => address) addressData;\\r\\n        uint256[12] __gap;\\r\\n    }\\r\\n\\r\\n    /**\\r\\n     *                              ** HELPER **\\r\\n     **/\\r\\n\\r\\n    /**\\r\\n     * @notice hashes given id with parameter to be used as key in getters and setters\\r\\n     * @return key bytes32 hash of id and parameter to be stored\\r\\n     **/\\r\\n    function getKey(uint256 _id, bytes32 _param)\\r\\n        internal\\r\\n        pure\\r\\n        returns (bytes32 key)\\r\\n    {\\r\\n        key = keccak256(abi.encodePacked(_id, _param));\\r\\n    }\\r\\n\\r\\n    /**\\r\\n     *                              **DATA GETTERS **\\r\\n     **/\\r\\n\\r\\n    function readUintForId(\\r\\n        DataStore storage self,\\r\\n        uint256 _id,\\r\\n        bytes32 _key\\r\\n    ) internal view returns (uint256 data) {\\r\\n        data = self.uintData[getKey(_id, _key)];\\r\\n    }\\r\\n\\r\\n    function readBytesForId(\\r\\n        DataStore storage self,\\r\\n        uint256 _id,\\r\\n        bytes32 _key\\r\\n    ) internal view returns (bytes memory data) {\\r\\n        data = self.bytesData[getKey(_id, _key)];\\r\\n    }\\r\\n\\r\\n    function readAddressForId(\\r\\n        DataStore storage self,\\r\\n        uint256 _id,\\r\\n        bytes32 _key\\r\\n    ) internal view returns (address data) {\\r\\n        data = self.addressData[getKey(_id, _key)];\\r\\n    }\\r\\n\\r\\n    /**\\r\\n     *                              **DATA SETTERS **\\r\\n     **/\\r\\n    function writeUintForId(\\r\\n        DataStore storage self,\\r\\n        uint256 _id,\\r\\n        bytes32 _key,\\r\\n        uint256 _data\\r\\n    ) internal {\\r\\n        self.uintData[getKey(_id, _key)] = _data;\\r\\n    }\\r\\n\\r\\n    function addUintForId(\\r\\n        DataStore storage self,\\r\\n        uint256 _id,\\r\\n        bytes32 _key,\\r\\n        uint256 _addend\\r\\n    ) internal {\\r\\n        self.uintData[getKey(_id, _key)] += _addend;\\r\\n    }\\r\\n\\r\\n    function subUintForId(\\r\\n        DataStore storage self,\\r\\n        uint256 _id,\\r\\n        bytes32 _key,\\r\\n        uint256 _minuend\\r\\n    ) internal {\\r\\n        self.uintData[getKey(_id, _key)] -= _minuend;\\r\\n    }\\r\\n\\r\\n    function writeBytesForId(\\r\\n        DataStore storage self,\\r\\n        uint256 _id,\\r\\n        bytes32 _key,\\r\\n        bytes memory _data\\r\\n    ) internal {\\r\\n        self.bytesData[getKey(_id, _key)] = _data;\\r\\n    }\\r\\n\\r\\n    function writeAddressForId(\\r\\n        DataStore storage self,\\r\\n        uint256 _id,\\r\\n        bytes32 _key,\\r\\n        address _data\\r\\n    ) internal {\\r\\n        self.addressData[getKey(_id, _key)] = _data;\\r\\n    }\\r\\n}\\r\\n\",\"keccak256\":\"0xb2fd773eb25be37401395117ee336c638bb83594297fa2300dfa7defa35bad49\",\"license\":\"MIT\"},\"contracts/Portal/utils/GeodeUtilsLib.sol\":{\"content\":\"// SPDX-License-Identifier: MIT\\r\\npragma solidity =0.8.7;\\r\\n\\r\\nimport \\\"./DataStoreUtilsLib.sol\\\";\\r\\n\\r\\n/**\\r\\n * @author Icebear & Crash Bandicoot\\r\\n * @title GeodeUtils library\\r\\n * @notice Exclusively contains functions responsible for administration of DATASTORE,\\r\\n * including functions related to \\\"limited upgradability\\\" with Senate & Proposals.\\r\\n * @dev Contracts relying on this library must initialize GeodeUtils.Universe\\r\\n * @dev ALL \\\"fee\\\" variables are limited by PERCENTAGE_DENOMINATOR = 100%\\r\\n * @dev Admin functions are already protected\\r\\n * Note this library contains both functions called by users(ID) (approveSenate) and admins(GOVERNANCE, SENATE)\\r\\n * Note refer to DataStoreUtils before reviewing\\r\\n */\\r\\nlibrary GeodeUtils {\\r\\n    using DataStoreUtils for DataStoreUtils.DataStore;\\r\\n\\r\\n    event GovernanceTaxUpdated(uint256 newFee);\\r\\n    event MaxGovernanceTaxUpdated(uint256 newMaxFee);\\r\\n    event ControllerChanged(uint256 id, address newCONTROLLER);\\r\\n    event Proposed(\\r\\n        uint256 id,\\r\\n        address CONTROLLER,\\r\\n        uint256 TYPE,\\r\\n        uint256 deadline\\r\\n    );\\r\\n    event ProposalApproved(uint256 id);\\r\\n    event ElectorTypeSet(uint256 TYPE, bool isElector);\\r\\n    event Vote(uint256 proposalId, uint256 electorId);\\r\\n    event NewSenate(address senate, uint256 senateExpiry);\\r\\n\\r\\n    /**\\r\\n     * @notice Proposal basically refers to give the control of an ID to a CONTROLLER.\\r\\n     *\\r\\n     * @notice A Proposal has 4 specs:\\r\\n     * @param TYPE: separates the proposals and related functionality between different ID types.\\r\\n     * * RESERVED TYPES on GeodeUtils:\\r\\n     * * * TYPE 0: inactive\\r\\n     * * * TYPE 1: Senate: controls state of governance, contract updates and other members of A Universe\\r\\n     * * * TYPE 2: Upgrade: address of the implementation for desired contract upgrade\\r\\n     * * * TYPE 3: **gap** : formally it represented the admin contract, however since UUPS is being used as a upgrade path,\\r\\n     * this TYPE is now reserved.\\r\\n     *\\r\\n     * @param name: id is created by keccak(name, type)\\r\\n     *\\r\\n     * @param CONTROLLER: the address that refers to the change that is proposed by given proposal ID.\\r\\n     * * This slot can refer to the controller of an id, a new implementation contract, a new Senate etc.\\r\\n     *\\r\\n     * @param deadline: refers to last timestamp until a proposal expires, limited by MAX_PROPOSAL_DURATION\\r\\n     * * Expired proposals can not be approved by Senate\\r\\n     * * Expired proposals can not be overriden by new proposals\\r\\n     **/\\r\\n    struct Proposal {\\r\\n        address CONTROLLER;\\r\\n        uint256 TYPE;\\r\\n        bytes NAME;\\r\\n        uint256 deadline;\\r\\n    }\\r\\n\\r\\n    /**\\r\\n     * @notice Universe is A blockchain. In this case, it defines Ethereum\\r\\n     * @param GOVERNANCE a community that works to improve the core product and ensures its adoption in the DeFi ecosystem\\r\\n     * Suggests updates, such as new planets, operators, comets, contract upgrades and new Senate, on the Ecosystem -without any permission to force them-\\r\\n     * @param SENATE An address that controls the state of governance, updates and other users in the Geode Ecosystem\\r\\n     * Note SENATE is proposed by Governance and voted by all elector types, operates if \\u230a2/3\\u230b approves.\\r\\n     * @param GOVERNANCE_TAX operation fee of the given contract, acquired by GOVERNANCE. Limited by MAX_GOVERNANCE_TAX\\r\\n     * @param MAX_GOVERNANCE_TAX set by SENATE, limited by PERCENTAGE_DENOMINATOR\\r\\n     * @param SENATE_EXPIRY refers to the last timestamp that SENATE can continue operating. Enforces a new election, limited by MAX_SENATE_PERIOD\\r\\n     * @param approvedUpgrade only 1 implementation contract can be \\\"approved\\\" at any given time. @dev safe to set to address(0) after every upgrade\\r\\n     * @param _electorCount increased when a new id is added with _electorTypes[id] == true\\r\\n     * @param _electorTypes only given types can vote @dev MUST only change during upgrades.\\r\\n     * @param _proposalForId proposals are kept seperately instead of setting the parameters of id in DATASTORE, and then setting it's type; to allow surpassing type checks to save gas cost\\r\\n     **/\\r\\n    struct Universe {\\r\\n        address SENATE;\\r\\n        address GOVERNANCE;\\r\\n        uint256 GOVERNANCE_TAX;\\r\\n        uint256 MAX_GOVERNANCE_TAX;\\r\\n        uint256 SENATE_EXPIRY;\\r\\n        address approvedUpgrade;\\r\\n        uint256 _electorCount;\\r\\n        mapping(uint256 => bool) _electorTypes;\\r\\n        mapping(uint256 => Proposal) _proposalForId;\\r\\n        uint256[7] __gap;\\r\\n    }\\r\\n\\r\\n    /// @notice PERCENTAGE_DENOMINATOR represents 100%\\r\\n    uint256 public constant PERCENTAGE_DENOMINATOR = 10**10;\\r\\n\\r\\n    uint32 public constant MIN_PROPOSAL_DURATION = 1 days;\\r\\n    uint32 public constant MAX_PROPOSAL_DURATION = 2 weeks;\\r\\n    uint32 public constant MAX_SENATE_PERIOD = 365 days; // 1 year\\r\\n\\r\\n    modifier onlySenate(Universe storage self) {\\r\\n        require(msg.sender == self.SENATE, \\\"GeodeUtils: SENATE role needed\\\");\\r\\n        require(\\r\\n            block.timestamp < self.SENATE_EXPIRY,\\r\\n            \\\"GeodeUtils: SENATE not active\\\"\\r\\n        );\\r\\n        _;\\r\\n    }\\r\\n\\r\\n    modifier onlyGovernance(Universe storage self) {\\r\\n        require(\\r\\n            msg.sender == self.GOVERNANCE,\\r\\n            \\\"GeodeUtils: GOVERNANCE role needed\\\"\\r\\n        );\\r\\n        _;\\r\\n    }\\r\\n\\r\\n    modifier onlyController(\\r\\n        DataStoreUtils.DataStore storage DATASTORE,\\r\\n        uint256 id\\r\\n    ) {\\r\\n        require(\\r\\n            msg.sender == DATASTORE.readAddressForId(id, \\\"CONTROLLER\\\"),\\r\\n            \\\"GeodeUtils: CONTROLLER role needed\\\"\\r\\n        );\\r\\n        _;\\r\\n    }\\r\\n\\r\\n    /**\\r\\n     *                                         ** UNIVERSE GETTERS **\\r\\n     **/\\r\\n\\r\\n    /**\\r\\n     * @return address of SENATE\\r\\n     **/\\r\\n    function getSenate(Universe storage self) external view returns (address) {\\r\\n        return self.SENATE;\\r\\n    }\\r\\n\\r\\n    /**\\r\\n     * @return address of GOVERNANCE\\r\\n     **/\\r\\n    function getGovernance(Universe storage self)\\r\\n        external\\r\\n        view\\r\\n        returns (address)\\r\\n    {\\r\\n        return self.GOVERNANCE;\\r\\n    }\\r\\n\\r\\n    /**\\r\\n     * @notice MAX_GOVERNANCE_TAX must limit GOVERNANCE_TAX even if MAX is changed\\r\\n     * @return active GOVERNANCE_TAX, limited by MAX_GOVERNANCE_TAX\\r\\n     */\\r\\n    function getGovernanceTax(Universe storage self)\\r\\n        external\\r\\n        view\\r\\n        returns (uint256)\\r\\n    {\\r\\n        return self.GOVERNANCE_TAX;\\r\\n    }\\r\\n\\r\\n    /**\\r\\n     *  @return MAX_GOVERNANCE_TAX\\r\\n     */\\r\\n    function getMaxGovernanceTax(Universe storage self)\\r\\n        external\\r\\n        view\\r\\n        returns (uint256)\\r\\n    {\\r\\n        return self.MAX_GOVERNANCE_TAX;\\r\\n    }\\r\\n\\r\\n    /**\\r\\n     * @return the expiration date of current SENATE as a timestamp\\r\\n     */\\r\\n    function getSenateExpiry(Universe storage self)\\r\\n        external\\r\\n        view\\r\\n        returns (uint256)\\r\\n    {\\r\\n        return self.SENATE_EXPIRY;\\r\\n    }\\r\\n\\r\\n    /**\\r\\n     *                                         ** UNIVERSE SETTERS **\\r\\n     */\\r\\n\\r\\n    /**\\r\\n     * @dev can not set the fee more than MAX_GOVERNANCE_TAX\\r\\n     * @dev no need to check PERCENTAGE_DENOMINATOR because MAX_GOVERNANCE_TAX is limited already\\r\\n     * @return true if the operation was succesful, might be helpful when governance rights are distributed\\r\\n     */\\r\\n    function setGovernanceTax(Universe storage self, uint256 newFee)\\r\\n        external\\r\\n        onlyGovernance(self)\\r\\n        returns (bool)\\r\\n    {\\r\\n        require(\\r\\n            newFee <= self.MAX_GOVERNANCE_TAX,\\r\\n            \\\"GeodeUtils: cannot be more than MAX_GOVERNANCE_TAX\\\"\\r\\n        );\\r\\n\\r\\n        self.GOVERNANCE_TAX = newFee;\\r\\n\\r\\n        emit GovernanceTaxUpdated(newFee);\\r\\n\\r\\n        return true;\\r\\n    }\\r\\n\\r\\n    /**\\r\\n     * @dev can not set a fee more than PERCENTAGE_DENOMINATOR (100%)\\r\\n     * @return true if the operation was succesful\\r\\n     */\\r\\n    function setMaxGovernanceTax(Universe storage self, uint256 newMaxFee)\\r\\n        external\\r\\n        onlySenate(self)\\r\\n        returns (bool)\\r\\n    {\\r\\n        require(\\r\\n            newMaxFee <= PERCENTAGE_DENOMINATOR,\\r\\n            \\\"GeodeUtils: fee more than 100%\\\"\\r\\n        );\\r\\n\\r\\n        self.MAX_GOVERNANCE_TAX = newMaxFee;\\r\\n\\r\\n        emit MaxGovernanceTaxUpdated(newMaxFee);\\r\\n\\r\\n        return true;\\r\\n    }\\r\\n\\r\\n    /**\\r\\n     *                                          ** ID **\\r\\n     */\\r\\n\\r\\n    /**\\r\\n     * @dev Some TYPEs may require permissionless creation. But to allow anyone to claim any ID,\\r\\n     * meaning malicious actors can claim names and operate pools to mislead people. To prevent this\\r\\n     * TYPEs will be considered during id generation.\\r\\n     */\\r\\n    function _generateId(bytes calldata _NAME, uint256 _TYPE)\\r\\n        internal\\r\\n        pure\\r\\n        returns (uint256)\\r\\n    {\\r\\n        return uint256(keccak256(abi.encodePacked(_NAME, _TYPE)));\\r\\n    }\\r\\n\\r\\n    /**\\r\\n     * @dev returns address(0) for empty ids, mandatory\\r\\n     */\\r\\n    function getCONTROLLERFromId(\\r\\n        DataStoreUtils.DataStore storage DATASTORE,\\r\\n        uint256 id\\r\\n    ) external view returns (address) {\\r\\n        return DATASTORE.readAddressForId(id, \\\"CONTROLLER\\\");\\r\\n    }\\r\\n\\r\\n    /**\\r\\n     * @dev returns uint(0) for empty ids, mandatory\\r\\n     */\\r\\n    function getTYPEFromId(\\r\\n        DataStoreUtils.DataStore storage DATASTORE,\\r\\n        uint256 id\\r\\n    ) external view returns (uint256) {\\r\\n        return DATASTORE.readUintForId(id, \\\"TYPE\\\");\\r\\n    }\\r\\n\\r\\n    /**\\r\\n     * @dev returns bytes(0) for empty ids, mandatory\\r\\n     */\\r\\n    function getNAMEFromId(\\r\\n        DataStoreUtils.DataStore storage DATASTORE,\\r\\n        uint256 id\\r\\n    ) external view returns (bytes memory) {\\r\\n        return DATASTORE.readBytesForId(id, \\\"NAME\\\");\\r\\n    }\\r\\n\\r\\n    /**\\r\\n     * @notice only the current CONTROLLER can change\\r\\n     * @dev this operation can not be reverted by the old CONTROLLER\\r\\n     * @dev in case the current controller wants to remove the\\r\\n     * need to upgrade to Controller they should provide smt like 0x000000000000000000000000000000000000dEaD\\r\\n     */\\r\\n    function changeIdCONTROLLER(\\r\\n        DataStoreUtils.DataStore storage DATASTORE,\\r\\n        uint256 id,\\r\\n        address newCONTROLLER\\r\\n    ) external onlyController(DATASTORE, id) {\\r\\n        require(\\r\\n            newCONTROLLER != address(0),\\r\\n            \\\"GeodeUtils: CONTROLLER can not be zero\\\"\\r\\n        );\\r\\n\\r\\n        DATASTORE.writeAddressForId(id, \\\"CONTROLLER\\\", newCONTROLLER);\\r\\n\\r\\n        emit ControllerChanged(id, newCONTROLLER);\\r\\n    }\\r\\n\\r\\n    /**\\r\\n     *                                          ** PROPOSALS **\\r\\n     */\\r\\n\\r\\n    /**\\r\\n     * CONTROLLER Proposals\\r\\n     */\\r\\n\\r\\n    function getProposal(Universe storage self, uint256 id)\\r\\n        external\\r\\n        view\\r\\n        returns (Proposal memory)\\r\\n    {\\r\\n        return self._proposalForId[id];\\r\\n    }\\r\\n\\r\\n    /**\\r\\n     * @notice a proposal can never be overriden.\\r\\n     * @notice DATASTORE(id) will not be updated until the proposal is approved.\\r\\n     * @dev refer to structure of Proposal for explanations of params\\r\\n     */\\r\\n    function newProposal(\\r\\n        Universe storage self,\\r\\n        address _CONTROLLER,\\r\\n        uint256 _TYPE,\\r\\n        bytes calldata _NAME,\\r\\n        uint256 duration\\r\\n    ) external returns (uint256 id) {\\r\\n        require(\\r\\n            duration >= MIN_PROPOSAL_DURATION,\\r\\n            \\\"GeodeUtils: duration should be higher than MIN_PROPOSAL_DURATION\\\"\\r\\n        );\\r\\n        require(\\r\\n            duration <= MAX_PROPOSAL_DURATION,\\r\\n            \\\"GeodeUtils: duration exceeds MAX_PROPOSAL_DURATION\\\"\\r\\n        );\\r\\n\\r\\n        id = _generateId(_NAME, _TYPE);\\r\\n\\r\\n        require(\\r\\n            self._proposalForId[id].deadline == 0,\\r\\n            \\\"GeodeUtils: NAME already proposed\\\"\\r\\n        );\\r\\n\\r\\n        self._proposalForId[id] = Proposal({\\r\\n            CONTROLLER: _CONTROLLER,\\r\\n            TYPE: _TYPE,\\r\\n            NAME: _NAME,\\r\\n            deadline: block.timestamp + duration\\r\\n        });\\r\\n\\r\\n        emit Proposed(id, _CONTROLLER, _TYPE, block.timestamp + duration);\\r\\n    }\\r\\n\\r\\n    /**\\r\\n     *  @notice type specific changes for reserved_types(1,2,3) are implemented here,\\r\\n     *  any other addition should take place in Portal, as not related\\r\\n     *  @param id given ID proposal that has been approved by Senate\\r\\n     *  @dev Senate should not be able to approve approved proposals\\r\\n     *  @dev Senate should not be able to approve expired proposals\\r\\n     *  @dev Senate should not be able to approve SENATE proposals :)\\r\\n     */\\r\\n    function approveProposal(\\r\\n        Universe storage self,\\r\\n        DataStoreUtils.DataStore storage DATASTORE,\\r\\n        uint256 id\\r\\n    ) external onlySenate(self) {\\r\\n        require(\\r\\n            self._proposalForId[id].deadline > block.timestamp,\\r\\n            \\\"GeodeUtils: proposal expired\\\"\\r\\n        );\\r\\n        require(\\r\\n            self._proposalForId[id].TYPE != 1,\\r\\n            \\\"GeodeUtils: Senate can not approve Senate Election\\\"\\r\\n        );\\r\\n\\r\\n        DATASTORE.writeAddressForId(\\r\\n            id,\\r\\n            \\\"CONTROLLER\\\",\\r\\n            self._proposalForId[id].CONTROLLER\\r\\n        );\\r\\n        DATASTORE.writeUintForId(id, \\\"TYPE\\\", self._proposalForId[id].TYPE);\\r\\n        DATASTORE.writeBytesForId(id, \\\"NAME\\\", self._proposalForId[id].NAME);\\r\\n\\r\\n        if (self._proposalForId[id].TYPE == 2) {\\r\\n            self.approvedUpgrade = self._proposalForId[id].CONTROLLER;\\r\\n        }\\r\\n\\r\\n        if (self._electorTypes[DATASTORE.readUintForId(id, \\\"TYPE\\\")]) {\\r\\n            self._electorCount += 1;\\r\\n        }\\r\\n\\r\\n        DATASTORE.allIdsByType[self._proposalForId[id].TYPE].push(id);\\r\\n        self._proposalForId[id].deadline = block.timestamp;\\r\\n\\r\\n        emit ProposalApproved(id);\\r\\n    }\\r\\n\\r\\n    /**\\r\\n     * SENATE Proposals\\r\\n     */\\r\\n\\r\\n    /**\\r\\n     * @notice only elector types can vote for senate\\r\\n     * @param _TYPE selected type\\r\\n     * @param isElector true if selected _type can vote for senate from now on\\r\\n     * @dev can not set with the same value again, preventing double increment/decrements\\r\\n     */\\r\\n    function setElectorType(\\r\\n        Universe storage self,\\r\\n        DataStoreUtils.DataStore storage DATASTORE,\\r\\n        uint256 _TYPE,\\r\\n        bool isElector\\r\\n    ) external onlyGovernance(self) {\\r\\n        require(\\r\\n            self._electorTypes[_TYPE] != isElector,\\r\\n            \\\"GeodeUtils: type already _isElector\\\"\\r\\n        );\\r\\n        require(\\r\\n            _TYPE != 0 && _TYPE != 1 && _TYPE != 2 && _TYPE != 3,\\r\\n            \\\"GeodeUtils: 0, Senate, Upgrade cannot be elector\\\"\\r\\n        );\\r\\n\\r\\n        self._electorTypes[_TYPE] = isElector;\\r\\n\\r\\n        if (isElector) {\\r\\n            self._electorCount += DATASTORE.allIdsByType[_TYPE].length;\\r\\n        } else {\\r\\n            self._electorCount -= DATASTORE.allIdsByType[_TYPE].length;\\r\\n        }\\r\\n\\r\\n        emit ElectorTypeSet(_TYPE, isElector);\\r\\n    }\\r\\n\\r\\n    /**\\r\\n     * @notice Proposed CONTROLLER is the new Senate after 2/3 of the electors approved\\r\\n     * NOTE mathematically, min 4 elector is needed for (c+1)*2/3 to work properly\\r\\n     * @notice id can not vote if:\\r\\n     * - approved already\\r\\n     * - proposal is expired\\r\\n     * - not its type is elector\\r\\n     * - not senate proposal\\r\\n     * @param electorId should have the voting rights, msg.sender should be the CONTROLLER of given ID\\r\\n     * @dev pins id as \\\"voted\\\" when approved\\r\\n     * @dev increases \\\"approvalCount\\\" of proposalId by 1 when approved\\r\\n     */\\r\\n    function approveSenate(\\r\\n        Universe storage self,\\r\\n        DataStoreUtils.DataStore storage DATASTORE,\\r\\n        uint256 proposalId,\\r\\n        uint256 electorId\\r\\n    ) external onlyController(DATASTORE, electorId) {\\r\\n        require(\\r\\n            self._proposalForId[proposalId].TYPE == 1,\\r\\n            \\\"GeodeUtils: NOT Senate Proposal\\\"\\r\\n        );\\r\\n        require(\\r\\n            self._proposalForId[proposalId].deadline >= block.timestamp,\\r\\n            \\\"GeodeUtils: proposal expired\\\"\\r\\n        );\\r\\n        require(\\r\\n            self._electorTypes[DATASTORE.readUintForId(electorId, \\\"TYPE\\\")],\\r\\n            \\\"GeodeUtils: NOT an elector\\\"\\r\\n        );\\r\\n        require(\\r\\n            DATASTORE.readUintForId(\\r\\n                proposalId,\\r\\n                DataStoreUtils.getKey(electorId, \\\"voted\\\")\\r\\n            ) == 0,\\r\\n            \\\" GeodeUtils: already approved\\\"\\r\\n        );\\r\\n\\r\\n        DATASTORE.writeUintForId(\\r\\n            proposalId,\\r\\n            DataStoreUtils.getKey(electorId, \\\"voted\\\"),\\r\\n            1\\r\\n        );\\r\\n        DATASTORE.addUintForId(proposalId, \\\"approvalCount\\\", 1);\\r\\n\\r\\n        if (\\r\\n            DATASTORE.readUintForId(proposalId, \\\"approvalCount\\\") >=\\r\\n            ((self._electorCount + 1) * 2) / 3\\r\\n        ) {\\r\\n            self._proposalForId[proposalId].deadline = block.timestamp;\\r\\n            _setSenate(\\r\\n                self,\\r\\n                self._proposalForId[proposalId].CONTROLLER,\\r\\n                MAX_SENATE_PERIOD\\r\\n            );\\r\\n        }\\r\\n\\r\\n        emit Vote(proposalId, electorId);\\r\\n    }\\r\\n\\r\\n    function _setSenate(\\r\\n        Universe storage self,\\r\\n        address _newSenate,\\r\\n        uint256 _senatePeriod\\r\\n    ) internal {\\r\\n        self.SENATE = _newSenate;\\r\\n        self.SENATE_EXPIRY = block.timestamp + _senatePeriod;\\r\\n\\r\\n        emit NewSenate(self.SENATE, self.SENATE_EXPIRY);\\r\\n    }\\r\\n\\r\\n    /**\\r\\n     * @notice Get if it is allowed to change a specific contract with the current version.\\r\\n     * @return True if it is allowed by senate and false if not.\\r\\n     * @dev address(0) should return false\\r\\n     * @dev DO NOT TOUCH, EVER! WHATEVER YOU DEVELOP IN FUCKING 3022\\r\\n     **/\\r\\n    function isUpgradeAllowed(\\r\\n        Universe storage self,\\r\\n        address proposedImplementation\\r\\n    ) external view returns (bool) {\\r\\n        return\\r\\n            self.approvedUpgrade != address(0) &&\\r\\n            self.approvedUpgrade == proposedImplementation;\\r\\n    }\\r\\n}\\r\\n\",\"keccak256\":\"0x3f8d64ba8ba724d8076701f674b231fab74ba313c5b4e74b6450cd8546e7ad33\",\"license\":\"MIT\"}},\"version\":1}",
  "bytecode": "0x611b0f61003a600b82828239805160001a60731461002d57634e487b7160e01b600052600060045260246000fd5b30600052607381538281f3fe73000000000000000000000000000000000000000030146080604052600436106101415760003560e01c8063777b3f59116100c2578063b3cd425411610086578063b3cd42541461030d578063bd96821614610319578063c5de22ae14610323578063d115f19514610336578063d6f31cd814610356578063f00d779d1461037657600080fd5b8063777b3f59146102995780639067ce36146102b9578063944ee22d146102ce578063b09d91a9146102ed578063b21f21881461030257600080fd5b80631558c9b5116101095780631558c9b5146101fb5780633680b4071461022b5780634b61f9fe1461023e5780634e9130821461025e5780635fff75171461027957600080fd5b806305d6a78e14610146578063099745ae1461016e5780630bf249b81461018e5780630d1127cf146101b0578063105835b0146101db575b600080fd5b61015b61015436600461174c565b6003015490565b6040519081526020015b60405180910390f35b81801561017a57600080fd5b5061015b610189366004611791565b610394565b81801561019a57600080fd5b506101ae6101a9366004611717565b610625565b005b6101c36101be3660046116f5565b610736565b6040516001600160a01b039091168152602001610165565b8180156101e757600080fd5b506101ae6101f636600461185c565b610757565b81801561020757600080fd5b5061021b6102163660046116f5565b61093c565b6040519015158152602001610165565b61021b610239366004611765565b610a87565b81801561024a57600080fd5b506101ae610259366004611830565b610aba565b6101c361026c36600461174c565b546001600160a01b031690565b81801561028557600080fd5b506101ae6102943660046118a2565b610e79565b8180156102a557600080fd5b5061021b6102b43660046116f5565b611162565b61015b6102c736600461174c565b6002015490565b6102d86201518081565b60405163ffffffff9091168152602001610165565b61015b6102fb36600461174c565b6004015490565b6102d86301e1338081565b61015b6402540be40081565b6102d86212750081565b61015b6103313660046116f5565b611239565b6103496103443660046116f5565b61124d565b60405161016591906119ca565b6103696103643660046116f5565b611361565b6040516101659190611933565b6101c361038436600461174c565b600101546001600160a01b031690565b600062015180821015610416576040805162461bcd60e51b81526020600482015260248101919091527f47656f64655574696c733a206475726174696f6e2073686f756c64206265206860448201527f6967686572207468616e204d494e5f50524f504f53414c5f4455524154494f4e60648201526084015b60405180910390fd5b621275008211156104845760405162461bcd60e51b815260206004820152603260248201527f47656f64655574696c733a206475726174696f6e2065786365656473204d41586044820152712fa82927a827a9a0a62fa22aa920aa24a7a760711b606482015260840161040d565b61048f848487611375565b6000818152600889016020526040902060030154909150156104fd5760405162461bcd60e51b815260206004820152602160248201527f47656f64655574696c733a204e414d4520616c72656164792070726f706f73656044820152601960fa1b606482015260840161040d565b6040518060800160405280876001600160a01b0316815260200186815260200185858080601f0160208091040260200160405190810160405280939291908181526020018383808284376000920191909152505050908252506020016105638442611a18565b90526000828152600889016020908152604091829020835181546001600160a01b0319166001600160a01b039091161781558382015160018201559183015180516105b49260028501920190611640565b50606091909101516003909101557fb56e333cd6082a862942820ad6871b5a17d922a7506ff536fc0830784a46b2c68187876105f08642611a18565b604080519485526001600160a01b03909316602085015291830152606082015260800160405180910390a19695505050505050565b828261063f82826921a7a72a2927a62622a960b11b6113ac565b6001600160a01b0316336001600160a01b03161461066f5760405162461bcd60e51b815260040161040d90611988565b6001600160a01b0383166106d45760405162461bcd60e51b815260206004820152602660248201527f47656f64655574696c733a20434f4e54524f4c4c45522063616e206e6f74206260448201526565207a65726f60d01b606482015260840161040d565b6106ed85856921a7a72a2927a62622a960b11b866113e0565b604080518581526001600160a01b03851660208201527ff0d0c255199b45799d6fd3623dce5e99a7cb09d662754eff92d8d0e73a537f0a91015b60405180910390a15050505050565b600061075083836921a7a72a2927a62622a960b11b6113ac565b9392505050565b600184015484906001600160a01b031633146107855760405162461bcd60e51b815260040161040d90611946565b600083815260078601602052604090205460ff16151582151514156107f85760405162461bcd60e51b815260206004820152602360248201527f47656f64655574696c733a207479706520616c7265616479205f6973456c65636044820152623a37b960e91b606482015260840161040d565b8215801590610808575082600114155b8015610815575082600214155b8015610822575082600314155b6108875760405162461bcd60e51b815260206004820152603060248201527f47656f64655574696c733a20302c2053656e6174652c2055706772616465206360448201526f30b73737ba1031329032b632b1ba37b960811b606482015260840161040d565b60008381526007860160205260409020805460ff191683158015919091179091556108db57600083815260208590526040812054600687018054919290916108d0908490611a18565b909155506109059050565b600083815260208590526040812054600687018054919290916108ff908490611a71565b90915550505b6040805184815283151560208201527fd30c2f5058959ec9e0f8b4a5f4f92d0d293345e5bfe4947ba7063ae6e7590c819101610727565b815460009083906001600160a01b0316331461099a5760405162461bcd60e51b815260206004820152601e60248201527f47656f64655574696c733a2053454e41544520726f6c65206e65656465640000604482015260640161040d565b806004015442106109ed5760405162461bcd60e51b815260206004820152601d60248201527f47656f64655574696c733a2053454e415445206e6f7420616374697665000000604482015260640161040d565b6402540be400831115610a425760405162461bcd60e51b815260206004820152601e60248201527f47656f64655574696c733a20666565206d6f7265207468616e20313030250000604482015260640161040d565b600384018390556040518381527f53afe95a28ad28745e8ef391d676d643557ef1485a6b2fc3d7244c09922ad0ff906020015b60405180910390a15060019392505050565b60058201546000906001600160a01b031615801590610750575050600591909101546001600160a01b0391821691161490565b825483906001600160a01b03163314610b155760405162461bcd60e51b815260206004820152601e60248201527f47656f64655574696c733a2053454e41544520726f6c65206e65656465640000604482015260640161040d565b80600401544210610b685760405162461bcd60e51b815260206004820152601d60248201527f47656f64655574696c733a2053454e415445206e6f7420616374697665000000604482015260640161040d565b60008281526008850160205260409020600301544210610bca5760405162461bcd60e51b815260206004820152601c60248201527f47656f64655574696c733a2070726f706f73616c206578706972656400000000604482015260640161040d565b600082815260088501602052604090206001908101541415610c495760405162461bcd60e51b815260206004820152603260248201527f47656f64655574696c733a2053656e6174652063616e206e6f7420617070726f6044820152713b329029b2b730ba329022b632b1ba34b7b760711b606482015260840161040d565b6000828152600885016020526040902054610c7f90849084906921a7a72a2927a62622a960b11b906001600160a01b03166113e0565b6000828152600885016020526040902060010154610ca99084908490635459504560e01b90611429565b610d6782634e414d4560e01b8660080160008681526020019081526020016000206002018054610cd890611a88565b80601f0160208091040260200160405190810160405280929190818152602001828054610d0490611a88565b8015610d515780601f10610d2657610100808354040283529160200191610d51565b820191906000526020600020905b815481529060010190602001808311610d3457829003601f168201915b505050505086611451909392919063ffffffff16565b600082815260088501602052604090206001015460021415610db65760008281526008850160205260409020546005850180546001600160a01b0319166001600160a01b039092169190911790555b600784016000610dce8585635459504560e01b61148a565b815260208101919091526040016000205460ff1615610e02576001846006016000828254610dfc9190611a18565b90915550505b600082815260088501602081815260408084206001808201548652888452828620805491820181558652838620018790559386905291815242600390930192909255518381527f28ec9e38ba73636ceb2f6c1574136f83bd46284a3c74734b711bf45e12f8d929910160405180910390a150505050565b8281610e9382826921a7a72a2927a62622a960b11b6113ac565b6001600160a01b0316336001600160a01b031614610ec35760405162461bcd60e51b815260040161040d90611988565b6000848152600887016020526040902060019081015414610f265760405162461bcd60e51b815260206004820152601f60248201527f47656f64655574696c733a204e4f542053656e6174652050726f706f73616c00604482015260640161040d565b6000848152600887016020526040902060030154421115610f895760405162461bcd60e51b815260206004820152601c60248201527f47656f64655574696c733a2070726f706f73616c206578706972656400000000604482015260640161040d565b600786016000610fa18786635459504560e01b61148a565b815260208101919091526040016000205460ff166110015760405162461bcd60e51b815260206004820152601a60248201527f47656f64655574696c733a204e4f5420616e20656c6563746f72000000000000604482015260640161040d565b61101f8461101785641d9bdd195960da1b6114b4565b87919061148a565b1561106c5760405162461bcd60e51b815260206004820152601d60248201527f2047656f64655574696c733a20616c726561647920617070726f766564000000604482015260640161040d565b61108c8461108285641d9bdd195960da1b6114b4565b8791906001611429565b6110a985856c185c1c1c9bdd985b10dbdd5b9d609a1b60016114e0565b6003866006015460016110bc9190611a18565b6110c7906002611a52565b6110d19190611a30565b6110ec86866c185c1c1c9bdd985b10dbdd5b9d609a1b61148a565b106111215760008481526008870160205260409020426003820155546111219087906001600160a01b03166301e13380611519565b60408051858152602081018590527f33952ef907843fd2ddd118a92dd935debf65b72965a557a364ea08deffca032f910160405180910390a1505050505050565b600182015460009083906001600160a01b031633146111935760405162461bcd60e51b815260040161040d90611946565b83600301548311156112025760405162461bcd60e51b815260206004820152603260248201527f47656f64655574696c733a2063616e6e6f74206265206d6f7265207468616e2060448201527109a82b0be8e9eac8aa49c829c868abea882b60731b606482015260840161040d565b600284018390556040518381527fde0a23c11264740c0d09fcd02c04cbbff396aafcb2e8eb7ab7b3906fe656b4a290602001610a75565b60006107508383635459504560e01b61148a565b611281604051806080016040528060006001600160a01b031681526020016000815260200160608152602001600081525090565b6000828152600884016020908152604091829020825160808101845281546001600160a01b0316815260018201549281019290925260028101805492939192918401916112cd90611a88565b80601f01602080910402602001604051908101604052809291908181526020018280546112f990611a88565b80156113465780601f1061131b57610100808354040283529160200191611346565b820191906000526020600020905b81548152906001019060200180831161132957829003601f168201915b50505050508152602001600382015481525050905092915050565b60606107508383634e414d4560e01b61158e565b600083838360405160200161138c93929190611921565b60408051601f198184030181529190528051602090910120949350505050565b60008360030160006113be85856114b4565b81526020810191909152604001600020546001600160a01b0316949350505050565b808460030160006113f186866114b4565b815260200190815260200160002060006101000a8154816001600160a01b0302191690836001600160a01b0316021790555050505050565b8084600101600061143a86866114b4565b815260208101919091526040016000205550505050565b8084600201600061146286866114b4565b81526020019081526020016000209080519060200190611483929190611640565b5050505050565b600083600101600061149c85856114b4565b81526020019081526020016000205490509392505050565b604080516020808201949094528082019290925280518083038201815260609092019052805191012090565b808460010160006114f186866114b4565b8152602001908152602001600020600082825461150e9190611a18565b909155505050505050565b82546001600160a01b0319166001600160a01b03831617835561153c8142611a18565b600484018190558354604080516001600160a01b03909216825260208201929092527f3f34afe456fb5b36c04b5d1e2ef0750086747ac542262fbf14a0b1aae5fd7ee8910160405180910390a1505050565b60608360020160006115a085856114b4565b815260200190815260200160002080546115b990611a88565b80601f01602080910402602001604051908101604052809291908181526020018280546115e590611a88565b80156116325780601f1061160757610100808354040283529160200191611632565b820191906000526020600020905b81548152906001019060200180831161161557829003601f168201915b505050505090509392505050565b82805461164c90611a88565b90600052602060002090601f01602090048101928261166e57600085556116b4565b82601f1061168757805160ff19168380011785556116b4565b828001600101855582156116b4579182015b828111156116b4578251825591602001919060010190611699565b506116c09291506116c4565b5090565b5b808211156116c057600081556001016116c5565b80356001600160a01b03811681146116f057600080fd5b919050565b6000806040838503121561170857600080fd5b50508035926020909101359150565b60008060006060848603121561172c57600080fd5b8335925060208401359150611743604085016116d9565b90509250925092565b60006020828403121561175e57600080fd5b5035919050565b6000806040838503121561177857600080fd5b82359150611788602084016116d9565b90509250929050565b60008060008060008060a087890312156117aa57600080fd5b863595506117ba602088016116d9565b945060408701359350606087013567ffffffffffffffff808211156117de57600080fd5b818901915089601f8301126117f257600080fd5b81358181111561180157600080fd5b8a602082850101111561181357600080fd5b602083019550809450505050608087013590509295509295509295565b60008060006060848603121561184557600080fd5b505081359360208301359350604090920135919050565b6000806000806080858703121561187257600080fd5b8435935060208501359250604085013591506060850135801515811461189757600080fd5b939692955090935050565b600080600080608085870312156118b857600080fd5b5050823594602084013594506040840135936060013592509050565b6000815180845260005b818110156118fa576020818501810151868301820152016118de565b8181111561190c576000602083870101525b50601f01601f19169290920160200192915050565b82848237909101908152602001919050565b60208152600061075060208301846118d4565b60208082526022908201527f47656f64655574696c733a20474f5645524e414e434520726f6c65206e656564604082015261195960f21b606082015260800190565b60208082526022908201527f47656f64655574696c733a20434f4e54524f4c4c455220726f6c65206e656564604082015261195960f21b606082015260800190565b6020815260018060a01b038251166020820152602082015160408201526000604083015160806060840152611a0260a08401826118d4565b9050606084015160808401528091505092915050565b60008219821115611a2b57611a2b611ac3565b500190565b600082611a4d57634e487b7160e01b600052601260045260246000fd5b500490565b6000816000190483118215151615611a6c57611a6c611ac3565b500290565b600082821015611a8357611a83611ac3565b500390565b600181811c90821680611a9c57607f821691505b60208210811415611abd57634e487b7160e01b600052602260045260246000fd5b50919050565b634e487b7160e01b600052601160045260246000fdfea2646970667358221220bc520d6454dddddfc28a434ed8b4fb2aaa962c4efbf7039b1a5529d2008919ca64736f6c63430008070033",
  "deployedBytecode": "0x73000000000000000000000000000000000000000030146080604052600436106101415760003560e01c8063777b3f59116100c2578063b3cd425411610086578063b3cd42541461030d578063bd96821614610319578063c5de22ae14610323578063d115f19514610336578063d6f31cd814610356578063f00d779d1461037657600080fd5b8063777b3f59146102995780639067ce36146102b9578063944ee22d146102ce578063b09d91a9146102ed578063b21f21881461030257600080fd5b80631558c9b5116101095780631558c9b5146101fb5780633680b4071461022b5780634b61f9fe1461023e5780634e9130821461025e5780635fff75171461027957600080fd5b806305d6a78e14610146578063099745ae1461016e5780630bf249b81461018e5780630d1127cf146101b0578063105835b0146101db575b600080fd5b61015b61015436600461174c565b6003015490565b6040519081526020015b60405180910390f35b81801561017a57600080fd5b5061015b610189366004611791565b610394565b81801561019a57600080fd5b506101ae6101a9366004611717565b610625565b005b6101c36101be3660046116f5565b610736565b6040516001600160a01b039091168152602001610165565b8180156101e757600080fd5b506101ae6101f636600461185c565b610757565b81801561020757600080fd5b5061021b6102163660046116f5565b61093c565b6040519015158152602001610165565b61021b610239366004611765565b610a87565b81801561024a57600080fd5b506101ae610259366004611830565b610aba565b6101c361026c36600461174c565b546001600160a01b031690565b81801561028557600080fd5b506101ae6102943660046118a2565b610e79565b8180156102a557600080fd5b5061021b6102b43660046116f5565b611162565b61015b6102c736600461174c565b6002015490565b6102d86201518081565b60405163ffffffff9091168152602001610165565b61015b6102fb36600461174c565b6004015490565b6102d86301e1338081565b61015b6402540be40081565b6102d86212750081565b61015b6103313660046116f5565b611239565b6103496103443660046116f5565b61124d565b60405161016591906119ca565b6103696103643660046116f5565b611361565b6040516101659190611933565b6101c361038436600461174c565b600101546001600160a01b031690565b600062015180821015610416576040805162461bcd60e51b81526020600482015260248101919091527f47656f64655574696c733a206475726174696f6e2073686f756c64206265206860448201527f6967686572207468616e204d494e5f50524f504f53414c5f4455524154494f4e60648201526084015b60405180910390fd5b621275008211156104845760405162461bcd60e51b815260206004820152603260248201527f47656f64655574696c733a206475726174696f6e2065786365656473204d41586044820152712fa82927a827a9a0a62fa22aa920aa24a7a760711b606482015260840161040d565b61048f848487611375565b6000818152600889016020526040902060030154909150156104fd5760405162461bcd60e51b815260206004820152602160248201527f47656f64655574696c733a204e414d4520616c72656164792070726f706f73656044820152601960fa1b606482015260840161040d565b6040518060800160405280876001600160a01b0316815260200186815260200185858080601f0160208091040260200160405190810160405280939291908181526020018383808284376000920191909152505050908252506020016105638442611a18565b90526000828152600889016020908152604091829020835181546001600160a01b0319166001600160a01b039091161781558382015160018201559183015180516105b49260028501920190611640565b50606091909101516003909101557fb56e333cd6082a862942820ad6871b5a17d922a7506ff536fc0830784a46b2c68187876105f08642611a18565b604080519485526001600160a01b03909316602085015291830152606082015260800160405180910390a19695505050505050565b828261063f82826921a7a72a2927a62622a960b11b6113ac565b6001600160a01b0316336001600160a01b03161461066f5760405162461bcd60e51b815260040161040d90611988565b6001600160a01b0383166106d45760405162461bcd60e51b815260206004820152602660248201527f47656f64655574696c733a20434f4e54524f4c4c45522063616e206e6f74206260448201526565207a65726f60d01b606482015260840161040d565b6106ed85856921a7a72a2927a62622a960b11b866113e0565b604080518581526001600160a01b03851660208201527ff0d0c255199b45799d6fd3623dce5e99a7cb09d662754eff92d8d0e73a537f0a91015b60405180910390a15050505050565b600061075083836921a7a72a2927a62622a960b11b6113ac565b9392505050565b600184015484906001600160a01b031633146107855760405162461bcd60e51b815260040161040d90611946565b600083815260078601602052604090205460ff16151582151514156107f85760405162461bcd60e51b815260206004820152602360248201527f47656f64655574696c733a207479706520616c7265616479205f6973456c65636044820152623a37b960e91b606482015260840161040d565b8215801590610808575082600114155b8015610815575082600214155b8015610822575082600314155b6108875760405162461bcd60e51b815260206004820152603060248201527f47656f64655574696c733a20302c2053656e6174652c2055706772616465206360448201526f30b73737ba1031329032b632b1ba37b960811b606482015260840161040d565b60008381526007860160205260409020805460ff191683158015919091179091556108db57600083815260208590526040812054600687018054919290916108d0908490611a18565b909155506109059050565b600083815260208590526040812054600687018054919290916108ff908490611a71565b90915550505b6040805184815283151560208201527fd30c2f5058959ec9e0f8b4a5f4f92d0d293345e5bfe4947ba7063ae6e7590c819101610727565b815460009083906001600160a01b0316331461099a5760405162461bcd60e51b815260206004820152601e60248201527f47656f64655574696c733a2053454e41544520726f6c65206e65656465640000604482015260640161040d565b806004015442106109ed5760405162461bcd60e51b815260206004820152601d60248201527f47656f64655574696c733a2053454e415445206e6f7420616374697665000000604482015260640161040d565b6402540be400831115610a425760405162461bcd60e51b815260206004820152601e60248201527f47656f64655574696c733a20666565206d6f7265207468616e20313030250000604482015260640161040d565b600384018390556040518381527f53afe95a28ad28745e8ef391d676d643557ef1485a6b2fc3d7244c09922ad0ff906020015b60405180910390a15060019392505050565b60058201546000906001600160a01b031615801590610750575050600591909101546001600160a01b0391821691161490565b825483906001600160a01b03163314610b155760405162461bcd60e51b815260206004820152601e60248201527f47656f64655574696c733a2053454e41544520726f6c65206e65656465640000604482015260640161040d565b80600401544210610b685760405162461bcd60e51b815260206004820152601d60248201527f47656f64655574696c733a2053454e415445206e6f7420616374697665000000604482015260640161040d565b60008281526008850160205260409020600301544210610bca5760405162461bcd60e51b815260206004820152601c60248201527f47656f64655574696c733a2070726f706f73616c206578706972656400000000604482015260640161040d565b600082815260088501602052604090206001908101541415610c495760405162461bcd60e51b815260206004820152603260248201527f47656f64655574696c733a2053656e6174652063616e206e6f7420617070726f6044820152713b329029b2b730ba329022b632b1ba34b7b760711b606482015260840161040d565b6000828152600885016020526040902054610c7f90849084906921a7a72a2927a62622a960b11b906001600160a01b03166113e0565b6000828152600885016020526040902060010154610ca99084908490635459504560e01b90611429565b610d6782634e414d4560e01b8660080160008681526020019081526020016000206002018054610cd890611a88565b80601f0160208091040260200160405190810160405280929190818152602001828054610d0490611a88565b8015610d515780601f10610d2657610100808354040283529160200191610d51565b820191906000526020600020905b815481529060010190602001808311610d3457829003601f168201915b505050505086611451909392919063ffffffff16565b600082815260088501602052604090206001015460021415610db65760008281526008850160205260409020546005850180546001600160a01b0319166001600160a01b039092169190911790555b600784016000610dce8585635459504560e01b61148a565b815260208101919091526040016000205460ff1615610e02576001846006016000828254610dfc9190611a18565b90915550505b600082815260088501602081815260408084206001808201548652888452828620805491820181558652838620018790559386905291815242600390930192909255518381527f28ec9e38ba73636ceb2f6c1574136f83bd46284a3c74734b711bf45e12f8d929910160405180910390a150505050565b8281610e9382826921a7a72a2927a62622a960b11b6113ac565b6001600160a01b0316336001600160a01b031614610ec35760405162461bcd60e51b815260040161040d90611988565b6000848152600887016020526040902060019081015414610f265760405162461bcd60e51b815260206004820152601f60248201527f47656f64655574696c733a204e4f542053656e6174652050726f706f73616c00604482015260640161040d565b6000848152600887016020526040902060030154421115610f895760405162461bcd60e51b815260206004820152601c60248201527f47656f64655574696c733a2070726f706f73616c206578706972656400000000604482015260640161040d565b600786016000610fa18786635459504560e01b61148a565b815260208101919091526040016000205460ff166110015760405162461bcd60e51b815260206004820152601a60248201527f47656f64655574696c733a204e4f5420616e20656c6563746f72000000000000604482015260640161040d565b61101f8461101785641d9bdd195960da1b6114b4565b87919061148a565b1561106c5760405162461bcd60e51b815260206004820152601d60248201527f2047656f64655574696c733a20616c726561647920617070726f766564000000604482015260640161040d565b61108c8461108285641d9bdd195960da1b6114b4565b8791906001611429565b6110a985856c185c1c1c9bdd985b10dbdd5b9d609a1b60016114e0565b6003866006015460016110bc9190611a18565b6110c7906002611a52565b6110d19190611a30565b6110ec86866c185c1c1c9bdd985b10dbdd5b9d609a1b61148a565b106111215760008481526008870160205260409020426003820155546111219087906001600160a01b03166301e13380611519565b60408051858152602081018590527f33952ef907843fd2ddd118a92dd935debf65b72965a557a364ea08deffca032f910160405180910390a1505050505050565b600182015460009083906001600160a01b031633146111935760405162461bcd60e51b815260040161040d90611946565b83600301548311156112025760405162461bcd60e51b815260206004820152603260248201527f47656f64655574696c733a2063616e6e6f74206265206d6f7265207468616e2060448201527109a82b0be8e9eac8aa49c829c868abea882b60731b606482015260840161040d565b600284018390556040518381527fde0a23c11264740c0d09fcd02c04cbbff396aafcb2e8eb7ab7b3906fe656b4a290602001610a75565b60006107508383635459504560e01b61148a565b611281604051806080016040528060006001600160a01b031681526020016000815260200160608152602001600081525090565b6000828152600884016020908152604091829020825160808101845281546001600160a01b0316815260018201549281019290925260028101805492939192918401916112cd90611a88565b80601f01602080910402602001604051908101604052809291908181526020018280546112f990611a88565b80156113465780601f1061131b57610100808354040283529160200191611346565b820191906000526020600020905b81548152906001019060200180831161132957829003601f168201915b50505050508152602001600382015481525050905092915050565b60606107508383634e414d4560e01b61158e565b600083838360405160200161138c93929190611921565b60408051601f198184030181529190528051602090910120949350505050565b60008360030160006113be85856114b4565b81526020810191909152604001600020546001600160a01b0316949350505050565b808460030160006113f186866114b4565b815260200190815260200160002060006101000a8154816001600160a01b0302191690836001600160a01b0316021790555050505050565b8084600101600061143a86866114b4565b815260208101919091526040016000205550505050565b8084600201600061146286866114b4565b81526020019081526020016000209080519060200190611483929190611640565b5050505050565b600083600101600061149c85856114b4565b81526020019081526020016000205490509392505050565b604080516020808201949094528082019290925280518083038201815260609092019052805191012090565b808460010160006114f186866114b4565b8152602001908152602001600020600082825461150e9190611a18565b909155505050505050565b82546001600160a01b0319166001600160a01b03831617835561153c8142611a18565b600484018190558354604080516001600160a01b03909216825260208201929092527f3f34afe456fb5b36c04b5d1e2ef0750086747ac542262fbf14a0b1aae5fd7ee8910160405180910390a1505050565b60608360020160006115a085856114b4565b815260200190815260200160002080546115b990611a88565b80601f01602080910402602001604051908101604052809291908181526020018280546115e590611a88565b80156116325780601f1061160757610100808354040283529160200191611632565b820191906000526020600020905b81548152906001019060200180831161161557829003601f168201915b505050505090509392505050565b82805461164c90611a88565b90600052602060002090601f01602090048101928261166e57600085556116b4565b82601f1061168757805160ff19168380011785556116b4565b828001600101855582156116b4579182015b828111156116b4578251825591602001919060010190611699565b506116c09291506116c4565b5090565b5b808211156116c057600081556001016116c5565b80356001600160a01b03811681146116f057600080fd5b919050565b6000806040838503121561170857600080fd5b50508035926020909101359150565b60008060006060848603121561172c57600080fd5b8335925060208401359150611743604085016116d9565b90509250925092565b60006020828403121561175e57600080fd5b5035919050565b6000806040838503121561177857600080fd5b82359150611788602084016116d9565b90509250929050565b60008060008060008060a087890312156117aa57600080fd5b863595506117ba602088016116d9565b945060408701359350606087013567ffffffffffffffff808211156117de57600080fd5b818901915089601f8301126117f257600080fd5b81358181111561180157600080fd5b8a602082850101111561181357600080fd5b602083019550809450505050608087013590509295509295509295565b60008060006060848603121561184557600080fd5b505081359360208301359350604090920135919050565b6000806000806080858703121561187257600080fd5b8435935060208501359250604085013591506060850135801515811461189757600080fd5b939692955090935050565b600080600080608085870312156118b857600080fd5b5050823594602084013594506040840135936060013592509050565b6000815180845260005b818110156118fa576020818501810151868301820152016118de565b8181111561190c576000602083870101525b50601f01601f19169290920160200192915050565b82848237909101908152602001919050565b60208152600061075060208301846118d4565b60208082526022908201527f47656f64655574696c733a20474f5645524e414e434520726f6c65206e656564604082015261195960f21b606082015260800190565b60208082526022908201527f47656f64655574696c733a20434f4e54524f4c4c455220726f6c65206e656564604082015261195960f21b606082015260800190565b6020815260018060a01b038251166020820152602082015160408201526000604083015160806060840152611a0260a08401826118d4565b9050606084015160808401528091505092915050565b60008219821115611a2b57611a2b611ac3565b500190565b600082611a4d57634e487b7160e01b600052601260045260246000fd5b500490565b6000816000190483118215151615611a6c57611a6c611ac3565b500290565b600082821015611a8357611a83611ac3565b500390565b600181811c90821680611a9c57607f821691505b60208210811415611abd57634e487b7160e01b600052602260045260246000fd5b50919050565b634e487b7160e01b600052601160045260246000fdfea2646970667358221220bc520d6454dddddfc28a434ed8b4fb2aaa962c4efbf7039b1a5529d2008919ca64736f6c63430008070033",
  "devdoc": {
    "author": "Icebear & Crash Bandicoot",
    "details": "Contracts relying on this library must initialize GeodeUtils.UniverseALL \"fee\" variables are limited by PERCENTAGE_DENOMINATOR = 100%Admin functions are already protected Note this library contains both functions called by users(ID) (approveSenate) and admins(GOVERNANCE, SENATE) Note refer to DataStoreUtils before reviewing",
    "kind": "dev",
    "methods": {
      "approveProposal(GeodeUtils.Universe storage,DataStoreUtils.DataStore storage,uint256)": {
        "details": "Senate should not be able to approve approved proposalsSenate should not be able to approve expired proposalsSenate should not be able to approve SENATE proposals :)",
        "params": {
          "id": "given ID proposal that has been approved by Senate"
        }
      },
      "approveSenate(GeodeUtils.Universe storage,DataStoreUtils.DataStore storage,uint256,uint256)": {
        "details": "pins id as \"voted\" when approvedincreases \"approvalCount\" of proposalId by 1 when approved",
        "params": {
          "electorId": "should have the voting rights, msg.sender should be the CONTROLLER of given ID"
        }
      },
      "changeIdCONTROLLER(DataStoreUtils.DataStore storage,uint256,address)": {
        "details": "this operation can not be reverted by the old CONTROLLERin case the current controller wants to remove the need to upgrade to Controller they should provide smt like 0x000000000000000000000000000000000000dEaD"
      },
      "getCONTROLLERFromId(DataStoreUtils.DataStore storage,uint256)": {
        "details": "returns address(0) for empty ids, mandatory"
      },
      "getGovernance(GeodeUtils.Universe storage)": {
        "returns": {
          "_0": "address of GOVERNANCE*"
        }
      },
      "getGovernanceTax(GeodeUtils.Universe storage)": {
        "returns": {
          "_0": "active GOVERNANCE_TAX, limited by MAX_GOVERNANCE_TAX"
        }
      },
      "getMaxGovernanceTax(GeodeUtils.Universe storage)": {
        "returns": {
          "_0": "MAX_GOVERNANCE_TAX"
        }
      },
      "getNAMEFromId(DataStoreUtils.DataStore storage,uint256)": {
        "details": "returns bytes(0) for empty ids, mandatory"
      },
      "getSenate(GeodeUtils.Universe storage)": {
        "returns": {
          "_0": "address of SENATE*"
        }
      },
      "getSenateExpiry(GeodeUtils.Universe storage)": {
        "returns": {
          "_0": "the expiration date of current SENATE as a timestamp"
        }
      },
      "getTYPEFromId(DataStoreUtils.DataStore storage,uint256)": {
        "details": "returns uint(0) for empty ids, mandatory"
      },
      "isUpgradeAllowed(GeodeUtils.Universe storage,address)": {
        "details": "address(0) should return falseDO NOT TOUCH, EVER! WHATEVER YOU DEVELOP IN FUCKING 3022*",
        "returns": {
          "_0": "True if it is allowed by senate and false if not."
        }
      },
      "newProposal(GeodeUtils.Universe storage,address,uint256,bytes,uint256)": {
        "details": "refer to structure of Proposal for explanations of params"
      },
      "setElectorType(GeodeUtils.Universe storage,DataStoreUtils.DataStore storage,uint256,bool)": {
        "details": "can not set with the same value again, preventing double increment/decrements",
        "params": {
          "_TYPE": "selected type",
          "isElector": "true if selected _type can vote for senate from now on"
        }
      },
      "setGovernanceTax(GeodeUtils.Universe storage,uint256)": {
        "details": "can not set the fee more than MAX_GOVERNANCE_TAXno need to check PERCENTAGE_DENOMINATOR because MAX_GOVERNANCE_TAX is limited already",
        "returns": {
          "_0": "true if the operation was succesful, might be helpful when governance rights are distributed"
        }
      },
      "setMaxGovernanceTax(GeodeUtils.Universe storage,uint256)": {
        "details": "can not set a fee more than PERCENTAGE_DENOMINATOR (100%)",
        "returns": {
          "_0": "true if the operation was succesful"
        }
      }
    },
    "title": "GeodeUtils library",
    "version": 1
  },
  "userdoc": {
    "kind": "user",
    "methods": {
      "PERCENTAGE_DENOMINATOR()": {
        "notice": "PERCENTAGE_DENOMINATOR represents 100%"
      },
      "approveProposal(GeodeUtils.Universe storage,DataStoreUtils.DataStore storage,uint256)": {
        "notice": "type specific changes for reserved_types(1,2,3) are implemented here,  any other addition should take place in Portal, as not related"
      },
      "approveSenate(GeodeUtils.Universe storage,DataStoreUtils.DataStore storage,uint256,uint256)": {
        "notice": "Proposed CONTROLLER is the new Senate after 2/3 of the electors approved NOTE mathematically, min 4 elector is needed for (c+1)*2/3 to work properlyid can not vote if: - approved already - proposal is expired - not its type is elector - not senate proposal"
      },
      "changeIdCONTROLLER(DataStoreUtils.DataStore storage,uint256,address)": {
        "notice": "only the current CONTROLLER can change"
      },
      "getGovernanceTax(GeodeUtils.Universe storage)": {
        "notice": "MAX_GOVERNANCE_TAX must limit GOVERNANCE_TAX even if MAX is changed"
      },
      "getProposal(GeodeUtils.Universe storage,uint256)": {
        "notice": "CONTROLLER Proposals"
      },
      "isUpgradeAllowed(GeodeUtils.Universe storage,address)": {
        "notice": "Get if it is allowed to change a specific contract with the current version."
      },
      "newProposal(GeodeUtils.Universe storage,address,uint256,bytes,uint256)": {
        "notice": "a proposal can never be overriden.DATASTORE(id) will not be updated until the proposal is approved."
      },
      "setElectorType(GeodeUtils.Universe storage,DataStoreUtils.DataStore storage,uint256,bool)": {
        "notice": "only elector types can vote for senate"
      }
    },
    "notice": "Exclusively contains functions responsible for administration of DATASTORE, including functions related to \"limited upgradability\" with Senate & Proposals.",
    "version": 1
  },
  "storageLayout": {
    "storage": [],
    "types": null
  }
}