{
  "address": "0xb1D5A2b8F78f29D5Aca647C5F1E400d1A4B05a66",
  "abi": [
    {
      "anonymous": false,
      "inputs": [
        {
          "indexed": true,
          "internalType": "address",
          "name": "provider",
          "type": "address"
        },
        {
          "indexed": false,
          "internalType": "uint256[]",
          "name": "tokenAmounts",
          "type": "uint256[]"
        },
        {
          "indexed": false,
          "internalType": "uint256[]",
          "name": "fees",
          "type": "uint256[]"
        },
        {
          "indexed": false,
          "internalType": "uint256",
          "name": "invariant",
          "type": "uint256"
        },
        {
          "indexed": false,
          "internalType": "uint256",
          "name": "lpTokenSupply",
          "type": "uint256"
        }
      ],
      "name": "AddLiquidity",
      "type": "event"
    },
    {
      "anonymous": false,
      "inputs": [
        {
          "indexed": false,
          "internalType": "uint256",
          "name": "newAdminFee",
          "type": "uint256"
        }
      ],
      "name": "NewAdminFee",
      "type": "event"
    },
    {
      "anonymous": false,
      "inputs": [
        {
          "indexed": false,
          "internalType": "uint256",
          "name": "newSwapFee",
          "type": "uint256"
        }
      ],
      "name": "NewSwapFee",
      "type": "event"
    },
    {
      "anonymous": false,
      "inputs": [
        {
          "indexed": true,
          "internalType": "address",
          "name": "provider",
          "type": "address"
        },
        {
          "indexed": false,
          "internalType": "uint256[]",
          "name": "tokenAmounts",
          "type": "uint256[]"
        },
        {
          "indexed": false,
          "internalType": "uint256",
          "name": "lpTokenSupply",
          "type": "uint256"
        }
      ],
      "name": "RemoveLiquidity",
      "type": "event"
    },
    {
      "anonymous": false,
      "inputs": [
        {
          "indexed": true,
          "internalType": "address",
          "name": "provider",
          "type": "address"
        },
        {
          "indexed": false,
          "internalType": "uint256[]",
          "name": "tokenAmounts",
          "type": "uint256[]"
        },
        {
          "indexed": false,
          "internalType": "uint256[]",
          "name": "fees",
          "type": "uint256[]"
        },
        {
          "indexed": false,
          "internalType": "uint256",
          "name": "invariant",
          "type": "uint256"
        },
        {
          "indexed": false,
          "internalType": "uint256",
          "name": "lpTokenSupply",
          "type": "uint256"
        }
      ],
      "name": "RemoveLiquidityImbalance",
      "type": "event"
    },
    {
      "anonymous": false,
      "inputs": [
        {
          "indexed": true,
          "internalType": "address",
          "name": "provider",
          "type": "address"
        },
        {
          "indexed": false,
          "internalType": "uint256",
          "name": "lpTokenAmount",
          "type": "uint256"
        },
        {
          "indexed": false,
          "internalType": "uint256",
          "name": "lpTokenSupply",
          "type": "uint256"
        },
        {
          "indexed": false,
          "internalType": "uint256",
          "name": "boughtId",
          "type": "uint256"
        },
        {
          "indexed": false,
          "internalType": "uint256",
          "name": "tokensBought",
          "type": "uint256"
        }
      ],
      "name": "RemoveLiquidityOne",
      "type": "event"
    },
    {
      "anonymous": false,
      "inputs": [
        {
          "indexed": true,
          "internalType": "address",
          "name": "buyer",
          "type": "address"
        },
        {
          "indexed": false,
          "internalType": "uint256",
          "name": "tokensSold",
          "type": "uint256"
        },
        {
          "indexed": false,
          "internalType": "uint256",
          "name": "tokensBought",
          "type": "uint256"
        },
        {
          "indexed": false,
          "internalType": "uint128",
          "name": "soldId",
          "type": "uint128"
        },
        {
          "indexed": false,
          "internalType": "uint128",
          "name": "boughtId",
          "type": "uint128"
        }
      ],
      "name": "TokenSwap",
      "type": "event"
    },
    {
      "inputs": [],
      "name": "MAX_ADMIN_FEE",
      "outputs": [
        {
          "internalType": "uint256",
          "name": "",
          "type": "uint256"
        }
      ],
      "stateMutability": "view",
      "type": "function"
    },
    {
      "inputs": [],
      "name": "MAX_SWAP_FEE",
      "outputs": [
        {
          "internalType": "uint256",
          "name": "",
          "type": "uint256"
        }
      ],
      "stateMutability": "view",
      "type": "function"
    }
  ],
  "transactionHash": "0x23a6f98d85e3dec8118e2e15ca86c44e917156405c1765b49e4ca485616f683a",
  "receipt": {
    "to": null,
    "from": "0xbF45Aa723614476e8A832225bF714A46dAD69118",
    "contractAddress": "0xb1D5A2b8F78f29D5Aca647C5F1E400d1A4B05a66",
    "transactionIndex": 0,
    "gasUsed": "4119027",
    "logsBloom": "0x00000000000000000000000000000000000000000000000000000000000000000000000000000000000000000000000000000000000000000000000000000000000000000000000000000000000000000000000000000000000000000000000000000000000000000000000000000000000000000000000000000000000000000000000000000000000000000000000000000000000000000000000000000000000000000000000000000000000000000000000000000000000000000000000000000000000000000000000000000000000000000000000000000000000000000000000000000000000000000000000000000000000000000000000000000000",
    "blockHash": "0xc39c46b9490b4e9775f44d9816afceca2bd1f320bcf55ec7f54b7593b61e93d8",
    "transactionHash": "0x23a6f98d85e3dec8118e2e15ca86c44e917156405c1765b49e4ca485616f683a",
    "logs": [],
    "blockNumber": 8102563,
    "cumulativeGasUsed": "4119027",
    "status": 1,
    "byzantium": true
  },
  "args": [],
  "numDeployments": 1,
  "solcInputHash": "cb242a5b12c893bd03b25e475b2a02ca",
  "metadata": "{\"compiler\":{\"version\":\"0.8.7+commit.e28d00a7\"},\"language\":\"Solidity\",\"output\":{\"abi\":[{\"anonymous\":false,\"inputs\":[{\"indexed\":true,\"internalType\":\"address\",\"name\":\"provider\",\"type\":\"address\"},{\"indexed\":false,\"internalType\":\"uint256[]\",\"name\":\"tokenAmounts\",\"type\":\"uint256[]\"},{\"indexed\":false,\"internalType\":\"uint256[]\",\"name\":\"fees\",\"type\":\"uint256[]\"},{\"indexed\":false,\"internalType\":\"uint256\",\"name\":\"invariant\",\"type\":\"uint256\"},{\"indexed\":false,\"internalType\":\"uint256\",\"name\":\"lpTokenSupply\",\"type\":\"uint256\"}],\"name\":\"AddLiquidity\",\"type\":\"event\"},{\"anonymous\":false,\"inputs\":[{\"indexed\":false,\"internalType\":\"uint256\",\"name\":\"newAdminFee\",\"type\":\"uint256\"}],\"name\":\"NewAdminFee\",\"type\":\"event\"},{\"anonymous\":false,\"inputs\":[{\"indexed\":false,\"internalType\":\"uint256\",\"name\":\"newSwapFee\",\"type\":\"uint256\"}],\"name\":\"NewSwapFee\",\"type\":\"event\"},{\"anonymous\":false,\"inputs\":[{\"indexed\":true,\"internalType\":\"address\",\"name\":\"provider\",\"type\":\"address\"},{\"indexed\":false,\"internalType\":\"uint256[]\",\"name\":\"tokenAmounts\",\"type\":\"uint256[]\"},{\"indexed\":false,\"internalType\":\"uint256\",\"name\":\"lpTokenSupply\",\"type\":\"uint256\"}],\"name\":\"RemoveLiquidity\",\"type\":\"event\"},{\"anonymous\":false,\"inputs\":[{\"indexed\":true,\"internalType\":\"address\",\"name\":\"provider\",\"type\":\"address\"},{\"indexed\":false,\"internalType\":\"uint256[]\",\"name\":\"tokenAmounts\",\"type\":\"uint256[]\"},{\"indexed\":false,\"internalType\":\"uint256[]\",\"name\":\"fees\",\"type\":\"uint256[]\"},{\"indexed\":false,\"internalType\":\"uint256\",\"name\":\"invariant\",\"type\":\"uint256\"},{\"indexed\":false,\"internalType\":\"uint256\",\"name\":\"lpTokenSupply\",\"type\":\"uint256\"}],\"name\":\"RemoveLiquidityImbalance\",\"type\":\"event\"},{\"anonymous\":false,\"inputs\":[{\"indexed\":true,\"internalType\":\"address\",\"name\":\"provider\",\"type\":\"address\"},{\"indexed\":false,\"internalType\":\"uint256\",\"name\":\"lpTokenAmount\",\"type\":\"uint256\"},{\"indexed\":false,\"internalType\":\"uint256\",\"name\":\"lpTokenSupply\",\"type\":\"uint256\"},{\"indexed\":false,\"internalType\":\"uint256\",\"name\":\"boughtId\",\"type\":\"uint256\"},{\"indexed\":false,\"internalType\":\"uint256\",\"name\":\"tokensBought\",\"type\":\"uint256\"}],\"name\":\"RemoveLiquidityOne\",\"type\":\"event\"},{\"anonymous\":false,\"inputs\":[{\"indexed\":true,\"internalType\":\"address\",\"name\":\"buyer\",\"type\":\"address\"},{\"indexed\":false,\"internalType\":\"uint256\",\"name\":\"tokensSold\",\"type\":\"uint256\"},{\"indexed\":false,\"internalType\":\"uint256\",\"name\":\"tokensBought\",\"type\":\"uint256\"},{\"indexed\":false,\"internalType\":\"uint128\",\"name\":\"soldId\",\"type\":\"uint128\"},{\"indexed\":false,\"internalType\":\"uint128\",\"name\":\"boughtId\",\"type\":\"uint128\"}],\"name\":\"TokenSwap\",\"type\":\"event\"},{\"inputs\":[],\"name\":\"MAX_ADMIN_FEE\",\"outputs\":[{\"internalType\":\"uint256\",\"name\":\"\",\"type\":\"uint256\"}],\"stateMutability\":\"view\",\"type\":\"function\"},{\"inputs\":[],\"name\":\"MAX_SWAP_FEE\",\"outputs\":[{\"internalType\":\"uint256\",\"name\":\"\",\"type\":\"uint256\"}],\"stateMutability\":\"view\",\"type\":\"function\"}],\"devdoc\":{\"details\":\"Contracts relying on this library must initialize SwapUtils.Swap struct then use this library for SwapUtils.Swap struct. Note that this library contains both functions called by users and admins. Admin functions should be protected within contracts using this library.Whenever \\\"Effective Balance\\\" is mentioned it refers to the balance projected with underlying price.\",\"kind\":\"dev\",\"methods\":{\"addLiquidity(SwapUtils.Swap storage,uint256[],uint256)\":{\"params\":{\"amounts\":\"the amounts of each token to add, in their native precision\",\"minToMint\":\"the minimum LP tokens adding this amount of liquidity should mint, otherwise revert. Handy for front-running mitigation allowed addresses. If the pool is not in the guarded launch phase, this parameter will be ignored.\",\"self\":\"Swap struct to read from and write to\"},\"returns\":{\"_0\":\"amount of LP token user received\"}},\"calculateSwap(SwapUtils.Swap storage,uint8,uint8,uint256)\":{\"params\":{\"dx\":\"the number of tokens to sell. If the token charges a fee on transfers, use the amount that gets transferred after the fee.\",\"self\":\"Swap struct to read from\",\"tokenIndexFrom\":\"the token to sell\",\"tokenIndexTo\":\"the token to buy\"},\"returns\":{\"dy\":\"the number of tokens the user will get\"}},\"calculateTokenAmount(SwapUtils.Swap storage,uint256[],bool)\":{\"details\":\"This shouldn't be used outside frontends for user estimates.\",\"params\":{\"amounts\":\"an array of token amounts to deposit or withdrawal, corresponding to pooledTokens. The amount should be in each pooled token's native precision. If a token charges a fee on transfers, use the amount that gets transferred after the fee.\",\"deposit\":\"whether this is a deposit or a withdrawal\",\"self\":\"Swap struct to read from\"},\"returns\":{\"_0\":\"if deposit was true, total amount of lp token that will be minted and if deposit was false, total amount of lp token that will be burned\"}},\"calculateWithdrawOneToken(SwapUtils.Swap storage,uint256,uint8)\":{\"params\":{\"self\":\"Swap struct to read from\",\"tokenAmount\":\"the amount to withdraw in the pool's precision\",\"tokenIndex\":\"which token will be withdrawn\"},\"returns\":{\"_0\":\"the amount of token user will receive\"}},\"donateBalancedFees(SwapUtils.Swap storage,uint256,uint256)\":{\"params\":{\"EthDonation\":\"amount of ETH to donate into the pool\",\"gEthDonation\":\"amount of gETH to donate into the pool\",\"self\":\"Swap struct to deposit fees\"}},\"getAdminBalance(SwapUtils.Swap storage,uint256)\":{\"params\":{\"index\":\"Index of the pooled token\",\"self\":\"Swap struct to read from\"},\"returns\":{\"_0\":\"admin balance in the token's precision\"}},\"getDebt(SwapUtils.Swap storage)\":{\"returns\":{\"_0\":\"debt the half of the D StableSwap invariant when debt is needed to be payed.\"}},\"getVirtualPrice(SwapUtils.Swap storage)\":{\"params\":{\"self\":\"Swap struct to read from\"},\"returns\":{\"_0\":\"the virtual price\"}},\"removeLiquidity(SwapUtils.Swap storage,uint256,uint256[])\":{\"details\":\"Liquidity can always be removed, even when the pool is paused.\",\"params\":{\"amount\":\"the amount of LP tokens to burn\",\"minAmounts\":\"the minimum amounts of each token in the pool acceptable for this burn. Useful as a front-running mitigation\",\"self\":\"Swap struct to read from and write to\"},\"returns\":{\"_0\":\"amounts of tokens the user received\"}},\"removeLiquidityImbalance(SwapUtils.Swap storage,uint256[],uint256)\":{\"params\":{\"amounts\":\"how much of each token to withdraw\",\"maxBurnAmount\":\"the max LP token provider is willing to pay to remove liquidity. Useful as a front-running mitigation.\",\"self\":\"Swap struct to read from and write to\"},\"returns\":{\"_0\":\"actual amount of LP tokens burned in the withdrawal\"}},\"removeLiquidityOneToken(SwapUtils.Swap storage,uint256,uint8,uint256)\":{\"params\":{\"minAmount\":\"the minimum amount to withdraw, otherwise revert\",\"self\":\"Swap struct to read from and write to\",\"tokenAmount\":\"the amount of the lp tokens to burn\",\"tokenIndex\":\"the index of the token you want to receive\"},\"returns\":{\"_0\":\"amount chosen token that user received\"}},\"setAdminFee(SwapUtils.Swap storage,uint256)\":{\"details\":\"adminFee cannot be higher than 100% of the swap fee\",\"params\":{\"newAdminFee\":\"new admin fee to be applied on future transactions\",\"self\":\"Swap struct to update\"}},\"setSwapFee(SwapUtils.Swap storage,uint256)\":{\"details\":\"fee cannot be higher than 1% of each swap\",\"params\":{\"newSwapFee\":\"new swap fee to be applied on future transactions\",\"self\":\"Swap struct to update\"}},\"swap(SwapUtils.Swap storage,uint8,uint8,uint256,uint256)\":{\"params\":{\"dx\":\"the amount of tokens the user wants to sell\",\"minDy\":\"the min amount the user would like to receive, or revert.\",\"self\":\"Swap struct to read from and write to\",\"tokenIndexFrom\":\"the token the user wants to sell\",\"tokenIndexTo\":\"the token the user wants to buy\"},\"returns\":{\"_0\":\"amount of token user received on swap\"}},\"withdrawAdminFees(SwapUtils.Swap storage,address)\":{\"params\":{\"self\":\"Swap struct to withdraw fees from\",\"to\":\"Address to send the fees to\"}}},\"title\":\"SwapUtils library\",\"version\":1},\"userdoc\":{\"kind\":\"user\",\"methods\":{\"addLiquidity(SwapUtils.Swap storage,uint256[],uint256)\":{\"notice\":\"Add liquidity to the pool\"},\"calculateRemoveLiquidity(SwapUtils.Swap storage,uint256)\":{\"notice\":\"Uses _calculateRemoveLiquidity with Effective Balances, then projects the prices to the token amounts to get Real Balances, before removing them from pool.\"},\"calculateSwap(SwapUtils.Swap storage,uint8,uint8,uint256)\":{\"notice\":\"Externally calculates a swap between two tokens.\"},\"calculateTokenAmount(SwapUtils.Swap storage,uint256[],bool)\":{\"notice\":\"A simple method to calculate prices from deposits or withdrawals, excluding fees but including slippage. This is helpful as an input into the various \\\"min\\\" parameters on calls to fight front-running\"},\"calculateWithdrawOneToken(SwapUtils.Swap storage,uint256,uint8)\":{\"notice\":\"Calculate the dy, the amount of selected token that user receives and the fee of withdrawing in one token\"},\"donateBalancedFees(SwapUtils.Swap storage,uint256,uint256)\":{\"notice\":\"donate ETH and gETH to the pool as fee with respect to derivative price\"},\"getAdminBalance(SwapUtils.Swap storage,uint256)\":{\"notice\":\"return accumulated amount of admin fees of the token with given index\"},\"getVirtualPrice(SwapUtils.Swap storage)\":{\"notice\":\"Get the virtual price, to help calculate profit\"},\"removeLiquidity(SwapUtils.Swap storage,uint256,uint256[])\":{\"notice\":\"Burn LP tokens to remove liquidity from the pool.\"},\"removeLiquidityImbalance(SwapUtils.Swap storage,uint256[],uint256)\":{\"notice\":\"Remove liquidity from the pool, weighted differently than the pool's current balances.\"},\"removeLiquidityOneToken(SwapUtils.Swap storage,uint256,uint8,uint256)\":{\"notice\":\"Remove liquidity from the pool all in one token.\"},\"setAdminFee(SwapUtils.Swap storage,uint256)\":{\"notice\":\"Sets the admin fee\"},\"setSwapFee(SwapUtils.Swap storage,uint256)\":{\"notice\":\"update the swap fee\"},\"swap(SwapUtils.Swap storage,uint8,uint8,uint256,uint256)\":{\"notice\":\"swap two tokens in the pool\"},\"withdrawAdminFees(SwapUtils.Swap storage,address)\":{\"notice\":\"withdraw all admin fees to a given address\"}},\"notice\":\"A library to be used within Swap.sol. Contains functions responsible for custody and AMM functionalities with some changes. The main functionality of Withdrawal Pools is allowing the depositors to have instant withdrawals relying on the Oracle Price, with the help of Liquidity Providers. It is important to change the focus point (1-1) of the pricing algorithm with PriceIn and PriceOut functions. Because the underlying price of the staked assets are expected to raise in time. One can see this similar to accomplishing a \\\"rebasing\\\" logic, with the help of a trusted price source.\",\"version\":1}},\"settings\":{\"compilationTarget\":{\"contracts/Portal/WithdrawalPool/utils/SwapUtils.sol\":\"SwapUtils\"},\"evmVersion\":\"london\",\"libraries\":{},\"metadata\":{\"bytecodeHash\":\"ipfs\",\"useLiteralContent\":true},\"optimizer\":{\"enabled\":true,\"runs\":200},\"remappings\":[]},\"sources\":{\"contracts/Portal/WithdrawalPool/utils/AmplificationUtils.sol\":{\"content\":\"// SPDX-License-Identifier: MIT\\r\\npragma solidity =0.8.7;\\r\\nimport \\\"./SwapUtils.sol\\\";\\r\\n\\r\\n/**\\r\\n * @title AmplificationUtils library\\r\\n * @notice A library to calculate and ramp the A parameter of a given `SwapUtils.Swap` struct.\\r\\n * This library assumes the struct is fully validated.\\r\\n */\\r\\nlibrary AmplificationUtils {\\r\\n    event RampA(\\r\\n        uint256 oldA,\\r\\n        uint256 newA,\\r\\n        uint256 initialTime,\\r\\n        uint256 futureTime\\r\\n    );\\r\\n    event StopRampA(uint256 currentA, uint256 time);\\r\\n\\r\\n    // Constant values used in ramping A calculations\\r\\n    uint256 public constant A_PRECISION = 100;\\r\\n    uint256 public constant MAX_A = 10**6;\\r\\n    uint256 private constant MAX_A_CHANGE = 2;\\r\\n    uint256 private constant MIN_RAMP_TIME = 14 days;\\r\\n\\r\\n    /**\\r\\n     * @notice Return A, the amplification coefficient * n * (n - 1)\\r\\n     * @dev See the StableSwap paper for details\\r\\n     * @param self Swap struct to read from\\r\\n     * @return A parameter\\r\\n     */\\r\\n    function getA(SwapUtils.Swap storage self) internal view returns (uint256) {\\r\\n        return _getAPrecise(self) / (A_PRECISION);\\r\\n    }\\r\\n\\r\\n    /**\\r\\n     * @notice Return A in its raw precision\\r\\n     * @dev See the StableSwap paper for details\\r\\n     * @param self Swap struct to read from\\r\\n     * @return A parameter in its raw precision form\\r\\n     */\\r\\n    function getAPrecise(SwapUtils.Swap storage self)\\r\\n        internal\\r\\n        view\\r\\n        returns (uint256)\\r\\n    {\\r\\n        return _getAPrecise(self);\\r\\n    }\\r\\n\\r\\n    /**\\r\\n     * @notice Return A in its raw precision\\r\\n     * @dev See the StableSwap paper for details\\r\\n     * @param self Swap struct to read from\\r\\n     * @return A parameter in its raw precision form\\r\\n     */\\r\\n    function _getAPrecise(SwapUtils.Swap storage self)\\r\\n        internal\\r\\n        view\\r\\n        returns (uint256)\\r\\n    {\\r\\n        uint256 t1 = self.futureATime; // time when ramp is finished\\r\\n        uint256 a1 = self.futureA; // final A value when ramp is finished\\r\\n\\r\\n        if (block.timestamp < t1) {\\r\\n            uint256 t0 = self.initialATime; // time when ramp is started\\r\\n            uint256 a0 = self.initialA; // initial A value when ramp is started\\r\\n            if (a1 > a0) {\\r\\n                // a0 + (a1 - a0) * (block.timestamp - t0) / (t1 - t0)\\r\\n                return a0 + ((a1 - a0) * (block.timestamp - t0)) / (t1 - t0);\\r\\n            } else {\\r\\n                // a0 - (a0 - a1) * (block.timestamp - t0) / (t1 - t0)\\r\\n                return a0 - ((a0 - a1) * (block.timestamp - t0)) / (t1 - t0);\\r\\n            }\\r\\n        } else {\\r\\n            return a1;\\r\\n        }\\r\\n    }\\r\\n\\r\\n    /**\\r\\n     * @notice Start ramping up or down A parameter towards given futureA_ and futureTime_\\r\\n     * Checks if the change is too rapid, and commits the new A value only when it falls under\\r\\n     * the limit range.\\r\\n     * @param self Swap struct to update\\r\\n     * @param futureA_ the new A to ramp towards\\r\\n     * @param futureTime_ timestamp when the new A should be reached\\r\\n     */\\r\\n    function rampA(\\r\\n        SwapUtils.Swap storage self,\\r\\n        uint256 futureA_,\\r\\n        uint256 futureTime_\\r\\n    ) internal {\\r\\n        require(\\r\\n            block.timestamp >= self.initialATime + 1 days,\\r\\n            \\\"Wait 1 day before starting ramp\\\"\\r\\n        );\\r\\n        require(\\r\\n            futureTime_ >= block.timestamp + MIN_RAMP_TIME,\\r\\n            \\\"Insufficient ramp time\\\"\\r\\n        );\\r\\n        require(\\r\\n            futureA_ > 0 && futureA_ < MAX_A,\\r\\n            \\\"futureA_ must be > 0 and < MAX_A\\\"\\r\\n        );\\r\\n\\r\\n        uint256 initialAPrecise = _getAPrecise(self);\\r\\n        uint256 futureAPrecise = futureA_ * A_PRECISION;\\r\\n\\r\\n        if (futureAPrecise < initialAPrecise) {\\r\\n            require(\\r\\n                futureAPrecise * MAX_A_CHANGE >= initialAPrecise,\\r\\n                \\\"futureA_ is too small\\\"\\r\\n            );\\r\\n        } else {\\r\\n            require(\\r\\n                futureAPrecise <= initialAPrecise * MAX_A_CHANGE,\\r\\n                \\\"futureA_ is too large\\\"\\r\\n            );\\r\\n        }\\r\\n\\r\\n        self.initialA = initialAPrecise;\\r\\n        self.futureA = futureAPrecise;\\r\\n        self.initialATime = block.timestamp;\\r\\n        self.futureATime = futureTime_;\\r\\n\\r\\n        emit RampA(\\r\\n            initialAPrecise,\\r\\n            futureAPrecise,\\r\\n            block.timestamp,\\r\\n            futureTime_\\r\\n        );\\r\\n    }\\r\\n\\r\\n    /**\\r\\n     * @notice Stops ramping A immediately. Once this function is called, rampA()\\r\\n     * cannot be called for another 24 hours\\r\\n     * @param self Swap struct to update\\r\\n     */\\r\\n    function stopRampA(SwapUtils.Swap storage self) internal {\\r\\n        require(self.futureATime > block.timestamp, \\\"Ramp is already stopped\\\");\\r\\n\\r\\n        uint256 currentA = _getAPrecise(self);\\r\\n        self.initialA = currentA;\\r\\n        self.futureA = currentA;\\r\\n        self.initialATime = block.timestamp;\\r\\n        self.futureATime = block.timestamp;\\r\\n\\r\\n        emit StopRampA(currentA, block.timestamp);\\r\\n    }\\r\\n}\\r\\n\",\"keccak256\":\"0x1b1b2b9e003ddc4c3f4ab9be61d1800fa29f723a348580bb7b300bb753a0830e\",\"license\":\"MIT\"},\"contracts/Portal/WithdrawalPool/utils/MathUtils.sol\":{\"content\":\"// SPDX-License-Identifier: MIT\\r\\npragma solidity =0.8.7;\\r\\n\\r\\n/**\\r\\n * @title MathUtils library\\r\\n * @notice  Contains functions for calculating differences between two uint256.\\r\\n */\\r\\nlibrary MathUtils {\\r\\n    /**\\r\\n     * @notice Compares a and b and returns true if the difference between a and b\\r\\n     *         is less than 1 or equal to each other.\\r\\n     * @param a uint256 to compare with\\r\\n     * @param b uint256 to compare with\\r\\n     * @return True if the difference between a and b is less than 1 or equal,\\r\\n     *         otherwise return false\\r\\n     */\\r\\n    function within1(uint256 a, uint256 b) internal pure returns (bool) {\\r\\n        return (difference(a, b) <= 1);\\r\\n    }\\r\\n\\r\\n    /**\\r\\n     * @notice Calculates absolute difference between a and b\\r\\n     * @param a uint256 to compare with\\r\\n     * @param b uint256 to compare with\\r\\n     * @return Difference between a and b\\r\\n     */\\r\\n    function difference(uint256 a, uint256 b) internal pure returns (uint256) {\\r\\n        if (a > b) {\\r\\n            return a - b;\\r\\n        }\\r\\n        return b - a;\\r\\n    }\\r\\n}\\r\\n\",\"keccak256\":\"0xd0a9d28938cecdc3d7cc70f1847c15fa726d2a8e25e87aaf06e98cf3b995a33d\",\"license\":\"MIT\"},\"contracts/Portal/WithdrawalPool/utils/SwapUtils.sol\":{\"content\":\"// SPDX-License-Identifier: MIT\\r\\npragma solidity =0.8.7;\\r\\n\\r\\nimport \\\"./MathUtils.sol\\\";\\r\\nimport \\\"./AmplificationUtils.sol\\\";\\r\\nimport \\\"../../../interfaces/ILPToken.sol\\\";\\r\\nimport \\\"../../../interfaces/IgETH.sol\\\";\\r\\n\\r\\n/**\\r\\n * @title SwapUtils library\\r\\n *\\r\\n * @dev Contracts relying on this library must initialize SwapUtils.Swap struct then use this library\\r\\n * for SwapUtils.Swap struct. Note that this library contains both functions called by users and admins.\\r\\n * Admin functions should be protected within contracts using this library.\\r\\n *\\r\\n * @notice A library to be used within Swap.sol. Contains functions responsible for custody and AMM functionalities with some changes.\\r\\n * The main functionality of Withdrawal Pools is allowing the depositors to have instant withdrawals\\r\\n * relying on the Oracle Price, with the help of Liquidity Providers.\\r\\n * It is important to change the focus point (1-1) of the pricing algorithm with PriceIn and PriceOut functions.\\r\\n * Because the underlying price of the staked assets are expected to raise in time.\\r\\n * One can see this similar to accomplishing a \\\"rebasing\\\" logic, with the help of a trusted price source.\\r\\n *\\r\\n * @dev Whenever \\\"Effective Balance\\\" is mentioned it refers to the balance projected with underlying price.\\r\\n */\\r\\nlibrary SwapUtils {\\r\\n    using MathUtils for uint256;\\r\\n\\r\\n    /*** EVENTS ***/\\r\\n\\r\\n    event TokenSwap(\\r\\n        address indexed buyer,\\r\\n        uint256 tokensSold,\\r\\n        uint256 tokensBought,\\r\\n        uint128 soldId,\\r\\n        uint128 boughtId\\r\\n    );\\r\\n    event AddLiquidity(\\r\\n        address indexed provider,\\r\\n        uint256[] tokenAmounts,\\r\\n        uint256[] fees,\\r\\n        uint256 invariant,\\r\\n        uint256 lpTokenSupply\\r\\n    );\\r\\n    event RemoveLiquidity(\\r\\n        address indexed provider,\\r\\n        uint256[] tokenAmounts,\\r\\n        uint256 lpTokenSupply\\r\\n    );\\r\\n    event RemoveLiquidityOne(\\r\\n        address indexed provider,\\r\\n        uint256 lpTokenAmount,\\r\\n        uint256 lpTokenSupply,\\r\\n        uint256 boughtId,\\r\\n        uint256 tokensBought\\r\\n    );\\r\\n    event RemoveLiquidityImbalance(\\r\\n        address indexed provider,\\r\\n        uint256[] tokenAmounts,\\r\\n        uint256[] fees,\\r\\n        uint256 invariant,\\r\\n        uint256 lpTokenSupply\\r\\n    );\\r\\n    event NewAdminFee(uint256 newAdminFee);\\r\\n    event NewSwapFee(uint256 newSwapFee);\\r\\n\\r\\n    struct Swap {\\r\\n        IgETH gETH;\\r\\n        ILPToken lpToken;\\r\\n        uint256 pooledTokenId;\\r\\n        // variables around the ramp management of A,\\r\\n        // the amplification coefficient * n * (n - 1)\\r\\n        // see https://curve.fi/stableswap-paper.pdf for details\\r\\n        uint256 initialA;\\r\\n        uint256 futureA;\\r\\n        uint256 initialATime;\\r\\n        uint256 futureATime;\\r\\n        // fee calculation\\r\\n        uint256 swapFee;\\r\\n        uint256 adminFee;\\r\\n        // gETH contract reference\\r\\n        // the pool balance as [ETH, gETH]\\r\\n        // the contract's actual token balance might differ\\r\\n        uint256[] balances;\\r\\n    }\\r\\n\\r\\n    // Struct storing variables used in calculations in the\\r\\n    // calculateWithdrawOneTokenDY function to avoid stack too deep errors\\r\\n    struct CalculateWithdrawOneTokenDYInfo {\\r\\n        uint256 d0;\\r\\n        uint256 d1;\\r\\n        uint256 newY;\\r\\n        uint256 feePerToken;\\r\\n        uint256 preciseA;\\r\\n    }\\r\\n\\r\\n    // Struct storing variables used in calculations in the\\r\\n    // {add,remove} Liquidity functions to avoid stack too deep errors\\r\\n    struct ManageLiquidityInfo {\\r\\n        ILPToken lpToken;\\r\\n        uint256 d0;\\r\\n        uint256 d1;\\r\\n        uint256 d2;\\r\\n        uint256 preciseA;\\r\\n        uint256 totalSupply;\\r\\n        uint256[] balances;\\r\\n    }\\r\\n\\r\\n    // the denominator used to calculate admin and LP fees. For example, an\\r\\n    // LP fee is BoughtAmount.mul(fee).div(PERCENTAGE_DENOMINATOR)\\r\\n    uint256 private constant PERCENTAGE_DENOMINATOR = 10**10;\\r\\n\\r\\n    // Max swap fee is 1% or 100bps of each swap\\r\\n    uint256 public constant MAX_SWAP_FEE = 10**8;\\r\\n\\r\\n    // Max adminFee is 100% of the swapFee\\r\\n    // adminFee does not add additional fee on top of swapFee\\r\\n    // instead it takes a certain percentage of the swapFee.\\r\\n    // Therefore it has no impact on users but only on the earnings of LPs\\r\\n    uint256 public constant MAX_ADMIN_FEE = 10**10;\\r\\n\\r\\n    // Constant value used as max loop limit\\r\\n    uint256 private constant MAX_LOOP_LIMIT = 256;\\r\\n\\r\\n    /*** VIEW & PURE FUNCTIONS ***/\\r\\n\\r\\n    function _getAPrecise(Swap storage self) internal view returns (uint256) {\\r\\n        return AmplificationUtils._getAPrecise(self);\\r\\n    }\\r\\n\\r\\n    /**\\r\\n     * @notice This function MULTIPLIES the Staked Ether token (gETH) balance with underlying relative price (pricePerShare),\\r\\n     * to keep pricing around 1-OraclePrice instead of 1-1 like stableSwap pool.\\r\\n     * @dev this function assumes prices are sent with the indexes that [ETH, gETH]\\r\\n     * @param balance balance that will be taken into calculation\\r\\n     * @param i if i is 0 it means we are dealing with ETH, if i is 1 it is gETH\\r\\n     */\\r\\n    function _pricedIn(\\r\\n        Swap storage self,\\r\\n        uint256 balance,\\r\\n        uint256 i\\r\\n    ) internal view returns (uint256) {\\r\\n        return\\r\\n            i == 1\\r\\n                ? (balance * self.gETH.pricePerShare(self.pooledTokenId)) /\\r\\n                    self.gETH.denominator()\\r\\n                : balance;\\r\\n    }\\r\\n\\r\\n    /**\\r\\n     * @notice This function DIVIDES the Staked Ether token (gETH) balance with underlying relative price (pricePerShare),\\r\\n     * to keep pricing around 1-OraclePrice instead of 1-1 like stableSwap pool.\\r\\n     * @dev this function assumes prices are sent with the indexes that [ETH, gETH]\\r\\n     * @param balance balance that will be taken into calculation\\r\\n     * @param i if i is 0 it means we are dealing with ETH, if i is 1 it is gETH\\r\\n     */\\r\\n    function _pricedOut(\\r\\n        Swap storage self,\\r\\n        uint256 balance,\\r\\n        uint256 i\\r\\n    ) internal view returns (uint256) {\\r\\n        return\\r\\n            i == 1\\r\\n                ? (balance * self.gETH.denominator()) /\\r\\n                    self.gETH.pricePerShare(self.pooledTokenId)\\r\\n                : balance;\\r\\n    }\\r\\n\\r\\n    /**\\r\\n     * @notice This function MULTIPLIES the Staked Ether token (gETH) balance with underlying relative price (pricePerShare),\\r\\n     * to keep pricing around 1-OraclePrice instead of 1-1 like stableSwap pool.\\r\\n     * @dev this function assumes prices are sent with the indexes that [ETH, gETH]\\r\\n     * @param balances ARRAY of balances that will be taken into calculation\\r\\n     */\\r\\n    function _pricedInBatch(Swap storage self, uint256[] memory balances)\\r\\n        internal\\r\\n        view\\r\\n        returns (uint256[] memory)\\r\\n    {\\r\\n        uint256[] memory _p = new uint256[](balances.length);\\r\\n        _p[0] = balances[0];\\r\\n        _p[1] =\\r\\n            (balances[1] * self.gETH.pricePerShare(self.pooledTokenId)) /\\r\\n            self.gETH.denominator();\\r\\n        return _p;\\r\\n    }\\r\\n\\r\\n    /**\\r\\n     * @notice This function DIVIDES the Staked Ether token (gETH) balance with underlying relative price (pricePerShare),\\r\\n     * to keep pricing around 1-OraclePrice instead of 1-1 like stableSwap pool.\\r\\n     * @dev this function assumes prices are sent with the indexes that [ETH, gETH]\\r\\n     * @param balances ARRAY of balances that will be taken into calculation\\r\\n     */\\r\\n    function _pricedOutBatch(Swap storage self, uint256[] memory balances)\\r\\n        internal\\r\\n        view\\r\\n        returns (uint256[] memory)\\r\\n    {\\r\\n        uint256[] memory _p = new uint256[](balances.length);\\r\\n        _p[0] = balances[0];\\r\\n        _p[1] =\\r\\n            (balances[1] * self.gETH.denominator()) /\\r\\n            self.gETH.pricePerShare(self.pooledTokenId);\\r\\n        return _p;\\r\\n    }\\r\\n\\r\\n    /**\\r\\n     * @notice Calculate the dy, the amount of selected token that user receives and\\r\\n     * the fee of withdrawing in one token\\r\\n     * @param tokenAmount the amount to withdraw in the pool's precision\\r\\n     * @param tokenIndex which token will be withdrawn\\r\\n     * @param self Swap struct to read from\\r\\n     * @return the amount of token user will receive\\r\\n     */\\r\\n    function calculateWithdrawOneToken(\\r\\n        Swap storage self,\\r\\n        uint256 tokenAmount,\\r\\n        uint8 tokenIndex\\r\\n    ) external view returns (uint256) {\\r\\n        (uint256 availableTokenAmount, ) = _calculateWithdrawOneToken(\\r\\n            self,\\r\\n            tokenAmount,\\r\\n            tokenIndex,\\r\\n            self.lpToken.totalSupply()\\r\\n        );\\r\\n        return availableTokenAmount;\\r\\n    }\\r\\n\\r\\n    function _calculateWithdrawOneToken(\\r\\n        Swap storage self,\\r\\n        uint256 tokenAmount,\\r\\n        uint8 tokenIndex,\\r\\n        uint256 totalSupply\\r\\n    ) internal view returns (uint256, uint256) {\\r\\n        uint256 dy;\\r\\n        uint256 newY;\\r\\n        uint256 currentY;\\r\\n\\r\\n        (dy, newY, currentY) = calculateWithdrawOneTokenDY(\\r\\n            self,\\r\\n            tokenIndex,\\r\\n            tokenAmount,\\r\\n            totalSupply\\r\\n        );\\r\\n\\r\\n        // dy_0 (without fees)\\r\\n        // dy, dy_0 - dy\\r\\n\\r\\n        uint256 dySwapFee = currentY - newY - dy;\\r\\n\\r\\n        return (dy, dySwapFee);\\r\\n    }\\r\\n\\r\\n    /**\\r\\n     * @notice Calculate the dy of withdrawing in one token\\r\\n     * @param self Swap struct to read from\\r\\n     * @param tokenIndex which token will be withdrawn\\r\\n     * @param tokenAmount the amount to withdraw in the pools precision\\r\\n     * @return the d and the new y after withdrawing one token\\r\\n     */\\r\\n    function calculateWithdrawOneTokenDY(\\r\\n        Swap storage self,\\r\\n        uint8 tokenIndex,\\r\\n        uint256 tokenAmount,\\r\\n        uint256 totalSupply\\r\\n    )\\r\\n        internal\\r\\n        view\\r\\n        returns (\\r\\n            uint256,\\r\\n            uint256,\\r\\n            uint256\\r\\n        )\\r\\n    {\\r\\n        // Get the current D, then solve the stableswap invariant\\r\\n        // y_i for D - tokenAmount\\r\\n\\r\\n        require(tokenIndex < 2, \\\"Token index out of range\\\");\\r\\n\\r\\n        CalculateWithdrawOneTokenDYInfo\\r\\n            memory v = CalculateWithdrawOneTokenDYInfo(0, 0, 0, 0, 0);\\r\\n        v.preciseA = _getAPrecise(self);\\r\\n        v.d0 = getD(_pricedInBatch(self, self.balances), v.preciseA);\\r\\n        v.d1 = v.d0 - ((tokenAmount * v.d0) / totalSupply);\\r\\n\\r\\n        require(\\r\\n            tokenAmount <= self.balances[tokenIndex],\\r\\n            \\\"Withdraw exceeds available\\\"\\r\\n        );\\r\\n\\r\\n        v.newY = _pricedOut(\\r\\n            self,\\r\\n            getYD(\\r\\n                v.preciseA,\\r\\n                tokenIndex,\\r\\n                _pricedInBatch(self, self.balances),\\r\\n                v.d1\\r\\n            ),\\r\\n            tokenIndex\\r\\n        );\\r\\n\\r\\n        uint256[] memory xpReduced = new uint256[](2);\\r\\n\\r\\n        v.feePerToken = self.swapFee / 2;\\r\\n        for (uint256 i = 0; i < 2; i++) {\\r\\n            uint256 xpi = self.balances[i];\\r\\n            xpReduced[i] =\\r\\n                xpi -\\r\\n                (((\\r\\n                    (i == tokenIndex)\\r\\n                        ? (xpi * v.d1) / v.d0 - v.newY\\r\\n                        : xpi - ((xpi * v.d1) / (v.d0))\\r\\n                ) * (v.feePerToken)) / (PERCENTAGE_DENOMINATOR));\\r\\n        }\\r\\n\\r\\n        uint256 dy = xpReduced[tokenIndex] -\\r\\n            _pricedOut(\\r\\n                self,\\r\\n                (\\r\\n                    getYD(\\r\\n                        v.preciseA,\\r\\n                        tokenIndex,\\r\\n                        _pricedInBatch(self, xpReduced),\\r\\n                        v.d1\\r\\n                    )\\r\\n                ),\\r\\n                tokenIndex\\r\\n            );\\r\\n        dy = dy - 1;\\r\\n\\r\\n        return (dy, v.newY, self.balances[tokenIndex]);\\r\\n    }\\r\\n\\r\\n    /**\\r\\n     * @notice Get Debt, The amount of buyback for stable pricing.\\r\\n     * @param xp a  set of pool balances. Array should be the same cardinality\\r\\n     * as the pool.\\r\\n     * @param a the amplification coefficient * n * (n - 1) in A_PRECISION.\\r\\n     * See the StableSwap paper for details\\r\\n     * @return debt the half of the D StableSwap invariant when debt is needed to be payed.\\r\\n     */\\r\\n    function _getDebt(\\r\\n        Swap storage self,\\r\\n        uint256[] memory xp,\\r\\n        uint256 a\\r\\n    ) internal view returns (uint256) {\\r\\n        uint256 halfD = getD(xp, a) / 2;\\r\\n        if (xp[0] >= halfD) {\\r\\n            return 0;\\r\\n        } else {\\r\\n            uint256 dy = xp[1] - halfD;\\r\\n            uint256 feeHalf = (dy * self.swapFee) / PERCENTAGE_DENOMINATOR / 2;\\r\\n            uint256 debt = halfD - xp[0] + feeHalf;\\r\\n            return debt;\\r\\n        }\\r\\n    }\\r\\n\\r\\n    /**\\r\\n     * @return debt the half of the D StableSwap invariant when debt is needed to be payed.\\r\\n     */\\r\\n    function getDebt(Swap storage self) external view returns (uint256) {\\r\\n        // might change when price is in.\\r\\n        return\\r\\n            _getDebt(\\r\\n                self,\\r\\n                _pricedInBatch(self, self.balances),\\r\\n                _getAPrecise(self)\\r\\n            );\\r\\n    }\\r\\n\\r\\n    /**\\r\\n     * @notice Calculate the price of a token in the pool with given\\r\\n     *  balances and a particular D.\\r\\n     *\\r\\n     * @dev This is accomplished via solving the invariant iteratively.\\r\\n     * See the StableSwap paper and Curve.fi implementation for further details.\\r\\n     *\\r\\n     * x_1**2 + x1 * (sum' - (A*n**n - 1) * D / (A * n**n)) = D ** (n + 1) / (n ** (2 * n) * prod' * A)\\r\\n     * x_1**2 + b*x_1 = c\\r\\n     * x_1 = (x_1**2 + c) / (2*x_1 + b)\\r\\n     *\\r\\n     * @param a the amplification coefficient * n * (n - 1). See the StableSwap paper for details.\\r\\n     * @param tokenIndex Index of token we are calculating for.\\r\\n     * @param xp a  set of pool balances. Array should be\\r\\n     * the same cardinality as the pool.\\r\\n     * @param d the stableswap invariant\\r\\n     * @return the price of the token, in the same precision as in xp\\r\\n     */\\r\\n    function getYD(\\r\\n        uint256 a,\\r\\n        uint8 tokenIndex,\\r\\n        uint256[] memory xp,\\r\\n        uint256 d\\r\\n    ) internal pure returns (uint256) {\\r\\n        uint256 numTokens = 2;\\r\\n        require(tokenIndex < numTokens, \\\"Token not found\\\");\\r\\n\\r\\n        uint256 c = d;\\r\\n        uint256 s;\\r\\n        uint256 nA = a * numTokens;\\r\\n\\r\\n        for (uint256 i = 0; i < numTokens; i++) {\\r\\n            if (i != tokenIndex) {\\r\\n                s = s + xp[i];\\r\\n                c = (c * d) / (xp[i] * (numTokens));\\r\\n                // If we were to protect the division loss we would have to keep the denominator separate\\r\\n                // and divide at the end. However this leads to overflow with large numTokens or/and D.\\r\\n                // c = c * D * D * D * ... overflow!\\r\\n            }\\r\\n        }\\r\\n        c = (c * d * AmplificationUtils.A_PRECISION) / (nA * numTokens);\\r\\n\\r\\n        uint256 b = s + ((d * AmplificationUtils.A_PRECISION) / nA);\\r\\n        uint256 yPrev;\\r\\n        uint256 y = d;\\r\\n        for (uint256 i = 0; i < MAX_LOOP_LIMIT; i++) {\\r\\n            yPrev = y;\\r\\n            y = ((y * y) + c) / (2 * y + b - d);\\r\\n            if (y.within1(yPrev)) {\\r\\n                return y;\\r\\n            }\\r\\n        }\\r\\n        revert(\\\"Approximation did not converge\\\");\\r\\n    }\\r\\n\\r\\n    /**\\r\\n     * @notice Get D, the StableSwap invariant, based on a set of balances and a particular A.\\r\\n     * @param xp a  set of pool balances. Array should be the same cardinality\\r\\n     * as the pool.\\r\\n     * @param a the amplification coefficient * n * (n - 1) in A_PRECISION.\\r\\n     * See the StableSwap paper for details\\r\\n     * @return the invariant, at the precision of the pool\\r\\n     */\\r\\n    function getD(uint256[] memory xp, uint256 a)\\r\\n        internal\\r\\n        pure\\r\\n        returns (uint256)\\r\\n    {\\r\\n        uint256 numTokens = 2;\\r\\n        uint256 s = xp[0] + xp[1];\\r\\n        if (s == 0) {\\r\\n            return 0;\\r\\n        }\\r\\n\\r\\n        uint256 prevD;\\r\\n        uint256 d = s;\\r\\n        uint256 nA = a * numTokens;\\r\\n\\r\\n        for (uint256 i = 0; i < MAX_LOOP_LIMIT; i++) {\\r\\n            uint256 dP = (d**(numTokens + 1)) /\\r\\n                (numTokens**numTokens * xp[0] * xp[1]);\\r\\n            prevD = d;\\r\\n            d =\\r\\n                ((((nA * s) / AmplificationUtils.A_PRECISION) +\\r\\n                    dP *\\r\\n                    numTokens) * (d)) /\\r\\n                (((nA - AmplificationUtils.A_PRECISION) * (d)) /\\r\\n                    (AmplificationUtils.A_PRECISION) +\\r\\n                    ((numTokens + 1) * dP));\\r\\n\\r\\n            if (d.within1(prevD)) {\\r\\n                return d;\\r\\n            }\\r\\n        }\\r\\n\\r\\n        // Convergence should occur in 4 loops or less. If this is reached, there may be something wrong\\r\\n        // with the pool. If this were to occur repeatedly, LPs should withdraw via `removeLiquidity()`\\r\\n        // function which does not rely on D.\\r\\n        revert(\\\"D does not converge\\\");\\r\\n    }\\r\\n\\r\\n    /**\\r\\n     * @notice Get the virtual price, to help calculate profit\\r\\n     * @param self Swap struct to read from\\r\\n     * @return the virtual price\\r\\n     */\\r\\n    function getVirtualPrice(Swap storage self)\\r\\n        external\\r\\n        view\\r\\n        returns (uint256)\\r\\n    {\\r\\n        uint256 d = getD(\\r\\n            _pricedInBatch(self, self.balances),\\r\\n            _getAPrecise(self)\\r\\n        );\\r\\n        ILPToken lpToken = self.lpToken;\\r\\n        uint256 supply = lpToken.totalSupply();\\r\\n        if (supply > 0) {\\r\\n            return (d * 10**18) / supply;\\r\\n        }\\r\\n        return 0;\\r\\n    }\\r\\n\\r\\n    /**\\r\\n     * @notice Calculate the new balances of the tokens given the indexes of the token\\r\\n     * that is swapped from (FROM) and the token that is swapped to (TO).\\r\\n     * This function is used as a helper function to calculate how much TO token\\r\\n     * the user should receive on swap.\\r\\n     *\\r\\n     * @param preciseA precise form of amplification coefficient\\r\\n     * @param tokenIndexFrom index of FROM token\\r\\n     * @param tokenIndexTo index of TO token\\r\\n     * @param x the new total amount of FROM token\\r\\n     * @param xp balances of the tokens in the pool\\r\\n     * @return the amount of TO token that should remain in the pool\\r\\n     */\\r\\n    function getY(\\r\\n        uint256 preciseA,\\r\\n        uint8 tokenIndexFrom,\\r\\n        uint8 tokenIndexTo,\\r\\n        uint256 x,\\r\\n        uint256[] memory xp\\r\\n    ) internal pure returns (uint256) {\\r\\n        uint256 numTokens = 2;\\r\\n        require(\\r\\n            tokenIndexFrom != tokenIndexTo,\\r\\n            \\\"Can't compare token to itself\\\"\\r\\n        );\\r\\n        require(\\r\\n            tokenIndexFrom < numTokens && tokenIndexTo < numTokens,\\r\\n            \\\"Tokens must be in pool\\\"\\r\\n        );\\r\\n\\r\\n        uint256 d = getD(xp, preciseA);\\r\\n        uint256 c = d;\\r\\n        uint256 s = x;\\r\\n        uint256 nA = numTokens * (preciseA);\\r\\n\\r\\n        c = (c * d) / (x * numTokens);\\r\\n        c = (c * d * (AmplificationUtils.A_PRECISION)) / (nA * numTokens);\\r\\n        uint256 b = s + ((d * AmplificationUtils.A_PRECISION) / nA);\\r\\n\\r\\n        uint256 yPrev;\\r\\n        uint256 y = d;\\r\\n        for (uint256 i = 0; i < MAX_LOOP_LIMIT; i++) {\\r\\n            yPrev = y;\\r\\n            y = ((y * y) + c) / (2 * y + b - d);\\r\\n            if (y.within1(yPrev)) {\\r\\n                return y;\\r\\n            }\\r\\n        }\\r\\n        revert(\\\"Approximation did not converge\\\");\\r\\n    }\\r\\n\\r\\n    /**\\r\\n     * @notice Externally calculates a swap between two tokens.\\r\\n     * @param self Swap struct to read from\\r\\n     * @param tokenIndexFrom the token to sell\\r\\n     * @param tokenIndexTo the token to buy\\r\\n     * @param dx the number of tokens to sell. If the token charges a fee on transfers,\\r\\n     * use the amount that gets transferred after the fee.\\r\\n     * @return dy the number of tokens the user will get\\r\\n     */\\r\\n    function calculateSwap(\\r\\n        Swap storage self,\\r\\n        uint8 tokenIndexFrom,\\r\\n        uint8 tokenIndexTo,\\r\\n        uint256 dx\\r\\n    ) external view returns (uint256 dy) {\\r\\n        (dy, ) = _calculateSwap(\\r\\n            self,\\r\\n            tokenIndexFrom,\\r\\n            tokenIndexTo,\\r\\n            dx,\\r\\n            self.balances\\r\\n        );\\r\\n    }\\r\\n\\r\\n    /**\\r\\n     * @notice Internally calculates a swap between two tokens.\\r\\n     *\\r\\n     * @dev The caller is expected to transfer the actual amounts (dx and dy)\\r\\n     * using the token contracts.\\r\\n     *\\r\\n     * @param self Swap struct to read from\\r\\n     * @param tokenIndexFrom the token to sell\\r\\n     * @param tokenIndexTo the token to buy\\r\\n     * @param dx the number of tokens to sell. If the token charges a fee on transfers,\\r\\n     * use the amount that gets transferred after the fee.\\r\\n     * @return dy the number of tokens the user will get\\r\\n     * @return dyFee the associated fee\\r\\n     */\\r\\n    function _calculateSwap(\\r\\n        Swap storage self,\\r\\n        uint8 tokenIndexFrom,\\r\\n        uint8 tokenIndexTo,\\r\\n        uint256 dx,\\r\\n        uint256[] memory balances\\r\\n    ) internal view returns (uint256 dy, uint256 dyFee) {\\r\\n        require(\\r\\n            tokenIndexFrom < balances.length && tokenIndexTo < balances.length,\\r\\n            \\\"Token index out of range\\\"\\r\\n        );\\r\\n        uint256 x = _pricedIn(\\r\\n            self,\\r\\n            dx + balances[tokenIndexFrom],\\r\\n            tokenIndexFrom\\r\\n        );\\r\\n\\r\\n        uint256[] memory pricedBalances = _pricedInBatch(self, balances);\\r\\n\\r\\n        uint256 y = _pricedOut(\\r\\n            self,\\r\\n            getY(\\r\\n                _getAPrecise(self),\\r\\n                tokenIndexFrom,\\r\\n                tokenIndexTo,\\r\\n                x,\\r\\n                pricedBalances\\r\\n            ),\\r\\n            tokenIndexTo // => not id, index !!!\\r\\n        );\\r\\n        dy = balances[tokenIndexTo] - y - 1;\\r\\n        dyFee = (dy * self.swapFee) / (PERCENTAGE_DENOMINATOR);\\r\\n        dy = dy - dyFee;\\r\\n    }\\r\\n\\r\\n    /**\\r\\n     * @notice Uses _calculateRemoveLiquidity with Effective Balances,\\r\\n     * then projects the prices to the token amounts\\r\\n     * to get Real Balances, before removing them from pool.\\r\\n     */\\r\\n    function calculateRemoveLiquidity(Swap storage self, uint256 amount)\\r\\n        external\\r\\n        view\\r\\n        returns (uint256[] memory)\\r\\n    {\\r\\n        return\\r\\n            _pricedOutBatch(\\r\\n                self,\\r\\n                _calculateRemoveLiquidity(\\r\\n                    _pricedInBatch(self, self.balances),\\r\\n                    amount,\\r\\n                    self.lpToken.totalSupply()\\r\\n                )\\r\\n            );\\r\\n    }\\r\\n\\r\\n    /**\\r\\n     * @notice A simple method to calculate amount of each underlying\\r\\n     * tokens that is returned upon burning given amount of\\r\\n     * LP tokens\\r\\n     *\\r\\n     * @param amount the amount of LP tokens that would to be burned on\\r\\n     * withdrawal\\r\\n     * @return array of amounts of tokens user will receive\\r\\n     */\\r\\n    function _calculateRemoveLiquidity(\\r\\n        uint256[] memory balances,\\r\\n        uint256 amount,\\r\\n        uint256 totalSupply\\r\\n    ) internal pure returns (uint256[] memory) {\\r\\n        require(amount <= totalSupply, \\\"Cannot exceed total supply\\\");\\r\\n\\r\\n        uint256[] memory amounts = new uint256[](2);\\r\\n\\r\\n        amounts[0] = (balances[0] * amount) / totalSupply;\\r\\n        amounts[1] = (balances[1] * amount) / totalSupply;\\r\\n\\r\\n        return amounts;\\r\\n    }\\r\\n\\r\\n    /**\\r\\n     * @notice A simple method to calculate prices from deposits or\\r\\n     * withdrawals, excluding fees but including slippage. This is\\r\\n     * helpful as an input into the various \\\"min\\\" parameters on calls\\r\\n     * to fight front-running\\r\\n     *\\r\\n     * @dev This shouldn't be used outside frontends for user estimates.\\r\\n     *\\r\\n     * @param self Swap struct to read from\\r\\n     * @param amounts an array of token amounts to deposit or withdrawal,\\r\\n     * corresponding to pooledTokens. The amount should be in each\\r\\n     * pooled token's native precision. If a token charges a fee on transfers,\\r\\n     * use the amount that gets transferred after the fee.\\r\\n     * @param deposit whether this is a deposit or a withdrawal\\r\\n     * @return if deposit was true, total amount of lp token that will be minted and if\\r\\n     * deposit was false, total amount of lp token that will be burned\\r\\n     */\\r\\n    function calculateTokenAmount(\\r\\n        Swap storage self,\\r\\n        uint256[] calldata amounts,\\r\\n        bool deposit\\r\\n    ) external view returns (uint256) {\\r\\n        uint256 a = _getAPrecise(self);\\r\\n        uint256[] memory balances = self.balances;\\r\\n\\r\\n        uint256 d0 = getD(_pricedInBatch(self, balances), a);\\r\\n        for (uint256 i = 0; i < balances.length; i++) {\\r\\n            if (deposit) {\\r\\n                balances[i] = balances[i] + amounts[i];\\r\\n            } else {\\r\\n                require(\\r\\n                    amounts[i] <= balances[i],\\r\\n                    \\\"Cannot withdraw more than available\\\"\\r\\n                );\\r\\n                balances[i] = balances[i] - amounts[i];\\r\\n            }\\r\\n        }\\r\\n        uint256 d1 = getD(_pricedInBatch(self, balances), a);\\r\\n        uint256 totalSupply = self.lpToken.totalSupply();\\r\\n\\r\\n        if (deposit) {\\r\\n            return ((d1 - d0) * totalSupply) / d0;\\r\\n        } else {\\r\\n            return ((d0 - d1) * totalSupply) / d0;\\r\\n        }\\r\\n    }\\r\\n\\r\\n    /**\\r\\n     * @notice return accumulated amount of admin fees of the token with given index\\r\\n     * @param self Swap struct to read from\\r\\n     * @param index Index of the pooled token\\r\\n     * @return admin balance in the token's precision\\r\\n     */\\r\\n    function getAdminBalance(Swap storage self, uint256 index)\\r\\n        external\\r\\n        view\\r\\n        returns (uint256)\\r\\n    {\\r\\n        require(index < 2, \\\"Token index out of range\\\");\\r\\n        if (index == 0) return address(this).balance - (self.balances[index]);\\r\\n\\r\\n        if (index == 1)\\r\\n            return\\r\\n                self.gETH.balanceOf(address(this), self.pooledTokenId) -\\r\\n                (self.balances[index]);\\r\\n        return 0;\\r\\n    }\\r\\n\\r\\n    /*** STATE MODIFYING FUNCTIONS ***/\\r\\n\\r\\n    /**\\r\\n     * @notice swap two tokens in the pool\\r\\n     * @param self Swap struct to read from and write to\\r\\n     * @param tokenIndexFrom the token the user wants to sell\\r\\n     * @param tokenIndexTo the token the user wants to buy\\r\\n     * @param dx the amount of tokens the user wants to sell\\r\\n     * @param minDy the min amount the user would like to receive, or revert.\\r\\n     * @return amount of token user received on swap\\r\\n     */\\r\\n    function swap(\\r\\n        Swap storage self,\\r\\n        uint8 tokenIndexFrom,\\r\\n        uint8 tokenIndexTo,\\r\\n        uint256 dx,\\r\\n        uint256 minDy\\r\\n    ) external returns (uint256) {\\r\\n        IgETH gETHReference = self.gETH;\\r\\n        if (tokenIndexFrom == 0) {\\r\\n            // Means user is selling some ETH to the pool to get some gETH.\\r\\n            // In which case, we need to send exactly that amount of ETH.\\r\\n            require(dx == msg.value, \\\"Cannot swap more/less than you sent\\\");\\r\\n        }\\r\\n        if (tokenIndexFrom == 1) {\\r\\n            // Means user is selling some gETH to the pool to get some ETH.\\r\\n\\r\\n            require(\\r\\n                dx <= gETHReference.balanceOf(msg.sender, self.pooledTokenId),\\r\\n                \\\"Cannot swap more than you own\\\"\\r\\n            );\\r\\n\\r\\n            // Transfer tokens first\\r\\n            uint256 beforeBalance = gETHReference.balanceOf(\\r\\n                address(this),\\r\\n                self.pooledTokenId\\r\\n            );\\r\\n            gETHReference.safeTransferFrom(\\r\\n                msg.sender,\\r\\n                address(this),\\r\\n                self.pooledTokenId,\\r\\n                dx,\\r\\n                \\\"\\\"\\r\\n            );\\r\\n\\r\\n            // Use the actual transferred amount for AMM math\\r\\n            dx =\\r\\n                gETHReference.balanceOf(address(this), self.pooledTokenId) -\\r\\n                beforeBalance;\\r\\n        }\\r\\n\\r\\n        uint256 dy;\\r\\n        uint256 dyFee;\\r\\n        // Meaning the real balances *without* any effect of underlying price\\r\\n        // However, when we call _calculateSwap, it uses pricedIn function before calculation,\\r\\n        // and pricedOut function after the calculation. So, we don't need to use priceOut here.\\r\\n        uint256[] memory balances = self.balances;\\r\\n        (dy, dyFee) = _calculateSwap(\\r\\n            self,\\r\\n            tokenIndexFrom,\\r\\n            tokenIndexTo,\\r\\n            dx,\\r\\n            balances\\r\\n        );\\r\\n\\r\\n        require(dy >= minDy, \\\"Swap didn't result in min tokens\\\");\\r\\n        uint256 dyAdminFee = (dyFee * self.adminFee) / PERCENTAGE_DENOMINATOR;\\r\\n\\r\\n        // To prevent any Reentrancy, balances are updated before transfering the tokens.\\r\\n        self.balances[tokenIndexFrom] = balances[tokenIndexFrom] + dx;\\r\\n        self.balances[tokenIndexTo] = balances[tokenIndexTo] - dy - dyAdminFee;\\r\\n\\r\\n        if (tokenIndexTo == 0) {\\r\\n            // Means contract is going to send Idle Ether (ETH)\\r\\n            (bool sent, ) = payable(msg.sender).call{value: dy}(\\\"\\\");\\r\\n            require(sent, \\\"SwapUtils: Failed to send Ether\\\");\\r\\n        }\\r\\n        if (tokenIndexTo == 1) {\\r\\n            // Means contract is going to send staked ETH (gETH)\\r\\n            gETHReference.safeTransferFrom(\\r\\n                address(this),\\r\\n                msg.sender,\\r\\n                self.pooledTokenId,\\r\\n                dy,\\r\\n                \\\"\\\"\\r\\n            );\\r\\n        }\\r\\n\\r\\n        emit TokenSwap(msg.sender, dx, dy, tokenIndexFrom, tokenIndexTo);\\r\\n\\r\\n        return dy;\\r\\n    }\\r\\n\\r\\n    /**\\r\\n     * @notice Add liquidity to the pool\\r\\n     * @param self Swap struct to read from and write to\\r\\n     * @param amounts the amounts of each token to add, in their native precision\\r\\n     * @param minToMint the minimum LP tokens adding this amount of liquidity\\r\\n     * should mint, otherwise revert. Handy for front-running mitigation\\r\\n     * allowed addresses. If the pool is not in the guarded launch phase, this parameter will be ignored.\\r\\n     * @return amount of LP token user received\\r\\n     */\\r\\n    function addLiquidity(\\r\\n        Swap storage self,\\r\\n        uint256[] memory amounts,\\r\\n        uint256 minToMint\\r\\n    ) external returns (uint256) {\\r\\n        require(amounts.length == 2, \\\"Amounts must match pooled tokens\\\");\\r\\n        require(\\r\\n            amounts[0] == msg.value,\\r\\n            \\\"SwapUtils: received less or more ETH than expected\\\"\\r\\n        );\\r\\n        IgETH gETHReference = self.gETH;\\r\\n        // current state\\r\\n        ManageLiquidityInfo memory v = ManageLiquidityInfo(\\r\\n            self.lpToken,\\r\\n            0,\\r\\n            0,\\r\\n            0,\\r\\n            _getAPrecise(self),\\r\\n            0,\\r\\n            self.balances\\r\\n        );\\r\\n        v.totalSupply = v.lpToken.totalSupply();\\r\\n        if (v.totalSupply != 0) {\\r\\n            v.d0 = getD(_pricedInBatch(self, v.balances), v.preciseA);\\r\\n        }\\r\\n\\r\\n        uint256[] memory newBalances = new uint256[](2);\\r\\n        newBalances[0] = v.balances[0] + msg.value;\\r\\n\\r\\n        for (uint256 i = 0; i < 2; i++) {\\r\\n            require(\\r\\n                v.totalSupply != 0 || amounts[i] > 0,\\r\\n                \\\"Must supply all tokens in pool\\\"\\r\\n            );\\r\\n        }\\r\\n\\r\\n        {\\r\\n            // Transfer tokens first\\r\\n            uint256 beforeBalance = gETHReference.balanceOf(\\r\\n                address(this),\\r\\n                self.pooledTokenId\\r\\n            );\\r\\n            gETHReference.safeTransferFrom(\\r\\n                msg.sender,\\r\\n                address(this),\\r\\n                self.pooledTokenId,\\r\\n                amounts[1],\\r\\n                \\\"\\\"\\r\\n            );\\r\\n\\r\\n            // Update the amounts[] with actual transfer amount\\r\\n            amounts[1] =\\r\\n                gETHReference.balanceOf(address(this), self.pooledTokenId) -\\r\\n                beforeBalance;\\r\\n\\r\\n            newBalances[1] = v.balances[1] + amounts[1];\\r\\n        }\\r\\n\\r\\n        // invariant after change\\r\\n        v.d1 = getD(_pricedInBatch(self, newBalances), v.preciseA);\\r\\n        require(v.d1 > v.d0, \\\"D should increase\\\");\\r\\n\\r\\n        // updated to reflect fees and calculate the user's LP tokens\\r\\n        v.d2 = v.d1;\\r\\n        uint256[] memory fees = new uint256[](2);\\r\\n\\r\\n        if (v.totalSupply != 0) {\\r\\n            uint256 feePerToken = self.swapFee / 2;\\r\\n            for (uint256 i = 0; i < 2; i++) {\\r\\n                uint256 idealBalance = (v.d1 * v.balances[i]) / v.d0;\\r\\n                fees[i] =\\r\\n                    (feePerToken * (idealBalance.difference(newBalances[i]))) /\\r\\n                    (PERCENTAGE_DENOMINATOR);\\r\\n                self.balances[i] =\\r\\n                    newBalances[i] -\\r\\n                    ((fees[i] * (self.adminFee)) / (PERCENTAGE_DENOMINATOR));\\r\\n                newBalances[i] = newBalances[i] - (fees[i]);\\r\\n            }\\r\\n            v.d2 = getD(_pricedInBatch(self, newBalances), v.preciseA);\\r\\n        } else {\\r\\n            // the initial depositor doesn't pay fees\\r\\n            self.balances = newBalances;\\r\\n        }\\r\\n\\r\\n        uint256 toMint;\\r\\n        if (v.totalSupply == 0) {\\r\\n            toMint = v.d1;\\r\\n        } else {\\r\\n            toMint = ((v.d2 - v.d0) * v.totalSupply) / v.d0;\\r\\n        }\\r\\n\\r\\n        require(toMint >= minToMint, \\\"Couldn't mint min requested\\\");\\r\\n\\r\\n        // mint the user's LP tokens\\r\\n        v.lpToken.mint(msg.sender, toMint);\\r\\n\\r\\n        emit AddLiquidity(\\r\\n            msg.sender,\\r\\n            amounts,\\r\\n            fees,\\r\\n            v.d1,\\r\\n            v.totalSupply + toMint\\r\\n        );\\r\\n        return toMint;\\r\\n    }\\r\\n\\r\\n    /**\\r\\n     * @notice Burn LP tokens to remove liquidity from the pool.\\r\\n     * @dev Liquidity can always be removed, even when the pool is paused.\\r\\n     * @param self Swap struct to read from and write to\\r\\n     * @param amount the amount of LP tokens to burn\\r\\n     * @param minAmounts the minimum amounts of each token in the pool\\r\\n     * acceptable for this burn. Useful as a front-running mitigation\\r\\n     * @return amounts of tokens the user received\\r\\n     */\\r\\n    function removeLiquidity(\\r\\n        Swap storage self,\\r\\n        uint256 amount,\\r\\n        uint256[] calldata minAmounts\\r\\n    ) external returns (uint256[] memory) {\\r\\n        ILPToken lpToken = self.lpToken;\\r\\n        IgETH gETHReference = self.gETH;\\r\\n        require(amount <= lpToken.balanceOf(msg.sender), \\\">LP.balanceOf\\\");\\r\\n        require(minAmounts.length == 2, \\\"minAmounts must match poolTokens\\\");\\r\\n\\r\\n        uint256[] memory balances = self.balances;\\r\\n        uint256 totalSupply = lpToken.totalSupply();\\r\\n\\r\\n        uint256[] memory amounts = _pricedOutBatch(\\r\\n            self,\\r\\n            _calculateRemoveLiquidity(\\r\\n                _pricedInBatch(self, balances),\\r\\n                amount,\\r\\n                totalSupply\\r\\n            )\\r\\n        );\\r\\n\\r\\n        for (uint256 i = 0; i < amounts.length; i++) {\\r\\n            require(amounts[i] >= minAmounts[i], \\\"amounts[i] < minAmounts[i]\\\");\\r\\n            self.balances[i] = balances[i] - amounts[i];\\r\\n        }\\r\\n\\r\\n        // To prevent any Reentrancy, LP tokens are burned before transfering the tokens.\\r\\n        lpToken.burnFrom(msg.sender, amount);\\r\\n\\r\\n        (bool sent, ) = payable(msg.sender).call{value: amounts[0]}(\\\"\\\");\\r\\n        require(sent, \\\"SwapUtils: Failed to send Ether\\\");\\r\\n\\r\\n        gETHReference.safeTransferFrom(\\r\\n            address(this),\\r\\n            msg.sender,\\r\\n            self.pooledTokenId,\\r\\n            amounts[1],\\r\\n            \\\"\\\"\\r\\n        );\\r\\n\\r\\n        emit RemoveLiquidity(msg.sender, amounts, totalSupply - amount);\\r\\n        return amounts;\\r\\n    }\\r\\n\\r\\n    /**\\r\\n     * @notice Remove liquidity from the pool all in one token.\\r\\n     * @param self Swap struct to read from and write to\\r\\n     * @param tokenAmount the amount of the lp tokens to burn\\r\\n     * @param tokenIndex the index of the token you want to receive\\r\\n     * @param minAmount the minimum amount to withdraw, otherwise revert\\r\\n     * @return amount chosen token that user received\\r\\n     */\\r\\n    function removeLiquidityOneToken(\\r\\n        Swap storage self,\\r\\n        uint256 tokenAmount,\\r\\n        uint8 tokenIndex,\\r\\n        uint256 minAmount\\r\\n    ) external returns (uint256) {\\r\\n        ILPToken lpToken = self.lpToken;\\r\\n        IgETH gETHReference = self.gETH;\\r\\n\\r\\n        require(tokenAmount <= lpToken.balanceOf(msg.sender), \\\">LP.balanceOf\\\");\\r\\n        require(tokenIndex < 2, \\\"Token not found\\\");\\r\\n\\r\\n        uint256 totalSupply = lpToken.totalSupply();\\r\\n\\r\\n        (uint256 dy, uint256 dyFee) = _calculateWithdrawOneToken(\\r\\n            self,\\r\\n            tokenAmount,\\r\\n            tokenIndex,\\r\\n            totalSupply\\r\\n        );\\r\\n\\r\\n        require(dy >= minAmount, \\\"dy < minAmount\\\");\\r\\n\\r\\n        // To prevent any Reentrancy, LP tokens are burned before transfering the tokens.\\r\\n        self.balances[tokenIndex] =\\r\\n            self.balances[tokenIndex] -\\r\\n            (dy + ((dyFee * (self.adminFee)) / (PERCENTAGE_DENOMINATOR)));\\r\\n        lpToken.burnFrom(msg.sender, tokenAmount);\\r\\n\\r\\n        if (tokenIndex == 0) {\\r\\n            (bool sent, ) = payable(msg.sender).call{value: dy}(\\\"\\\");\\r\\n            require(sent, \\\"SwapUtils: Failed to send Ether\\\");\\r\\n        }\\r\\n        if (tokenIndex == 1) {\\r\\n            gETHReference.safeTransferFrom(\\r\\n                address(this),\\r\\n                msg.sender,\\r\\n                self.pooledTokenId,\\r\\n                dy,\\r\\n                \\\"\\\"\\r\\n            );\\r\\n        }\\r\\n\\r\\n        emit RemoveLiquidityOne(\\r\\n            msg.sender,\\r\\n            tokenAmount,\\r\\n            totalSupply,\\r\\n            tokenIndex,\\r\\n            dy\\r\\n        );\\r\\n\\r\\n        return dy;\\r\\n    }\\r\\n\\r\\n    /**\\r\\n     * @notice Remove liquidity from the pool, weighted differently than the\\r\\n     * pool's current balances.\\r\\n     *\\r\\n     * @param self Swap struct to read from and write to\\r\\n     * @param amounts how much of each token to withdraw\\r\\n     * @param maxBurnAmount the max LP token provider is willing to pay to\\r\\n     * remove liquidity. Useful as a front-running mitigation.\\r\\n     * @return actual amount of LP tokens burned in the withdrawal\\r\\n     */\\r\\n    function removeLiquidityImbalance(\\r\\n        Swap storage self,\\r\\n        uint256[] memory amounts,\\r\\n        uint256 maxBurnAmount\\r\\n    ) public returns (uint256) {\\r\\n        IgETH gETHReference = self.gETH;\\r\\n\\r\\n        ManageLiquidityInfo memory v = ManageLiquidityInfo(\\r\\n            self.lpToken,\\r\\n            0,\\r\\n            0,\\r\\n            0,\\r\\n            _getAPrecise(self),\\r\\n            0,\\r\\n            self.balances\\r\\n        );\\r\\n        v.totalSupply = v.lpToken.totalSupply();\\r\\n\\r\\n        require(amounts.length == 2, \\\"Amounts should match pool tokens\\\");\\r\\n\\r\\n        require(\\r\\n            maxBurnAmount <= v.lpToken.balanceOf(msg.sender) &&\\r\\n                maxBurnAmount != 0,\\r\\n            \\\">LP.balanceOf\\\"\\r\\n        );\\r\\n\\r\\n        uint256 feePerToken = self.swapFee / 2;\\r\\n        uint256[] memory fees = new uint256[](2);\\r\\n\\r\\n        {\\r\\n            uint256[] memory balances1 = new uint256[](2);\\r\\n\\r\\n            v.d0 = getD(_pricedInBatch(self, v.balances), v.preciseA);\\r\\n            for (uint256 i = 0; i < 2; i++) {\\r\\n                require(\\r\\n                    amounts[i] <= v.balances[i],\\r\\n                    \\\"Cannot withdraw more than available\\\"\\r\\n                );\\r\\n                balances1[i] = v.balances[i] - amounts[i];\\r\\n            }\\r\\n            v.d1 = getD(_pricedInBatch(self, balances1), v.preciseA);\\r\\n\\r\\n            for (uint256 i = 0; i < 2; i++) {\\r\\n                uint256 idealBalance = (v.d1 * v.balances[i]) / v.d0;\\r\\n                uint256 difference = idealBalance.difference(balances1[i]);\\r\\n                fees[i] = (feePerToken * difference) / PERCENTAGE_DENOMINATOR;\\r\\n                uint256 adminFee = self.adminFee;\\r\\n                {\\r\\n                    self.balances[i] =\\r\\n                        balances1[i] -\\r\\n                        ((fees[i] * adminFee) / PERCENTAGE_DENOMINATOR);\\r\\n                }\\r\\n                balances1[i] = balances1[i] - fees[i];\\r\\n            }\\r\\n\\r\\n            v.d2 = getD(_pricedInBatch(self, balances1), v.preciseA);\\r\\n        }\\r\\n\\r\\n        uint256 tokenAmount = ((v.d0 - v.d2) * (v.totalSupply)) / v.d0;\\r\\n        require(tokenAmount != 0, \\\"Burnt amount cannot be zero\\\");\\r\\n        tokenAmount = tokenAmount + 1;\\r\\n\\r\\n        require(tokenAmount <= maxBurnAmount, \\\"tokenAmount > maxBurnAmount\\\");\\r\\n\\r\\n        // To prevent any Reentrancy, LP tokens are burned before transfering the tokens.\\r\\n        v.lpToken.burnFrom(msg.sender, tokenAmount);\\r\\n\\r\\n        (bool sent, ) = payable(msg.sender).call{value: amounts[0]}(\\\"\\\");\\r\\n        require(sent, \\\"SwapUtils: Failed to send Ether\\\");\\r\\n\\r\\n        gETHReference.safeTransferFrom(\\r\\n            address(this),\\r\\n            msg.sender,\\r\\n            self.pooledTokenId,\\r\\n            amounts[1],\\r\\n            \\\"\\\"\\r\\n        );\\r\\n\\r\\n        emit RemoveLiquidityImbalance(\\r\\n            msg.sender,\\r\\n            amounts,\\r\\n            fees,\\r\\n            v.d1,\\r\\n            v.totalSupply - tokenAmount\\r\\n        );\\r\\n\\r\\n        return tokenAmount;\\r\\n    }\\r\\n\\r\\n    /**\\r\\n     * @notice donate ETH and gETH to the pool as fee with respect to derivative price\\r\\n     * @param self Swap struct to deposit fees\\r\\n     * @param EthDonation amount of ETH to donate into the pool\\r\\n     * @param gEthDonation amount of gETH to donate into the pool\\r\\n     */\\r\\n    function donateBalancedFees(\\r\\n        Swap storage self,\\r\\n        uint256 EthDonation,\\r\\n        uint256 gEthDonation\\r\\n    ) external returns (uint256, uint256) {\\r\\n        {\\r\\n            IgETH gETHReference = self.gETH;\\r\\n            // Transfer tokens first\\r\\n            uint256 beforeBalance = gETHReference.balanceOf(\\r\\n                address(this),\\r\\n                self.pooledTokenId\\r\\n            );\\r\\n            gETHReference.safeTransferFrom(\\r\\n                msg.sender,\\r\\n                address(this),\\r\\n                self.pooledTokenId,\\r\\n                gEthDonation,\\r\\n                \\\"\\\"\\r\\n            );\\r\\n\\r\\n            // Use the actual transferred amount\\r\\n            gEthDonation =\\r\\n                gETHReference.balanceOf(address(this), self.pooledTokenId) -\\r\\n                beforeBalance;\\r\\n        }\\r\\n        require(\\r\\n            _pricedIn(self, gEthDonation, 1) == EthDonation,\\r\\n            \\\"SwapUtils: MUST respect to derivative price\\\"\\r\\n        );\\r\\n        self.balances[0] +=\\r\\n            EthDonation -\\r\\n            (EthDonation * self.adminFee) /\\r\\n            PERCENTAGE_DENOMINATOR;\\r\\n        self.balances[1] +=\\r\\n            gEthDonation -\\r\\n            (gEthDonation * self.adminFee) /\\r\\n            PERCENTAGE_DENOMINATOR;\\r\\n        return (EthDonation, gEthDonation);\\r\\n    }\\r\\n\\r\\n    /**\\r\\n     * @notice withdraw all admin fees to a given address\\r\\n     * @param self Swap struct to withdraw fees from\\r\\n     * @param to Address to send the fees to\\r\\n     */\\r\\n    function withdrawAdminFees(Swap storage self, address to) external {\\r\\n        IgETH gETHReference = self.gETH;\\r\\n        uint256 tokenBalance = gETHReference.balanceOf(\\r\\n            address(this),\\r\\n            self.pooledTokenId\\r\\n        ) - self.balances[1];\\r\\n        if (tokenBalance != 0) {\\r\\n            gETHReference.safeTransferFrom(\\r\\n                address(this),\\r\\n                to,\\r\\n                self.pooledTokenId,\\r\\n                tokenBalance,\\r\\n                \\\"\\\"\\r\\n            );\\r\\n        }\\r\\n\\r\\n        uint256 etherBalance = address(this).balance - self.balances[0];\\r\\n        if (etherBalance != 0) {\\r\\n            (bool sent, ) = payable(msg.sender).call{value: etherBalance}(\\\"\\\");\\r\\n            require(sent, \\\"SwapUtils: Failed to send Ether\\\");\\r\\n        }\\r\\n    }\\r\\n\\r\\n    /**\\r\\n     * @notice Sets the admin fee\\r\\n     * @dev adminFee cannot be higher than 100% of the swap fee\\r\\n     * @param self Swap struct to update\\r\\n     * @param newAdminFee new admin fee to be applied on future transactions\\r\\n     */\\r\\n    function setAdminFee(Swap storage self, uint256 newAdminFee) external {\\r\\n        require(newAdminFee <= MAX_ADMIN_FEE, \\\"Fee is too high\\\");\\r\\n        self.adminFee = newAdminFee;\\r\\n\\r\\n        emit NewAdminFee(newAdminFee);\\r\\n    }\\r\\n\\r\\n    /**\\r\\n     * @notice update the swap fee\\r\\n     * @dev fee cannot be higher than 1% of each swap\\r\\n     * @param self Swap struct to update\\r\\n     * @param newSwapFee new swap fee to be applied on future transactions\\r\\n     */\\r\\n    function setSwapFee(Swap storage self, uint256 newSwapFee) external {\\r\\n        require(newSwapFee <= MAX_SWAP_FEE, \\\"Fee is too high\\\");\\r\\n        self.swapFee = newSwapFee;\\r\\n\\r\\n        emit NewSwapFee(newSwapFee);\\r\\n    }\\r\\n}\\r\\n\",\"keccak256\":\"0x62501de74fa223ca4e9bc9b9f7fb4daafca4693d36d64386e7a74cbaf7bb77f3\",\"license\":\"MIT\"},\"contracts/interfaces/ILPToken.sol\":{\"content\":\"// SPDX-License-Identifier: MIT\\r\\n\\r\\npragma solidity =0.8.7;\\r\\n\\r\\ninterface ILPToken {\\r\\n    function allowance(address owner, address spender)\\r\\n        external\\r\\n        view\\r\\n        returns (uint256);\\r\\n\\r\\n    function approve(address spender, uint256 amount) external returns (bool);\\r\\n\\r\\n    function balanceOf(address account) external view returns (uint256);\\r\\n\\r\\n    function burn(uint256 amount) external;\\r\\n\\r\\n    function burnFrom(address account, uint256 amount) external;\\r\\n\\r\\n    function decimals() external view returns (uint8);\\r\\n\\r\\n    function decreaseAllowance(address spender, uint256 subtractedValue)\\r\\n        external\\r\\n        returns (bool);\\r\\n\\r\\n    function increaseAllowance(address spender, uint256 addedValue)\\r\\n        external\\r\\n        returns (bool);\\r\\n\\r\\n    function initialize(string memory name, string memory symbol)\\r\\n        external\\r\\n        returns (bool);\\r\\n\\r\\n    function mint(address recipient, uint256 amount) external;\\r\\n\\r\\n    function name() external view returns (string memory);\\r\\n\\r\\n    function owner() external view returns (address);\\r\\n\\r\\n    function renounceOwnership() external;\\r\\n\\r\\n    function symbol() external view returns (string memory);\\r\\n\\r\\n    function totalSupply() external view returns (uint256);\\r\\n\\r\\n    function transfer(address to, uint256 amount) external returns (bool);\\r\\n\\r\\n    function transferFrom(\\r\\n        address from,\\r\\n        address to,\\r\\n        uint256 amount\\r\\n    ) external returns (bool);\\r\\n\\r\\n    function transferOwnership(address newOwner) external;\\r\\n}\\r\\n\",\"keccak256\":\"0x6b2b267ab9433da79265b376641d50d5ac1c6ed77bdb822b58f908fc0b70ed9d\",\"license\":\"MIT\"},\"contracts/interfaces/IgETH.sol\":{\"content\":\"// SPDX-License-Identifier: MIT\\r\\npragma solidity =0.8.7;\\r\\n\\r\\ninterface IgETH {\\r\\n    function supportsInterface(bytes4 interfaceId) external view returns (bool);\\r\\n\\r\\n    function uri(uint256) external view returns (string memory);\\r\\n\\r\\n    function balanceOf(address account, uint256 id)\\r\\n        external\\r\\n        view\\r\\n        returns (uint256);\\r\\n\\r\\n    function balanceOfBatch(address[] memory accounts, uint256[] memory ids)\\r\\n        external\\r\\n        view\\r\\n        returns (uint256[] memory);\\r\\n\\r\\n    function setApprovalForAll(address operator, bool approved) external;\\r\\n\\r\\n    function isApprovedForAll(address account, address operator)\\r\\n        external\\r\\n        view\\r\\n        returns (bool);\\r\\n\\r\\n    function safeTransferFrom(\\r\\n        address from,\\r\\n        address to,\\r\\n        uint256 id,\\r\\n        uint256 amount,\\r\\n        bytes memory data\\r\\n    ) external;\\r\\n\\r\\n    function safeBatchTransferFrom(\\r\\n        address from,\\r\\n        address to,\\r\\n        uint256[] memory ids,\\r\\n        uint256[] memory amounts,\\r\\n        bytes memory data\\r\\n    ) external;\\r\\n\\r\\n    function burn(\\r\\n        address account,\\r\\n        uint256 id,\\r\\n        uint256 value\\r\\n    ) external;\\r\\n\\r\\n    function burnBatch(\\r\\n        address account,\\r\\n        uint256[] memory ids,\\r\\n        uint256[] memory values\\r\\n    ) external;\\r\\n\\r\\n    function totalSupply(uint256 id) external view returns (uint256);\\r\\n\\r\\n    function exists(uint256 id) external view returns (bool);\\r\\n\\r\\n    function mint(\\r\\n        address to,\\r\\n        uint256 id,\\r\\n        uint256 amount,\\r\\n        bytes memory data\\r\\n    ) external;\\r\\n\\r\\n    function mintBatch(\\r\\n        address to,\\r\\n        uint256[] memory ids,\\r\\n        uint256[] memory amounts,\\r\\n        bytes memory data\\r\\n    ) external;\\r\\n\\r\\n    function pause() external;\\r\\n\\r\\n    function unpause() external;\\r\\n\\r\\n    function denominator() external view returns (uint256);\\r\\n\\r\\n    function pricePerShare(uint256 id) external view returns (uint256);\\r\\n\\r\\n    function priceUpdateTimestamp(uint256 id) external view returns (uint256);\\r\\n\\r\\n    function setPricePerShare(uint256 price, uint256 id) external;\\r\\n\\r\\n    function isInterface(address _interface, uint256 id)\\r\\n        external\\r\\n        view\\r\\n        returns (bool);\\r\\n\\r\\n    function setInterface(\\r\\n        address _interface,\\r\\n        uint256 id,\\r\\n        bool isSet\\r\\n    ) external;\\r\\n\\r\\n    function updateMinterRole(address Minter) external;\\r\\n\\r\\n    function updatePauserRole(address Pauser) external;\\r\\n\\r\\n    function updateOracleRole(address Oracle) external;\\r\\n}\\r\\n\",\"keccak256\":\"0x233c5eef588ce7699ead6ef2eddd219104331f819ffab3ac5dcd9a5aa09667f7\",\"license\":\"MIT\"}},\"version\":1}",
  "bytecode": "0x61498e61003a600b82828239805160001a60731461002d57634e487b7160e01b600052600060045260246000fd5b30600052607381538281f3fe73000000000000000000000000000000000000000030146080604052600436106101205760003560e01c80637d048160116100ac578063aa0ce1861161007b578063aa0ce186146102bb578063ab3d8544146102ce578063e0692742146102d9578063e7a4db81146102ec578063f3de03621461030c57600080fd5b80637d04816014610240578063834b4910146102535780638fc0f95914610266578063a5397b221461029b57600080fd5b80634b23603c116100f35780634b23603c146101ba57806370467276146101cd57806370703e4a146101ed57806371906c2c1461020d57806373fd6b3e1461022057600080fd5b806324c5c7511461012557806340370edf1461014757806341b91c261461017a578063467e186c1461019a575b600080fd5b81801561013157600080fd5b50610145610140366004614276565b610318565b005b81801561015357600080fd5b50610167610162366004614316565b6104f7565b6040519081526020015b60405180910390f35b81801561018657600080fd5b50610167610195366004614316565b610e1f565b8180156101a657600080fd5b506101456101b53660046143ef565b6115f1565b6101676101c8366004614502565b611676565b8180156101d957600080fd5b506101456101e83660046143ef565b6116e1565b6102006101fb3660046143ef565b61175f565b6040516101719190614629565b61016761021b36600461425d565b611855565b81801561022c57600080fd5b5061020061023b366004614411565b61198d565b61016761024e3660046143ef565b611e2e565b6101676102613660046142b2565b611f47565b81801561027257600080fd5b50610286610281366004614464565b6121d6565b60408051928352602083019190915201610171565b8180156102a757600080fd5b506101676102b6366004614536565b612490565b6101676102c936600461425d565b612a1f565b6101676305f5e10081565b6101676102e7366004614490565b612a8d565b8180156102f857600080fd5b506101676103073660046144c5565b612b23565b6101676402540be40081565b81546009830180546001600160a01b03909216916000919060019081106103415761034161492c565b6000918252602090912001546002850154604051627eeac760e11b81526001600160a01b0385169162fdd58e9161037c913091600401614610565b60206040518083038186803b15801561039457600080fd5b505afa1580156103a8573d6000803e3d6000fd5b505050506040513d601f19601f820116820180604052508101906103cc9190614584565b6103d691906148e4565b90508015610447576002840154604051637921219560e11b81526001600160a01b0384169163f242432a9161041491309188919087906004016145d8565b600060405180830381600087803b15801561042e57600080fd5b505af1158015610442573d6000803e3d6000fd5b505050505b60008460090160008154811061045f5761045f61492c565b90600052602060002001544761047591906148e4565b905080156104f057604051600090339083908381818185875af1925050503d80600081146104bf576040519150601f19603f3d011682016040523d82523d6000602084013e6104c4565b606091505b50509050806104ee5760405162461bcd60e51b81526004016104e5906146ff565b60405180910390fd5b505b5050505050565b6000825160021461054a5760405162461bcd60e51b815260206004820181905260248201527f416d6f756e7473206d757374206d6174636820706f6f6c656420746f6b656e7360448201526064016104e5565b348360008151811061055e5761055e61492c565b6020026020010151146105ce5760405162461bcd60e51b815260206004820152603260248201527f537761705574696c733a207265636569766564206c657373206f72206d6f726560448201527108115512081d1a185b88195e1c1958dd195960721b60648201526084016104e5565b83546040805160e08101825260018701546001600160a01b03908116825260006020830181905292820183905260608201839052909216916080810161061388612ef1565b8152602001600081526020018760090180548060200260200160405190810160405280929190818152602001828054801561066d57602002820191906000526020600020905b815481526020019060010190808311610659575b5050505050815250905080600001516001600160a01b03166318160ddd6040518163ffffffff1660e01b815260040160206040518083038186803b1580156106b457600080fd5b505afa1580156106c8573d6000803e3d6000fd5b505050506040513d601f19601f820116820180604052508101906106ec9190614584565b60a082018190521561071957610713610709878360c00151612efc565b82608001516130d3565b60208201525b604080516002808252606082018352600092602083019080368337019050509050348260c001516000815181106107525761075261492c565b602002602001015161076491906147a0565b816000815181106107775761077761492c565b60200260200101818152505060005b60028110156108185760a08301511515806107ba575060008782815181106107b0576107b061492c565b6020026020010151115b6108065760405162461bcd60e51b815260206004820152601e60248201527f4d75737420737570706c7920616c6c20746f6b656e7320696e20706f6f6c000060448201526064016104e5565b80610810816148fb565b915050610786565b506002870154604051627eeac760e11b81526000916001600160a01b0386169162fdd58e9161084c91309190600401614610565b60206040518083038186803b15801561086457600080fd5b505afa158015610878573d6000803e3d6000fd5b505050506040513d601f19601f8201168201806040525081019061089c9190614584565b9050836001600160a01b031663f242432a33308b600201548b6001815181106108c7576108c761492c565b60200260200101516040518563ffffffff1660e01b81526004016108ee94939291906145d8565b600060405180830381600087803b15801561090857600080fd5b505af115801561091c573d6000803e3d6000fd5b5050506002890154604051627eeac760e11b81528392506001600160a01b0387169162fdd58e91610951913091600401614610565b60206040518083038186803b15801561096957600080fd5b505afa15801561097d573d6000803e3d6000fd5b505050506040513d601f19601f820116820180604052508101906109a19190614584565b6109ab91906148e4565b876001815181106109be576109be61492c565b602002602001018181525050866001815181106109dd576109dd61492c565b60200260200101518360c001516001815181106109fc576109fc61492c565b6020026020010151610a0e91906147a0565b82600181518110610a2157610a2161492c565b60200260200101818152505050610a45610a3b8883612efc565b83608001516130d3565b60408301819052602083015110610a925760405162461bcd60e51b8152602060048201526011602482015270442073686f756c6420696e63726561736560781b60448201526064016104e5565b60408281015160608085019190915281516002808252918101835260009290919060208301908036833750505060a084015190915015610ca257600060028960070154610adf91906147b8565b905060005b6002811015610c7f57600085602001518660c001518381518110610b0a57610b0a61492c565b60200260200101518760400151610b2191906148c5565b610b2b91906147b8565b90506402540be400610b5f868481518110610b4857610b4861492c565b6020026020010151836132bb90919063ffffffff16565b610b6990856148c5565b610b7391906147b8565b848381518110610b8557610b8561492c565b6020026020010181815250506402540be4008b60080154858481518110610bae57610bae61492c565b6020026020010151610bc091906148c5565b610bca91906147b8565b858381518110610bdc57610bdc61492c565b6020026020010151610bee91906148e4565b8b6009018381548110610c0357610c0361492c565b9060005260206000200181905550838281518110610c2357610c2361492c565b6020026020010151858381518110610c3d57610c3d61492c565b6020026020010151610c4f91906148e4565b858381518110610c6157610c6161492c565b60209081029190910101525080610c77816148fb565b915050610ae4565b50610c97610c8d8a85612efc565b85608001516130d3565b606085015250610cb9565b8151610cb79060098a0190602085019061419b565b505b60008360a0015160001415610cd357506040830151610d04565b602084015160a08501516060860151610ced9083906148e4565b610cf791906148c5565b610d0191906147b8565b90505b86811015610d545760405162461bcd60e51b815260206004820152601b60248201527f436f756c646e2774206d696e74206d696e20726571756573746564000000000060448201526064016104e5565b83516040516340c10f1960e01b81526001600160a01b03909116906340c10f1990610d859033908590600401614610565b600060405180830381600087803b158015610d9f57600080fd5b505af1158015610db3573d6000803e3d6000fd5b50505050336001600160a01b03167f189c623b666b1b45b83d7178f39b8c087cb09774317ca2f53c2d3c3726f222a289848760400151858960a00151610df991906147a0565b604051610e09949392919061466d565b60405180910390a29450505050505b9392505050565b82546040805160e08101825260018601546001600160a01b0390811682526000602083018190529282018390526060820183905291929190911690829060808101610e6988612ef1565b81526020016000815260200187600901805480602002602001604051908101604052809291908181526020018280548015610ec357602002820191906000526020600020905b815481526020019060010190808311610eaf575b5050505050815250905080600001516001600160a01b03166318160ddd6040518163ffffffff1660e01b815260040160206040518083038186803b158015610f0a57600080fd5b505afa158015610f1e573d6000803e3d6000fd5b505050506040513d601f19601f82011682018060405250810190610f429190614584565b60a08201528451600214610f985760405162461bcd60e51b815260206004820181905260248201527f416d6f756e74732073686f756c64206d6174636820706f6f6c20746f6b656e7360448201526064016104e5565b80516040516370a0823160e01b81523360048201526001600160a01b03909116906370a082319060240160206040518083038186803b158015610fda57600080fd5b505afa158015610fee573d6000803e3d6000fd5b505050506040513d601f19601f820116820180604052508101906110129190614584565b841115801561102057508315155b61103c5760405162461bcd60e51b81526004016104e590614779565b60006002876007015461104f91906147b8565b60408051600280825260608201835292935060009290916020830190803683375050604080516002808252606082018352939450600093909250906020830190803683370190505090506110aa610c8d8a8660c00151612efc565b602085015260005b6002811015611182578460c0015181815181106110d1576110d161492c565b60200260200101518982815181106110eb576110eb61492c565b602002602001015111156111115760405162461bcd60e51b81526004016104e590614736565b8881815181106111235761112361492c565b60200260200101518560c0015182815181106111415761114161492c565b602002602001015161115391906148e4565b8282815181106111655761116561492c565b60209081029190910101528061117a816148fb565b9150506110b2565b50611190610c8d8a83612efc565b604085015260005b600281101561132957600085602001518660c0015183815181106111be576111be61492c565b602002602001015187604001516111d591906148c5565b6111df91906147b8565b905060006111f8848481518110610b4857610b4861492c565b90506402540be40061120a82886148c5565b61121491906147b8565b8584815181106112265761122661492c565b60200260200101818152505060008c6008015490506402540be400818786815181106112545761125461492c565b602002602001015161126691906148c5565b61127091906147b8565b8585815181106112825761128261492c565b602002602001015161129491906148e4565b8d60090185815481106112a9576112a961492c565b90600052602060002001819055508584815181106112c9576112c961492c565b60200260200101518585815181106112e3576112e361492c565b60200260200101516112f591906148e4565b8585815181106113075761130761492c565b6020026020010181815250505050508080611321906148fb565b915050611198565b50611337610c8d8a83612efc565b60608501819052602085015160a086015160009350909161135890836148e4565b61136291906148c5565b61136c91906147b8565b9050806113bb5760405162461bcd60e51b815260206004820152601b60248201527f4275726e7420616d6f756e742063616e6e6f74206265207a65726f000000000060448201526064016104e5565b6113c68160016147a0565b9050868111156114185760405162461bcd60e51b815260206004820152601b60248201527f746f6b656e416d6f756e74203e206d61784275726e416d6f756e74000000000060448201526064016104e5565b835160405163079cc67960e41b81526001600160a01b03909116906379cc6790906114499033908590600401614610565b600060405180830381600087803b15801561146357600080fd5b505af1158015611477573d6000803e3d6000fd5b505050506000336001600160a01b03168960008151811061149a5761149a61492c565b602002602001015160405160006040518083038185875af1925050503d80600081146114e2576040519150601f19603f3d011682016040523d82523d6000602084013e6114e7565b606091505b50509050806115085760405162461bcd60e51b81526004016104e5906146ff565b856001600160a01b031663f242432a30338d600201548d6001815181106115315761153161492c565b60200260200101516040518563ffffffff1660e01b815260040161155894939291906145d8565b600060405180830381600087803b15801561157257600080fd5b505af1158015611586573d6000803e3d6000fd5b50505050336001600160a01b03167f3631c28b1f9dd213e0319fb167b554d76b6c283a41143eb400a0d1adb1af17558a858860400151868a60a001516115cc91906148e4565b6040516115dc949392919061466d565b60405180910390a25098975050505050505050565b6305f5e1008111156116375760405162461bcd60e51b815260206004820152600f60248201526e08ccaca40d2e640e8dede40d0d2ced608b1b60448201526064016104e5565b600782018190556040518181527fd88ea5155021c6f8dafa1a741e173f595cdf77ce7c17d43342131d7f06afdfe5906020015b60405180910390a15050565b60006116d785858585896009018054806020026020016040519081016040528092919081815260200182805480156116cd57602002820191906000526020600020905b8154815260200190600101908083116116b9575b50505050506132d9565b5095945050505050565b6402540be4008111156117285760405162461bcd60e51b815260206004820152600f60248201526e08ccaca40d2e640e8dede40d0d2ced608b1b60448201526064016104e5565b600882018190556040518181527fab599d640ca80cde2b09b128a4154a8dfe608cb80f4c9399c8b954b01fd35f389060200161166a565b606061184c836118476117c486876009018054806020026020016040519081016040528092919081815260200182805480156117ba57602002820191906000526020600020905b8154815260200190600101908083116117a6575b5050505050612efc565b6001870154604080516318160ddd60e01b8152905188926001600160a01b0316916318160ddd916004808301926020929190829003018186803b15801561180a57600080fd5b505afa15801561181e573d6000803e3d6000fd5b505050506040513d601f19601f820116820180604052508101906118429190614584565b6133ec565b613506565b90505b92915050565b6000806118c36118b584856009018054806020026020016040519081016040528092919081815260200182805480156117ba57602002820191906000526020600020908154815260200190600101908083116117a6575050505050612efc565b6118be85612ef1565b6130d3565b905060008360010160009054906101000a90046001600160a01b031690506000816001600160a01b03166318160ddd6040518163ffffffff1660e01b815260040160206040518083038186803b15801561191c57600080fd5b505afa158015611930573d6000803e3d6000fd5b505050506040513d601f19601f820116820180604052508101906119549190614584565b90508015611982578061196f84670de0b6b3a76400006148c5565b61197991906147b8565b95945050505050565b506000949350505050565b600184015484546040516370a0823160e01b81523360048201526060926001600160a01b0390811692169082906370a082319060240160206040518083038186803b1580156119db57600080fd5b505afa1580156119ef573d6000803e3d6000fd5b505050506040513d601f19601f82011682018060405250810190611a139190614584565b861115611a325760405162461bcd60e51b81526004016104e590614779565b60028414611a825760405162461bcd60e51b815260206004820181905260248201527f6d696e416d6f756e7473206d757374206d6174636820706f6f6c546f6b656e7360448201526064016104e5565b600087600901805480602002602001604051908101604052809291908181526020018280548015611ad257602002820191906000526020600020905b815481526020019060010190808311611abe575b505050505090506000836001600160a01b03166318160ddd6040518163ffffffff1660e01b815260040160206040518083038186803b158015611b1457600080fd5b505afa158015611b28573d6000803e3d6000fd5b505050506040513d601f19601f82011682018060405250810190611b4c9190614584565b90506000611b688a611847611b618d87612efc565b8c866133ec565b905060005b8151811015611c6857888882818110611b8857611b8861492c565b90506020020135828281518110611ba157611ba161492c565b60200260200101511015611bf75760405162461bcd60e51b815260206004820152601a60248201527f616d6f756e74735b695d203c206d696e416d6f756e74735b695d00000000000060448201526064016104e5565b818181518110611c0957611c0961492c565b6020026020010151848281518110611c2357611c2361492c565b6020026020010151611c3591906148e4565b8b6009018281548110611c4a57611c4a61492c565b60009182526020909120015580611c60816148fb565b915050611b6d565b5060405163079cc67960e41b81526001600160a01b038616906379cc679090611c979033908d90600401614610565b600060405180830381600087803b158015611cb157600080fd5b505af1158015611cc5573d6000803e3d6000fd5b505050506000336001600160a01b031682600081518110611ce857611ce861492c565b602002602001015160405160006040518083038185875af1925050503d8060008114611d30576040519150601f19603f3d011682016040523d82523d6000602084013e611d35565b606091505b5050905080611d565760405162461bcd60e51b81526004016104e5906146ff565b846001600160a01b031663f242432a30338e6002015486600181518110611d7f57611d7f61492c565b60200260200101516040518563ffffffff1660e01b8152600401611da694939291906145d8565b600060405180830381600087803b158015611dc057600080fd5b505af1158015611dd4573d6000803e3d6000fd5b503392507f88d38ed598fdd809c2bf01ee49cd24b7fdabf379a83d29567952b60324d58cef9150849050611e088d876148e4565b604051611e169291906146a6565b60405180910390a2509450505050505b949350505050565b600060028210611e505760405162461bcd60e51b81526004016104e5906146c8565b81611e8757826009018281548110611e6a57611e6a61492c565b906000526020600020015447611e8091906148e4565b905061184f565b8160011415611f3e57826009018281548110611ea557611ea561492c565b60009182526020909120015483546002850154604051627eeac760e11b81526001600160a01b039092169162fdd58e91611ee491309190600401614610565b60206040518083038186803b158015611efc57600080fd5b505afa158015611f10573d6000803e3d6000fd5b505050506040513d601f19601f82011682018060405250810190611f349190614584565b611e8091906148e4565b50600092915050565b600080611f5386612ef1565b9050600086600901805480602002602001604051908101604052809291908181526020018280548015611fa557602002820191906000526020600020905b815481526020019060010190808311611f91575b505050505090506000611fc1611fbb8984612efc565b846130d3565b905060005b82518110156120f457851561203557878782818110611fe757611fe761492c565b905060200201358382815181106120005761200061492c565b602002602001015161201291906147a0565b8382815181106120245761202461492c565b6020026020010181815250506120e2565b8281815181106120475761204761492c565b60200260200101518888838181106120615761206161492c565b9050602002013511156120865760405162461bcd60e51b81526004016104e590614736565b8787828181106120985761209861492c565b905060200201358382815181106120b1576120b161492c565b60200260200101516120c391906148e4565b8382815181106120d5576120d561492c565b6020026020010181815250505b806120ec816148fb565b915050611fc6565b50600061210a6121048a85612efc565b856130d3565b905060008960010160009054906101000a90046001600160a01b03166001600160a01b03166318160ddd6040518163ffffffff1660e01b815260040160206040518083038186803b15801561215e57600080fd5b505afa158015612172573d6000803e3d6000fd5b505050506040513d601f19601f820116820180604052508101906121969190614584565b905086156121ca5782816121aa82856148e4565b6121b491906148c5565b6121be91906147b8565b95505050505050611e26565b82816121aa84836148e4565b82546002840154604051627eeac760e11b815260009283926001600160a01b03909116918391839162fdd58e9161221291309190600401614610565b60206040518083038186803b15801561222a57600080fd5b505afa15801561223e573d6000803e3d6000fd5b505050506040513d601f19601f820116820180604052508101906122629190614584565b6002880154604051637921219560e11b81529192506001600160a01b0384169163f242432a9161229a91339130918b906004016145d8565b600060405180830381600087803b1580156122b457600080fd5b505af11580156122c8573d6000803e3d6000fd5b5050506002880154604051627eeac760e11b81528392506001600160a01b0385169162fdd58e916122fd913091600401614610565b60206040518083038186803b15801561231557600080fd5b505afa158015612329573d6000803e3d6000fd5b505050506040513d601f19601f8201168201806040525081019061234d9190614584565b61235791906148e4565b945050508361236886856001613653565b146123c95760405162461bcd60e51b815260206004820152602b60248201527f537761705574696c733a204d555354207265737065637420746f20646572697660448201526a617469766520707269636560a81b60648201526084016104e5565b6402540be4008560080154856123df91906148c5565b6123e991906147b8565b6123f390856148e4565b856009016000815481106124095761240961492c565b90600052602060002001600082825461242291906147a0565b909155505060088501546402540be4009061243d90856148c5565b61244791906147b8565b61245190846148e4565b856009016001815481106124675761246761492c565b90600052602060002001600082825461248091906147a0565b9091555093959294509192505050565b84546000906001600160a01b031660ff8616612501573484146125015760405162461bcd60e51b815260206004820152602360248201527f43616e6e6f742073776170206d6f72652f6c657373207468616e20796f752073604482015262195b9d60ea1b60648201526084016104e5565b8560ff1660011415612757576002870154604051627eeac760e11b81526001600160a01b0383169162fdd58e9161253c913391600401614610565b60206040518083038186803b15801561255457600080fd5b505afa158015612568573d6000803e3d6000fd5b505050506040513d601f19601f8201168201806040525081019061258c9190614584565b8411156125db5760405162461bcd60e51b815260206004820152601d60248201527f43616e6e6f742073776170206d6f7265207468616e20796f75206f776e00000060448201526064016104e5565b6002870154604051627eeac760e11b81526000916001600160a01b0384169162fdd58e9161260e91309190600401614610565b60206040518083038186803b15801561262657600080fd5b505afa15801561263a573d6000803e3d6000fd5b505050506040513d601f19601f8201168201806040525081019061265e9190614584565b6002890154604051637921219560e11b81529192506001600160a01b0384169163f242432a9161269691339130918b906004016145d8565b600060405180830381600087803b1580156126b057600080fd5b505af11580156126c4573d6000803e3d6000fd5b5050506002890154604051627eeac760e11b81528392506001600160a01b0385169162fdd58e916126f9913091600401614610565b60206040518083038186803b15801561271157600080fd5b505afa158015612725573d6000803e3d6000fd5b505050506040513d601f19601f820116820180604052508101906127499190614584565b61275391906148e4565b9450505b6000806000896009018054806020026020016040519081016040528092919081815260200182805480156127aa57602002820191906000526020600020905b815481526020019060010190808311612796575b505050505090506127be8a8a8a8a856132d9565b9093509150858310156128135760405162461bcd60e51b815260206004820181905260248201527f53776170206469646e277420726573756c7420696e206d696e20746f6b656e7360448201526064016104e5565b60006402540be4008b600801548461282b91906148c5565b61283591906147b8565b905087828b60ff168151811061284d5761284d61492c565b602002602001015161285f91906147a0565b8b6009018b60ff16815481106128775761287761492c565b90600052602060002001819055508084838b60ff168151811061289c5761289c61492c565b60200260200101516128ae91906148e4565b6128b891906148e4565b8b6009018a60ff16815481106128d0576128d061492c565b60009182526020909120015560ff891661294e57604051600090339086908381818185875af1925050503d8060008114612926576040519150601f19603f3d011682016040523d82523d6000602084013e61292b565b606091505b505090508061294c5760405162461bcd60e51b81526004016104e5906146ff565b505b8860ff16600114156129c35760028b0154604051637921219560e11b81526001600160a01b0387169163f242432a916129909130913391908a906004016145d8565b600060405180830381600087803b1580156129aa57600080fd5b505af11580156129be573d6000803e3d6000fd5b505050505b604080518981526020810186905260ff8c8116828401528b166060820152905133917fc6c1e0630dbe9130cc068028486c0d118ddcea348550819defd5cb8c257f8a38919081900360800190a250919998505050505050505050565b600061184f82612a7f84856009018054806020026020016040519081016040528092919081815260200182805480156117ba57602002820191906000526020600020908154815260200190600101908083116117a6575050505050612efc565b612a8885612ef1565b613779565b6000806116d78585858860010160009054906101000a90046001600160a01b03166001600160a01b03166318160ddd6040518163ffffffff1660e01b815260040160206040518083038186803b158015612ae657600080fd5b505afa158015612afa573d6000803e3d6000fd5b505050506040513d601f19601f82011682018060405250810190612b1e9190614584565b613858565b600184015484546040516370a0823160e01b81523360048201526000926001600160a01b0390811692169082906370a082319060240160206040518083038186803b158015612b7157600080fd5b505afa158015612b85573d6000803e3d6000fd5b505050506040513d601f19601f82011682018060405250810190612ba99190614584565b861115612bc85760405162461bcd60e51b81526004016104e590614779565b60028560ff1610612c0d5760405162461bcd60e51b815260206004820152600f60248201526e151bdad95b881b9bdd08199bdd5b99608a1b60448201526064016104e5565b6000826001600160a01b03166318160ddd6040518163ffffffff1660e01b815260040160206040518083038186803b158015612c4857600080fd5b505afa158015612c5c573d6000803e3d6000fd5b505050506040513d601f19601f82011682018060405250810190612c809190614584565b9050600080612c918a8a8a86613858565b9150915086821015612cd65760405162461bcd60e51b815260206004820152600e60248201526d191e480f081b5a5b905b5bdd5b9d60921b60448201526064016104e5565b6402540be4008a6008015482612cec91906148c5565b612cf691906147b8565b612d0090836147a0565b8a6009018960ff1681548110612d1857612d1861492c565b9060005260206000200154612d2d91906148e4565b8a6009018960ff1681548110612d4557612d4561492c565b60009182526020909120015560405163079cc67960e41b81526001600160a01b038616906379cc679090612d7f9033908d90600401614610565b600060405180830381600087803b158015612d9957600080fd5b505af1158015612dad573d6000803e3d6000fd5b5050505060ff8816612e2357604051600090339084908381818185875af1925050503d8060008114612dfb576040519150601f19603f3d011682016040523d82523d6000602084013e612e00565b606091505b5050905080612e215760405162461bcd60e51b81526004016104e5906146ff565b505b8760ff1660011415612e985760028a0154604051637921219560e11b81526001600160a01b0386169163f242432a91612e6591309133919088906004016145d8565b600060405180830381600087803b158015612e7f57600080fd5b505af1158015612e93573d6000803e3d6000fd5b505050505b604080518a81526020810185905260ff8a168183015260608101849052905133917f43fb02998f4e03da2e0e6fff53fdbf0c40a9f45f145dc377fc30615d7d7a8a64919081900360800190a25098975050505050505050565b600061184f8261389b565b60606000825167ffffffffffffffff811115612f1a57612f1a614942565b604051908082528060200260200182016040528015612f43578160200160208202803683370190505b50905082600081518110612f5957612f5961492c565b602002602001015181600081518110612f7457612f7461492c565b6020908102919091018101919091528454604080516396ce079560e01b815290516001600160a01b03909216926396ce079592600480840193829003018186803b158015612fc157600080fd5b505afa158015612fd5573d6000803e3d6000fd5b505050506040513d601f19601f82011682018060405250810190612ff99190614584565b8454600286015460405163f759cc3b60e01b81526001600160a01b039092169163f759cc3b9161302f9160040190815260200190565b60206040518083038186803b15801561304757600080fd5b505afa15801561305b573d6000803e3d6000fd5b505050506040513d601f19601f8201168201806040525081019061307f9190614584565b846001815181106130925761309261492c565b60200260200101516130a491906148c5565b6130ae91906147b8565b816001815181106130c1576130c161492c565b60209081029190910101529392505050565b600080600290506000846001815181106130ef576130ef61492c565b60200260200101518560008151811061310a5761310a61492c565b602002602001015161311c91906147a0565b90508061312e5760009250505061184f565b6000818161313c85886148c5565b905060005b61010081101561327c576000896001815181106131605761316061492c565b60200260200101518a60008151811061317b5761317b61492c565b6020026020010151888961318f919061481d565b61319991906148c5565b6131a391906148c5565b6131ae8860016147a0565b6131b8908661481d565b6131c291906147b8565b9050839450808760016131d591906147a0565b6131df91906148c5565b6064856131ec82876148e4565b6131f691906148c5565b61320091906147b8565b61320a91906147a0565b8461321589846148c5565b60646132218a886148c5565b61322b91906147b8565b61323591906147a0565b61323f91906148c5565b61324991906147b8565b93506132558486613945565b15613269578397505050505050505061184f565b5080613274816148fb565b915050613141565b5060405162461bcd60e51b81526020600482015260136024820152724420646f6573206e6f7420636f6e766572676560681b60448201526064016104e5565b6000818311156132cf57611e8082846148e4565b61184c83836148e4565b60008082518660ff161080156132f2575082518560ff16105b61330e5760405162461bcd60e51b81526004016104e5906146c8565b600061334588858960ff16815181106133295761332961492c565b60200260200101518761333c91906147a0565b8960ff16613653565b905060006133538986612efc565b905060006133798a6133706133678d612ef1565b8c8c888861395c565b8a60ff16613b6d565b9050600181878a60ff16815181106133935761339361492c565b60200260200101516133a591906148e4565b6133af91906148e4565b94506402540be4008a60070154866133c791906148c5565b6133d191906147b8565b93506133dd84866148e4565b94505050509550959350505050565b60608183111561343e5760405162461bcd60e51b815260206004820152601a60248201527f43616e6e6f742065786365656420746f74616c20737570706c7900000000000060448201526064016104e5565b6040805160028082526060820183526000926020830190803683370190505090508284866000815181106134745761347461492c565b602002602001015161348691906148c5565b61349091906147b8565b816000815181106134a3576134a361492c565b6020026020010181815250508284866001815181106134c4576134c461492c565b60200260200101516134d691906148c5565b6134e091906147b8565b816001815181106134f3576134f361492c565b6020908102919091010152949350505050565b60606000825167ffffffffffffffff81111561352457613524614942565b60405190808252806020026020018201604052801561354d578160200160208202803683370190505b509050826000815181106135635761356361492c565b60200260200101518160008151811061357e5761357e61492c565b60209081029190910101528354600285015460405163f759cc3b60e01b81526001600160a01b039092169163f759cc3b916135bf9160040190815260200190565b60206040518083038186803b1580156135d757600080fd5b505afa1580156135eb573d6000803e3d6000fd5b505050506040513d601f19601f8201168201806040525081019061360f9190614584565b8454604080516396ce079560e01b815290516001600160a01b03909216916396ce079591600480820192602092909190829003018186803b15801561304757600080fd5b6000816001146136635782611e26565b8354604080516396ce079560e01b815290516001600160a01b03909216916396ce079591600480820192602092909190829003018186803b1580156136a757600080fd5b505afa1580156136bb573d6000803e3d6000fd5b505050506040513d601f19601f820116820180604052508101906136df9190614584565b8454600286015460405163f759cc3b60e01b81526001600160a01b039092169163f759cc3b916137159160040190815260200190565b60206040518083038186803b15801561372d57600080fd5b505afa158015613741573d6000803e3d6000fd5b505050506040513d601f19601f820116820180604052508101906137659190614584565b61376f90856148c5565b611e2691906147b8565b600080600261378885856130d3565b61379291906147b8565b905080846000815181106137a8576137a861492c565b6020026020010151106137bf576000915050610e18565b600081856001815181106137d5576137d561492c565b60200260200101516137e791906148e4565b9050600060026402540be40088600701548461380391906148c5565b61380d91906147b8565b61381791906147b8565b90506000818760008151811061382f5761382f61492c565b60200260200101518561384291906148e4565b61384c91906147a0565b9450610e189350505050565b600080600080600061386c89888a89613c47565b9194509250905060008361388084846148e4565b61388a91906148e4565b939a93995092975050505050505050565b600681015460048201546000919042821115610e18576005840154600385015480831115613909576138cd82856148e4565b6138d783426148e4565b6138e183866148e4565b6138eb91906148c5565b6138f591906147b8565b6138ff90826147a0565b9695505050505050565b61391382856148e4565b61391d83426148e4565b61392785846148e4565b61393191906148c5565b61393b91906147b8565b6138ff90826148e4565b6000600161395384846132bb565b11159392505050565b6000600260ff86811690861614156139b65760405162461bcd60e51b815260206004820152601d60248201527f43616e277420636f6d7061726520746f6b656e20746f20697473656c6600000060448201526064016104e5565b808660ff161080156139ca5750808560ff16105b613a0f5760405162461bcd60e51b8152602060048201526016602482015275151bdad95b9cc81b5d5cdd081899481a5b881c1bdbdb60521b60448201526064016104e5565b6000613a1b84896130d3565b905080856000613a2b8b866148c5565b9050613a3785896148c5565b613a4185856148c5565b613a4b91906147b8565b9250613a5785826148c5565b6064613a6386866148c5565b613a6d91906148c5565b613a7791906147b8565b9250600081613a876064876148c5565b613a9191906147b8565b613a9b90846147a0565b9050600085815b610100811015613b24578192508784836002613abe91906148c5565b613ac891906147a0565b613ad291906148e4565b87613add84806148c5565b613ae791906147a0565b613af191906147b8565b9150613afd8284613945565b15613b12575097506119799650505050505050565b80613b1c816148fb565b915050613aa2565b5060405162461bcd60e51b815260206004820152601e60248201527f417070726f78696d6174696f6e20646964206e6f7420636f6e7665726765000060448201526064016104e5565b600081600114613b7d5782611e26565b8354600285015460405163f759cc3b60e01b81526001600160a01b039092169163f759cc3b91613bb39160040190815260200190565b60206040518083038186803b158015613bcb57600080fd5b505afa158015613bdf573d6000803e3d6000fd5b505050506040513d601f19601f82011682018060405250810190613c039190614584565b8454604080516396ce079560e01b815290516001600160a01b03909216916396ce079591600480820192602092909190829003018186803b15801561372d57600080fd5b600080600060028660ff1610613c6f5760405162461bcd60e51b81526004016104e5906146c8565b60006040518060a001604052806000815260200160008152602001600081526020016000815260200160008152509050613ca888612ef1565b608082015260098801805460408051602080840282018101909252828152613d0793610709938d938301828280156117ba57602002820191906000526020600020908154815260200190600101908083116117a6575050505050612efc565b8082528590613d1690886148c5565b613d2091906147b8565b8151613d2c91906148e4565b602082015260098801805460ff8916908110613d4a57613d4a61492c565b9060005260206000200154861115613da45760405162461bcd60e51b815260206004820152601a60248201527f5769746864726177206578636565647320617661696c61626c6500000000000060448201526064016104e5565b613e1e88613e1583608001518a613e0b8d8e6009018054806020026020016040519081016040528092919081815260200182805480156117ba57602002820191906000526020600020908154815260200190600101908083116117a6575050505050612efc565b8660200151613fe2565b8960ff16613b6d565b6040828101919091528051600280825260608201835260009260208301908036833701905050905060028960070154613e5791906147b8565b606083015260005b6002811015613f435760008a6009018281548110613e7f57613e7f61492c565b906000526020600020015490506402540be40084606001518b60ff168414613ecb5785516020870151613eb290856148c5565b613ebc91906147b8565b613ec690846148e4565b613ef5565b604086015186516020880151613ee190866148c5565b613eeb91906147b8565b613ef591906148e4565b613eff91906148c5565b613f0991906147b8565b613f1390826148e4565b838381518110613f2557613f2561492c565b60209081029190910101525080613f3b816148fb565b915050613e5f565b506000613f708a613f6785608001518c613f5d8f88612efc565b8860200151613fe2565b8b60ff16613b6d565b828a60ff1681518110613f8557613f8561492c565b6020026020010151613f9791906148e4565b9050613fa46001826148e4565b90508083604001518b6009018b60ff1681548110613fc457613fc461492c565b90600052602060002001549550955095505050509450945094915050565b6000600260ff8516811161402a5760405162461bcd60e51b815260206004820152600f60248201526e151bdad95b881b9bdd08199bdd5b99608a1b60448201526064016104e5565b82600080614038848a6148c5565b905060005b848110156140c4578860ff1681146140b2578781815181106140615761406161492c565b60200260200101518361407491906147a0565b9250848882815181106140895761408961492c565b602002602001015161409b91906148c5565b6140a588866148c5565b6140af91906147b8565b93505b806140bc816148fb565b91505061403d565b506140cf84826148c5565b60646140db88866148c5565b6140e591906148c5565b6140ef91906147b8565b92506000816140ff6064896148c5565b61410991906147b8565b61411390846147a0565b9050600087815b610100811015613b2457819250898483600261413691906148c5565b61414091906147a0565b61414a91906148e4565b8761415584806148c5565b61415f91906147a0565b61416991906147b8565b91506141758284613945565b1561418957509650611e2695505050505050565b80614193816148fb565b91505061411a565b8280548282559060005260206000209081019282156141d6579160200282015b828111156141d65782518255916020019190600101906141bb565b506141e29291506141e6565b5090565b5b808211156141e257600081556001016141e7565b60008083601f84011261420d57600080fd5b50813567ffffffffffffffff81111561422557600080fd5b6020830191508360208260051b850101111561424057600080fd5b9250929050565b803560ff8116811461425857600080fd5b919050565b60006020828403121561426f57600080fd5b5035919050565b6000806040838503121561428957600080fd5b8235915060208301356001600160a01b03811681146142a757600080fd5b809150509250929050565b600080600080606085870312156142c857600080fd5b84359350602085013567ffffffffffffffff8111156142e657600080fd5b6142f2878288016141fb565b9094509250506040850135801515811461430b57600080fd5b939692955090935050565b60008060006060848603121561432b57600080fd5b8335925060208085013567ffffffffffffffff8082111561434b57600080fd5b818701915087601f83011261435f57600080fd5b81358181111561437157614371614942565b8060051b604051601f19603f8301168101818110858211171561439657614396614942565b604052828152858101935084860182860187018c10156143b557600080fd5b600095505b838610156143d85780358552600195909501949386019386016143ba565b50979a979950505050604095909501359450505050565b6000806040838503121561440257600080fd5b50508035926020909101359150565b6000806000806060858703121561442757600080fd5b8435935060208501359250604085013567ffffffffffffffff81111561444c57600080fd5b614458878288016141fb565b95989497509550505050565b60008060006060848603121561447957600080fd5b505081359360208301359350604090920135919050565b6000806000606084860312156144a557600080fd5b83359250602084013591506144bc60408501614247565b90509250925092565b600080600080608085870312156144db57600080fd5b84359350602085013592506144f260408601614247565b9396929550929360600135925050565b6000806000806080858703121561451857600080fd5b8435935061452860208601614247565b92506144f260408601614247565b600080600080600060a0868803121561454e57600080fd5b8535945061455e60208701614247565b935061456c60408701614247565b94979396509394606081013594506080013592915050565b60006020828403121561459657600080fd5b5051919050565b600081518084526020808501945080840160005b838110156145cd578151875295820195908201906001016145b1565b509495945050505050565b6001600160a01b0394851681529290931660208301526040820152606081019190915260a06080820181905260009082015260c00190565b6001600160a01b03929092168252602082015260400190565b6020808252825182820181905260009190848201906040850190845b8181101561466157835183529284019291840191600101614645565b50909695505050505050565b608081526000614680608083018761459d565b8281036020840152614692818761459d565b604084019590955250506060015292915050565b6040815260006146b9604083018561459d565b90508260208301529392505050565b60208082526018908201527f546f6b656e20696e646578206f7574206f662072616e67650000000000000000604082015260600190565b6020808252601f908201527f537761705574696c733a204661696c656420746f2073656e6420457468657200604082015260600190565b60208082526023908201527f43616e6e6f74207769746864726177206d6f7265207468616e20617661696c61604082015262626c6560e81b606082015260800190565b6020808252600d908201526c1f2628173130b630b731b2a7b360991b604082015260600190565b600082198211156147b3576147b3614916565b500190565b6000826147d557634e487b7160e01b600052601260045260246000fd5b500490565b600181815b808511156148155781600019048211156147fb576147fb614916565b8085161561480857918102915b93841c93908002906147df565b509250929050565b600061184c83836000826148335750600161184f565b816148405750600061184f565b816001811461485657600281146148605761487c565b600191505061184f565b60ff84111561487157614871614916565b50506001821b61184f565b5060208310610133831016604e8410600b841016171561489f575081810a61184f565b6148a983836147da565b80600019048211156148bd576148bd614916565b029392505050565b60008160001904831182151516156148df576148df614916565b500290565b6000828210156148f6576148f6614916565b500390565b600060001982141561490f5761490f614916565b5060010190565b634e487b7160e01b600052601160045260246000fd5b634e487b7160e01b600052603260045260246000fd5b634e487b7160e01b600052604160045260246000fdfea2646970667358221220ff4ea23a6b92e97e1c579cba2ae7555fc057331538a5831d71dc19b60f3012fb64736f6c63430008070033",
  "deployedBytecode": "0x73000000000000000000000000000000000000000030146080604052600436106101205760003560e01c80637d048160116100ac578063aa0ce1861161007b578063aa0ce186146102bb578063ab3d8544146102ce578063e0692742146102d9578063e7a4db81146102ec578063f3de03621461030c57600080fd5b80637d04816014610240578063834b4910146102535780638fc0f95914610266578063a5397b221461029b57600080fd5b80634b23603c116100f35780634b23603c146101ba57806370467276146101cd57806370703e4a146101ed57806371906c2c1461020d57806373fd6b3e1461022057600080fd5b806324c5c7511461012557806340370edf1461014757806341b91c261461017a578063467e186c1461019a575b600080fd5b81801561013157600080fd5b50610145610140366004614276565b610318565b005b81801561015357600080fd5b50610167610162366004614316565b6104f7565b6040519081526020015b60405180910390f35b81801561018657600080fd5b50610167610195366004614316565b610e1f565b8180156101a657600080fd5b506101456101b53660046143ef565b6115f1565b6101676101c8366004614502565b611676565b8180156101d957600080fd5b506101456101e83660046143ef565b6116e1565b6102006101fb3660046143ef565b61175f565b6040516101719190614629565b61016761021b36600461425d565b611855565b81801561022c57600080fd5b5061020061023b366004614411565b61198d565b61016761024e3660046143ef565b611e2e565b6101676102613660046142b2565b611f47565b81801561027257600080fd5b50610286610281366004614464565b6121d6565b60408051928352602083019190915201610171565b8180156102a757600080fd5b506101676102b6366004614536565b612490565b6101676102c936600461425d565b612a1f565b6101676305f5e10081565b6101676102e7366004614490565b612a8d565b8180156102f857600080fd5b506101676103073660046144c5565b612b23565b6101676402540be40081565b81546009830180546001600160a01b03909216916000919060019081106103415761034161492c565b6000918252602090912001546002850154604051627eeac760e11b81526001600160a01b0385169162fdd58e9161037c913091600401614610565b60206040518083038186803b15801561039457600080fd5b505afa1580156103a8573d6000803e3d6000fd5b505050506040513d601f19601f820116820180604052508101906103cc9190614584565b6103d691906148e4565b90508015610447576002840154604051637921219560e11b81526001600160a01b0384169163f242432a9161041491309188919087906004016145d8565b600060405180830381600087803b15801561042e57600080fd5b505af1158015610442573d6000803e3d6000fd5b505050505b60008460090160008154811061045f5761045f61492c565b90600052602060002001544761047591906148e4565b905080156104f057604051600090339083908381818185875af1925050503d80600081146104bf576040519150601f19603f3d011682016040523d82523d6000602084013e6104c4565b606091505b50509050806104ee5760405162461bcd60e51b81526004016104e5906146ff565b60405180910390fd5b505b5050505050565b6000825160021461054a5760405162461bcd60e51b815260206004820181905260248201527f416d6f756e7473206d757374206d6174636820706f6f6c656420746f6b656e7360448201526064016104e5565b348360008151811061055e5761055e61492c565b6020026020010151146105ce5760405162461bcd60e51b815260206004820152603260248201527f537761705574696c733a207265636569766564206c657373206f72206d6f726560448201527108115512081d1a185b88195e1c1958dd195960721b60648201526084016104e5565b83546040805160e08101825260018701546001600160a01b03908116825260006020830181905292820183905260608201839052909216916080810161061388612ef1565b8152602001600081526020018760090180548060200260200160405190810160405280929190818152602001828054801561066d57602002820191906000526020600020905b815481526020019060010190808311610659575b5050505050815250905080600001516001600160a01b03166318160ddd6040518163ffffffff1660e01b815260040160206040518083038186803b1580156106b457600080fd5b505afa1580156106c8573d6000803e3d6000fd5b505050506040513d601f19601f820116820180604052508101906106ec9190614584565b60a082018190521561071957610713610709878360c00151612efc565b82608001516130d3565b60208201525b604080516002808252606082018352600092602083019080368337019050509050348260c001516000815181106107525761075261492c565b602002602001015161076491906147a0565b816000815181106107775761077761492c565b60200260200101818152505060005b60028110156108185760a08301511515806107ba575060008782815181106107b0576107b061492c565b6020026020010151115b6108065760405162461bcd60e51b815260206004820152601e60248201527f4d75737420737570706c7920616c6c20746f6b656e7320696e20706f6f6c000060448201526064016104e5565b80610810816148fb565b915050610786565b506002870154604051627eeac760e11b81526000916001600160a01b0386169162fdd58e9161084c91309190600401614610565b60206040518083038186803b15801561086457600080fd5b505afa158015610878573d6000803e3d6000fd5b505050506040513d601f19601f8201168201806040525081019061089c9190614584565b9050836001600160a01b031663f242432a33308b600201548b6001815181106108c7576108c761492c565b60200260200101516040518563ffffffff1660e01b81526004016108ee94939291906145d8565b600060405180830381600087803b15801561090857600080fd5b505af115801561091c573d6000803e3d6000fd5b5050506002890154604051627eeac760e11b81528392506001600160a01b0387169162fdd58e91610951913091600401614610565b60206040518083038186803b15801561096957600080fd5b505afa15801561097d573d6000803e3d6000fd5b505050506040513d601f19601f820116820180604052508101906109a19190614584565b6109ab91906148e4565b876001815181106109be576109be61492c565b602002602001018181525050866001815181106109dd576109dd61492c565b60200260200101518360c001516001815181106109fc576109fc61492c565b6020026020010151610a0e91906147a0565b82600181518110610a2157610a2161492c565b60200260200101818152505050610a45610a3b8883612efc565b83608001516130d3565b60408301819052602083015110610a925760405162461bcd60e51b8152602060048201526011602482015270442073686f756c6420696e63726561736560781b60448201526064016104e5565b60408281015160608085019190915281516002808252918101835260009290919060208301908036833750505060a084015190915015610ca257600060028960070154610adf91906147b8565b905060005b6002811015610c7f57600085602001518660c001518381518110610b0a57610b0a61492c565b60200260200101518760400151610b2191906148c5565b610b2b91906147b8565b90506402540be400610b5f868481518110610b4857610b4861492c565b6020026020010151836132bb90919063ffffffff16565b610b6990856148c5565b610b7391906147b8565b848381518110610b8557610b8561492c565b6020026020010181815250506402540be4008b60080154858481518110610bae57610bae61492c565b6020026020010151610bc091906148c5565b610bca91906147b8565b858381518110610bdc57610bdc61492c565b6020026020010151610bee91906148e4565b8b6009018381548110610c0357610c0361492c565b9060005260206000200181905550838281518110610c2357610c2361492c565b6020026020010151858381518110610c3d57610c3d61492c565b6020026020010151610c4f91906148e4565b858381518110610c6157610c6161492c565b60209081029190910101525080610c77816148fb565b915050610ae4565b50610c97610c8d8a85612efc565b85608001516130d3565b606085015250610cb9565b8151610cb79060098a0190602085019061419b565b505b60008360a0015160001415610cd357506040830151610d04565b602084015160a08501516060860151610ced9083906148e4565b610cf791906148c5565b610d0191906147b8565b90505b86811015610d545760405162461bcd60e51b815260206004820152601b60248201527f436f756c646e2774206d696e74206d696e20726571756573746564000000000060448201526064016104e5565b83516040516340c10f1960e01b81526001600160a01b03909116906340c10f1990610d859033908590600401614610565b600060405180830381600087803b158015610d9f57600080fd5b505af1158015610db3573d6000803e3d6000fd5b50505050336001600160a01b03167f189c623b666b1b45b83d7178f39b8c087cb09774317ca2f53c2d3c3726f222a289848760400151858960a00151610df991906147a0565b604051610e09949392919061466d565b60405180910390a29450505050505b9392505050565b82546040805160e08101825260018601546001600160a01b0390811682526000602083018190529282018390526060820183905291929190911690829060808101610e6988612ef1565b81526020016000815260200187600901805480602002602001604051908101604052809291908181526020018280548015610ec357602002820191906000526020600020905b815481526020019060010190808311610eaf575b5050505050815250905080600001516001600160a01b03166318160ddd6040518163ffffffff1660e01b815260040160206040518083038186803b158015610f0a57600080fd5b505afa158015610f1e573d6000803e3d6000fd5b505050506040513d601f19601f82011682018060405250810190610f429190614584565b60a08201528451600214610f985760405162461bcd60e51b815260206004820181905260248201527f416d6f756e74732073686f756c64206d6174636820706f6f6c20746f6b656e7360448201526064016104e5565b80516040516370a0823160e01b81523360048201526001600160a01b03909116906370a082319060240160206040518083038186803b158015610fda57600080fd5b505afa158015610fee573d6000803e3d6000fd5b505050506040513d601f19601f820116820180604052508101906110129190614584565b841115801561102057508315155b61103c5760405162461bcd60e51b81526004016104e590614779565b60006002876007015461104f91906147b8565b60408051600280825260608201835292935060009290916020830190803683375050604080516002808252606082018352939450600093909250906020830190803683370190505090506110aa610c8d8a8660c00151612efc565b602085015260005b6002811015611182578460c0015181815181106110d1576110d161492c565b60200260200101518982815181106110eb576110eb61492c565b602002602001015111156111115760405162461bcd60e51b81526004016104e590614736565b8881815181106111235761112361492c565b60200260200101518560c0015182815181106111415761114161492c565b602002602001015161115391906148e4565b8282815181106111655761116561492c565b60209081029190910101528061117a816148fb565b9150506110b2565b50611190610c8d8a83612efc565b604085015260005b600281101561132957600085602001518660c0015183815181106111be576111be61492c565b602002602001015187604001516111d591906148c5565b6111df91906147b8565b905060006111f8848481518110610b4857610b4861492c565b90506402540be40061120a82886148c5565b61121491906147b8565b8584815181106112265761122661492c565b60200260200101818152505060008c6008015490506402540be400818786815181106112545761125461492c565b602002602001015161126691906148c5565b61127091906147b8565b8585815181106112825761128261492c565b602002602001015161129491906148e4565b8d60090185815481106112a9576112a961492c565b90600052602060002001819055508584815181106112c9576112c961492c565b60200260200101518585815181106112e3576112e361492c565b60200260200101516112f591906148e4565b8585815181106113075761130761492c565b6020026020010181815250505050508080611321906148fb565b915050611198565b50611337610c8d8a83612efc565b60608501819052602085015160a086015160009350909161135890836148e4565b61136291906148c5565b61136c91906147b8565b9050806113bb5760405162461bcd60e51b815260206004820152601b60248201527f4275726e7420616d6f756e742063616e6e6f74206265207a65726f000000000060448201526064016104e5565b6113c68160016147a0565b9050868111156114185760405162461bcd60e51b815260206004820152601b60248201527f746f6b656e416d6f756e74203e206d61784275726e416d6f756e74000000000060448201526064016104e5565b835160405163079cc67960e41b81526001600160a01b03909116906379cc6790906114499033908590600401614610565b600060405180830381600087803b15801561146357600080fd5b505af1158015611477573d6000803e3d6000fd5b505050506000336001600160a01b03168960008151811061149a5761149a61492c565b602002602001015160405160006040518083038185875af1925050503d80600081146114e2576040519150601f19603f3d011682016040523d82523d6000602084013e6114e7565b606091505b50509050806115085760405162461bcd60e51b81526004016104e5906146ff565b856001600160a01b031663f242432a30338d600201548d6001815181106115315761153161492c565b60200260200101516040518563ffffffff1660e01b815260040161155894939291906145d8565b600060405180830381600087803b15801561157257600080fd5b505af1158015611586573d6000803e3d6000fd5b50505050336001600160a01b03167f3631c28b1f9dd213e0319fb167b554d76b6c283a41143eb400a0d1adb1af17558a858860400151868a60a001516115cc91906148e4565b6040516115dc949392919061466d565b60405180910390a25098975050505050505050565b6305f5e1008111156116375760405162461bcd60e51b815260206004820152600f60248201526e08ccaca40d2e640e8dede40d0d2ced608b1b60448201526064016104e5565b600782018190556040518181527fd88ea5155021c6f8dafa1a741e173f595cdf77ce7c17d43342131d7f06afdfe5906020015b60405180910390a15050565b60006116d785858585896009018054806020026020016040519081016040528092919081815260200182805480156116cd57602002820191906000526020600020905b8154815260200190600101908083116116b9575b50505050506132d9565b5095945050505050565b6402540be4008111156117285760405162461bcd60e51b815260206004820152600f60248201526e08ccaca40d2e640e8dede40d0d2ced608b1b60448201526064016104e5565b600882018190556040518181527fab599d640ca80cde2b09b128a4154a8dfe608cb80f4c9399c8b954b01fd35f389060200161166a565b606061184c836118476117c486876009018054806020026020016040519081016040528092919081815260200182805480156117ba57602002820191906000526020600020905b8154815260200190600101908083116117a6575b5050505050612efc565b6001870154604080516318160ddd60e01b8152905188926001600160a01b0316916318160ddd916004808301926020929190829003018186803b15801561180a57600080fd5b505afa15801561181e573d6000803e3d6000fd5b505050506040513d601f19601f820116820180604052508101906118429190614584565b6133ec565b613506565b90505b92915050565b6000806118c36118b584856009018054806020026020016040519081016040528092919081815260200182805480156117ba57602002820191906000526020600020908154815260200190600101908083116117a6575050505050612efc565b6118be85612ef1565b6130d3565b905060008360010160009054906101000a90046001600160a01b031690506000816001600160a01b03166318160ddd6040518163ffffffff1660e01b815260040160206040518083038186803b15801561191c57600080fd5b505afa158015611930573d6000803e3d6000fd5b505050506040513d601f19601f820116820180604052508101906119549190614584565b90508015611982578061196f84670de0b6b3a76400006148c5565b61197991906147b8565b95945050505050565b506000949350505050565b600184015484546040516370a0823160e01b81523360048201526060926001600160a01b0390811692169082906370a082319060240160206040518083038186803b1580156119db57600080fd5b505afa1580156119ef573d6000803e3d6000fd5b505050506040513d601f19601f82011682018060405250810190611a139190614584565b861115611a325760405162461bcd60e51b81526004016104e590614779565b60028414611a825760405162461bcd60e51b815260206004820181905260248201527f6d696e416d6f756e7473206d757374206d6174636820706f6f6c546f6b656e7360448201526064016104e5565b600087600901805480602002602001604051908101604052809291908181526020018280548015611ad257602002820191906000526020600020905b815481526020019060010190808311611abe575b505050505090506000836001600160a01b03166318160ddd6040518163ffffffff1660e01b815260040160206040518083038186803b158015611b1457600080fd5b505afa158015611b28573d6000803e3d6000fd5b505050506040513d601f19601f82011682018060405250810190611b4c9190614584565b90506000611b688a611847611b618d87612efc565b8c866133ec565b905060005b8151811015611c6857888882818110611b8857611b8861492c565b90506020020135828281518110611ba157611ba161492c565b60200260200101511015611bf75760405162461bcd60e51b815260206004820152601a60248201527f616d6f756e74735b695d203c206d696e416d6f756e74735b695d00000000000060448201526064016104e5565b818181518110611c0957611c0961492c565b6020026020010151848281518110611c2357611c2361492c565b6020026020010151611c3591906148e4565b8b6009018281548110611c4a57611c4a61492c565b60009182526020909120015580611c60816148fb565b915050611b6d565b5060405163079cc67960e41b81526001600160a01b038616906379cc679090611c979033908d90600401614610565b600060405180830381600087803b158015611cb157600080fd5b505af1158015611cc5573d6000803e3d6000fd5b505050506000336001600160a01b031682600081518110611ce857611ce861492c565b602002602001015160405160006040518083038185875af1925050503d8060008114611d30576040519150601f19603f3d011682016040523d82523d6000602084013e611d35565b606091505b5050905080611d565760405162461bcd60e51b81526004016104e5906146ff565b846001600160a01b031663f242432a30338e6002015486600181518110611d7f57611d7f61492c565b60200260200101516040518563ffffffff1660e01b8152600401611da694939291906145d8565b600060405180830381600087803b158015611dc057600080fd5b505af1158015611dd4573d6000803e3d6000fd5b503392507f88d38ed598fdd809c2bf01ee49cd24b7fdabf379a83d29567952b60324d58cef9150849050611e088d876148e4565b604051611e169291906146a6565b60405180910390a2509450505050505b949350505050565b600060028210611e505760405162461bcd60e51b81526004016104e5906146c8565b81611e8757826009018281548110611e6a57611e6a61492c565b906000526020600020015447611e8091906148e4565b905061184f565b8160011415611f3e57826009018281548110611ea557611ea561492c565b60009182526020909120015483546002850154604051627eeac760e11b81526001600160a01b039092169162fdd58e91611ee491309190600401614610565b60206040518083038186803b158015611efc57600080fd5b505afa158015611f10573d6000803e3d6000fd5b505050506040513d601f19601f82011682018060405250810190611f349190614584565b611e8091906148e4565b50600092915050565b600080611f5386612ef1565b9050600086600901805480602002602001604051908101604052809291908181526020018280548015611fa557602002820191906000526020600020905b815481526020019060010190808311611f91575b505050505090506000611fc1611fbb8984612efc565b846130d3565b905060005b82518110156120f457851561203557878782818110611fe757611fe761492c565b905060200201358382815181106120005761200061492c565b602002602001015161201291906147a0565b8382815181106120245761202461492c565b6020026020010181815250506120e2565b8281815181106120475761204761492c565b60200260200101518888838181106120615761206161492c565b9050602002013511156120865760405162461bcd60e51b81526004016104e590614736565b8787828181106120985761209861492c565b905060200201358382815181106120b1576120b161492c565b60200260200101516120c391906148e4565b8382815181106120d5576120d561492c565b6020026020010181815250505b806120ec816148fb565b915050611fc6565b50600061210a6121048a85612efc565b856130d3565b905060008960010160009054906101000a90046001600160a01b03166001600160a01b03166318160ddd6040518163ffffffff1660e01b815260040160206040518083038186803b15801561215e57600080fd5b505afa158015612172573d6000803e3d6000fd5b505050506040513d601f19601f820116820180604052508101906121969190614584565b905086156121ca5782816121aa82856148e4565b6121b491906148c5565b6121be91906147b8565b95505050505050611e26565b82816121aa84836148e4565b82546002840154604051627eeac760e11b815260009283926001600160a01b03909116918391839162fdd58e9161221291309190600401614610565b60206040518083038186803b15801561222a57600080fd5b505afa15801561223e573d6000803e3d6000fd5b505050506040513d601f19601f820116820180604052508101906122629190614584565b6002880154604051637921219560e11b81529192506001600160a01b0384169163f242432a9161229a91339130918b906004016145d8565b600060405180830381600087803b1580156122b457600080fd5b505af11580156122c8573d6000803e3d6000fd5b5050506002880154604051627eeac760e11b81528392506001600160a01b0385169162fdd58e916122fd913091600401614610565b60206040518083038186803b15801561231557600080fd5b505afa158015612329573d6000803e3d6000fd5b505050506040513d601f19601f8201168201806040525081019061234d9190614584565b61235791906148e4565b945050508361236886856001613653565b146123c95760405162461bcd60e51b815260206004820152602b60248201527f537761705574696c733a204d555354207265737065637420746f20646572697660448201526a617469766520707269636560a81b60648201526084016104e5565b6402540be4008560080154856123df91906148c5565b6123e991906147b8565b6123f390856148e4565b856009016000815481106124095761240961492c565b90600052602060002001600082825461242291906147a0565b909155505060088501546402540be4009061243d90856148c5565b61244791906147b8565b61245190846148e4565b856009016001815481106124675761246761492c565b90600052602060002001600082825461248091906147a0565b9091555093959294509192505050565b84546000906001600160a01b031660ff8616612501573484146125015760405162461bcd60e51b815260206004820152602360248201527f43616e6e6f742073776170206d6f72652f6c657373207468616e20796f752073604482015262195b9d60ea1b60648201526084016104e5565b8560ff1660011415612757576002870154604051627eeac760e11b81526001600160a01b0383169162fdd58e9161253c913391600401614610565b60206040518083038186803b15801561255457600080fd5b505afa158015612568573d6000803e3d6000fd5b505050506040513d601f19601f8201168201806040525081019061258c9190614584565b8411156125db5760405162461bcd60e51b815260206004820152601d60248201527f43616e6e6f742073776170206d6f7265207468616e20796f75206f776e00000060448201526064016104e5565b6002870154604051627eeac760e11b81526000916001600160a01b0384169162fdd58e9161260e91309190600401614610565b60206040518083038186803b15801561262657600080fd5b505afa15801561263a573d6000803e3d6000fd5b505050506040513d601f19601f8201168201806040525081019061265e9190614584565b6002890154604051637921219560e11b81529192506001600160a01b0384169163f242432a9161269691339130918b906004016145d8565b600060405180830381600087803b1580156126b057600080fd5b505af11580156126c4573d6000803e3d6000fd5b5050506002890154604051627eeac760e11b81528392506001600160a01b0385169162fdd58e916126f9913091600401614610565b60206040518083038186803b15801561271157600080fd5b505afa158015612725573d6000803e3d6000fd5b505050506040513d601f19601f820116820180604052508101906127499190614584565b61275391906148e4565b9450505b6000806000896009018054806020026020016040519081016040528092919081815260200182805480156127aa57602002820191906000526020600020905b815481526020019060010190808311612796575b505050505090506127be8a8a8a8a856132d9565b9093509150858310156128135760405162461bcd60e51b815260206004820181905260248201527f53776170206469646e277420726573756c7420696e206d696e20746f6b656e7360448201526064016104e5565b60006402540be4008b600801548461282b91906148c5565b61283591906147b8565b905087828b60ff168151811061284d5761284d61492c565b602002602001015161285f91906147a0565b8b6009018b60ff16815481106128775761287761492c565b90600052602060002001819055508084838b60ff168151811061289c5761289c61492c565b60200260200101516128ae91906148e4565b6128b891906148e4565b8b6009018a60ff16815481106128d0576128d061492c565b60009182526020909120015560ff891661294e57604051600090339086908381818185875af1925050503d8060008114612926576040519150601f19603f3d011682016040523d82523d6000602084013e61292b565b606091505b505090508061294c5760405162461bcd60e51b81526004016104e5906146ff565b505b8860ff16600114156129c35760028b0154604051637921219560e11b81526001600160a01b0387169163f242432a916129909130913391908a906004016145d8565b600060405180830381600087803b1580156129aa57600080fd5b505af11580156129be573d6000803e3d6000fd5b505050505b604080518981526020810186905260ff8c8116828401528b166060820152905133917fc6c1e0630dbe9130cc068028486c0d118ddcea348550819defd5cb8c257f8a38919081900360800190a250919998505050505050505050565b600061184f82612a7f84856009018054806020026020016040519081016040528092919081815260200182805480156117ba57602002820191906000526020600020908154815260200190600101908083116117a6575050505050612efc565b612a8885612ef1565b613779565b6000806116d78585858860010160009054906101000a90046001600160a01b03166001600160a01b03166318160ddd6040518163ffffffff1660e01b815260040160206040518083038186803b158015612ae657600080fd5b505afa158015612afa573d6000803e3d6000fd5b505050506040513d601f19601f82011682018060405250810190612b1e9190614584565b613858565b600184015484546040516370a0823160e01b81523360048201526000926001600160a01b0390811692169082906370a082319060240160206040518083038186803b158015612b7157600080fd5b505afa158015612b85573d6000803e3d6000fd5b505050506040513d601f19601f82011682018060405250810190612ba99190614584565b861115612bc85760405162461bcd60e51b81526004016104e590614779565b60028560ff1610612c0d5760405162461bcd60e51b815260206004820152600f60248201526e151bdad95b881b9bdd08199bdd5b99608a1b60448201526064016104e5565b6000826001600160a01b03166318160ddd6040518163ffffffff1660e01b815260040160206040518083038186803b158015612c4857600080fd5b505afa158015612c5c573d6000803e3d6000fd5b505050506040513d601f19601f82011682018060405250810190612c809190614584565b9050600080612c918a8a8a86613858565b9150915086821015612cd65760405162461bcd60e51b815260206004820152600e60248201526d191e480f081b5a5b905b5bdd5b9d60921b60448201526064016104e5565b6402540be4008a6008015482612cec91906148c5565b612cf691906147b8565b612d0090836147a0565b8a6009018960ff1681548110612d1857612d1861492c565b9060005260206000200154612d2d91906148e4565b8a6009018960ff1681548110612d4557612d4561492c565b60009182526020909120015560405163079cc67960e41b81526001600160a01b038616906379cc679090612d7f9033908d90600401614610565b600060405180830381600087803b158015612d9957600080fd5b505af1158015612dad573d6000803e3d6000fd5b5050505060ff8816612e2357604051600090339084908381818185875af1925050503d8060008114612dfb576040519150601f19603f3d011682016040523d82523d6000602084013e612e00565b606091505b5050905080612e215760405162461bcd60e51b81526004016104e5906146ff565b505b8760ff1660011415612e985760028a0154604051637921219560e11b81526001600160a01b0386169163f242432a91612e6591309133919088906004016145d8565b600060405180830381600087803b158015612e7f57600080fd5b505af1158015612e93573d6000803e3d6000fd5b505050505b604080518a81526020810185905260ff8a168183015260608101849052905133917f43fb02998f4e03da2e0e6fff53fdbf0c40a9f45f145dc377fc30615d7d7a8a64919081900360800190a25098975050505050505050565b600061184f8261389b565b60606000825167ffffffffffffffff811115612f1a57612f1a614942565b604051908082528060200260200182016040528015612f43578160200160208202803683370190505b50905082600081518110612f5957612f5961492c565b602002602001015181600081518110612f7457612f7461492c565b6020908102919091018101919091528454604080516396ce079560e01b815290516001600160a01b03909216926396ce079592600480840193829003018186803b158015612fc157600080fd5b505afa158015612fd5573d6000803e3d6000fd5b505050506040513d601f19601f82011682018060405250810190612ff99190614584565b8454600286015460405163f759cc3b60e01b81526001600160a01b039092169163f759cc3b9161302f9160040190815260200190565b60206040518083038186803b15801561304757600080fd5b505afa15801561305b573d6000803e3d6000fd5b505050506040513d601f19601f8201168201806040525081019061307f9190614584565b846001815181106130925761309261492c565b60200260200101516130a491906148c5565b6130ae91906147b8565b816001815181106130c1576130c161492c565b60209081029190910101529392505050565b600080600290506000846001815181106130ef576130ef61492c565b60200260200101518560008151811061310a5761310a61492c565b602002602001015161311c91906147a0565b90508061312e5760009250505061184f565b6000818161313c85886148c5565b905060005b61010081101561327c576000896001815181106131605761316061492c565b60200260200101518a60008151811061317b5761317b61492c565b6020026020010151888961318f919061481d565b61319991906148c5565b6131a391906148c5565b6131ae8860016147a0565b6131b8908661481d565b6131c291906147b8565b9050839450808760016131d591906147a0565b6131df91906148c5565b6064856131ec82876148e4565b6131f691906148c5565b61320091906147b8565b61320a91906147a0565b8461321589846148c5565b60646132218a886148c5565b61322b91906147b8565b61323591906147a0565b61323f91906148c5565b61324991906147b8565b93506132558486613945565b15613269578397505050505050505061184f565b5080613274816148fb565b915050613141565b5060405162461bcd60e51b81526020600482015260136024820152724420646f6573206e6f7420636f6e766572676560681b60448201526064016104e5565b6000818311156132cf57611e8082846148e4565b61184c83836148e4565b60008082518660ff161080156132f2575082518560ff16105b61330e5760405162461bcd60e51b81526004016104e5906146c8565b600061334588858960ff16815181106133295761332961492c565b60200260200101518761333c91906147a0565b8960ff16613653565b905060006133538986612efc565b905060006133798a6133706133678d612ef1565b8c8c888861395c565b8a60ff16613b6d565b9050600181878a60ff16815181106133935761339361492c565b60200260200101516133a591906148e4565b6133af91906148e4565b94506402540be4008a60070154866133c791906148c5565b6133d191906147b8565b93506133dd84866148e4565b94505050509550959350505050565b60608183111561343e5760405162461bcd60e51b815260206004820152601a60248201527f43616e6e6f742065786365656420746f74616c20737570706c7900000000000060448201526064016104e5565b6040805160028082526060820183526000926020830190803683370190505090508284866000815181106134745761347461492c565b602002602001015161348691906148c5565b61349091906147b8565b816000815181106134a3576134a361492c565b6020026020010181815250508284866001815181106134c4576134c461492c565b60200260200101516134d691906148c5565b6134e091906147b8565b816001815181106134f3576134f361492c565b6020908102919091010152949350505050565b60606000825167ffffffffffffffff81111561352457613524614942565b60405190808252806020026020018201604052801561354d578160200160208202803683370190505b509050826000815181106135635761356361492c565b60200260200101518160008151811061357e5761357e61492c565b60209081029190910101528354600285015460405163f759cc3b60e01b81526001600160a01b039092169163f759cc3b916135bf9160040190815260200190565b60206040518083038186803b1580156135d757600080fd5b505afa1580156135eb573d6000803e3d6000fd5b505050506040513d601f19601f8201168201806040525081019061360f9190614584565b8454604080516396ce079560e01b815290516001600160a01b03909216916396ce079591600480820192602092909190829003018186803b15801561304757600080fd5b6000816001146136635782611e26565b8354604080516396ce079560e01b815290516001600160a01b03909216916396ce079591600480820192602092909190829003018186803b1580156136a757600080fd5b505afa1580156136bb573d6000803e3d6000fd5b505050506040513d601f19601f820116820180604052508101906136df9190614584565b8454600286015460405163f759cc3b60e01b81526001600160a01b039092169163f759cc3b916137159160040190815260200190565b60206040518083038186803b15801561372d57600080fd5b505afa158015613741573d6000803e3d6000fd5b505050506040513d601f19601f820116820180604052508101906137659190614584565b61376f90856148c5565b611e2691906147b8565b600080600261378885856130d3565b61379291906147b8565b905080846000815181106137a8576137a861492c565b6020026020010151106137bf576000915050610e18565b600081856001815181106137d5576137d561492c565b60200260200101516137e791906148e4565b9050600060026402540be40088600701548461380391906148c5565b61380d91906147b8565b61381791906147b8565b90506000818760008151811061382f5761382f61492c565b60200260200101518561384291906148e4565b61384c91906147a0565b9450610e189350505050565b600080600080600061386c89888a89613c47565b9194509250905060008361388084846148e4565b61388a91906148e4565b939a93995092975050505050505050565b600681015460048201546000919042821115610e18576005840154600385015480831115613909576138cd82856148e4565b6138d783426148e4565b6138e183866148e4565b6138eb91906148c5565b6138f591906147b8565b6138ff90826147a0565b9695505050505050565b61391382856148e4565b61391d83426148e4565b61392785846148e4565b61393191906148c5565b61393b91906147b8565b6138ff90826148e4565b6000600161395384846132bb565b11159392505050565b6000600260ff86811690861614156139b65760405162461bcd60e51b815260206004820152601d60248201527f43616e277420636f6d7061726520746f6b656e20746f20697473656c6600000060448201526064016104e5565b808660ff161080156139ca5750808560ff16105b613a0f5760405162461bcd60e51b8152602060048201526016602482015275151bdad95b9cc81b5d5cdd081899481a5b881c1bdbdb60521b60448201526064016104e5565b6000613a1b84896130d3565b905080856000613a2b8b866148c5565b9050613a3785896148c5565b613a4185856148c5565b613a4b91906147b8565b9250613a5785826148c5565b6064613a6386866148c5565b613a6d91906148c5565b613a7791906147b8565b9250600081613a876064876148c5565b613a9191906147b8565b613a9b90846147a0565b9050600085815b610100811015613b24578192508784836002613abe91906148c5565b613ac891906147a0565b613ad291906148e4565b87613add84806148c5565b613ae791906147a0565b613af191906147b8565b9150613afd8284613945565b15613b12575097506119799650505050505050565b80613b1c816148fb565b915050613aa2565b5060405162461bcd60e51b815260206004820152601e60248201527f417070726f78696d6174696f6e20646964206e6f7420636f6e7665726765000060448201526064016104e5565b600081600114613b7d5782611e26565b8354600285015460405163f759cc3b60e01b81526001600160a01b039092169163f759cc3b91613bb39160040190815260200190565b60206040518083038186803b158015613bcb57600080fd5b505afa158015613bdf573d6000803e3d6000fd5b505050506040513d601f19601f82011682018060405250810190613c039190614584565b8454604080516396ce079560e01b815290516001600160a01b03909216916396ce079591600480820192602092909190829003018186803b15801561372d57600080fd5b600080600060028660ff1610613c6f5760405162461bcd60e51b81526004016104e5906146c8565b60006040518060a001604052806000815260200160008152602001600081526020016000815260200160008152509050613ca888612ef1565b608082015260098801805460408051602080840282018101909252828152613d0793610709938d938301828280156117ba57602002820191906000526020600020908154815260200190600101908083116117a6575050505050612efc565b8082528590613d1690886148c5565b613d2091906147b8565b8151613d2c91906148e4565b602082015260098801805460ff8916908110613d4a57613d4a61492c565b9060005260206000200154861115613da45760405162461bcd60e51b815260206004820152601a60248201527f5769746864726177206578636565647320617661696c61626c6500000000000060448201526064016104e5565b613e1e88613e1583608001518a613e0b8d8e6009018054806020026020016040519081016040528092919081815260200182805480156117ba57602002820191906000526020600020908154815260200190600101908083116117a6575050505050612efc565b8660200151613fe2565b8960ff16613b6d565b6040828101919091528051600280825260608201835260009260208301908036833701905050905060028960070154613e5791906147b8565b606083015260005b6002811015613f435760008a6009018281548110613e7f57613e7f61492c565b906000526020600020015490506402540be40084606001518b60ff168414613ecb5785516020870151613eb290856148c5565b613ebc91906147b8565b613ec690846148e4565b613ef5565b604086015186516020880151613ee190866148c5565b613eeb91906147b8565b613ef591906148e4565b613eff91906148c5565b613f0991906147b8565b613f1390826148e4565b838381518110613f2557613f2561492c565b60209081029190910101525080613f3b816148fb565b915050613e5f565b506000613f708a613f6785608001518c613f5d8f88612efc565b8860200151613fe2565b8b60ff16613b6d565b828a60ff1681518110613f8557613f8561492c565b6020026020010151613f9791906148e4565b9050613fa46001826148e4565b90508083604001518b6009018b60ff1681548110613fc457613fc461492c565b90600052602060002001549550955095505050509450945094915050565b6000600260ff8516811161402a5760405162461bcd60e51b815260206004820152600f60248201526e151bdad95b881b9bdd08199bdd5b99608a1b60448201526064016104e5565b82600080614038848a6148c5565b905060005b848110156140c4578860ff1681146140b2578781815181106140615761406161492c565b60200260200101518361407491906147a0565b9250848882815181106140895761408961492c565b602002602001015161409b91906148c5565b6140a588866148c5565b6140af91906147b8565b93505b806140bc816148fb565b91505061403d565b506140cf84826148c5565b60646140db88866148c5565b6140e591906148c5565b6140ef91906147b8565b92506000816140ff6064896148c5565b61410991906147b8565b61411390846147a0565b9050600087815b610100811015613b2457819250898483600261413691906148c5565b61414091906147a0565b61414a91906148e4565b8761415584806148c5565b61415f91906147a0565b61416991906147b8565b91506141758284613945565b1561418957509650611e2695505050505050565b80614193816148fb565b91505061411a565b8280548282559060005260206000209081019282156141d6579160200282015b828111156141d65782518255916020019190600101906141bb565b506141e29291506141e6565b5090565b5b808211156141e257600081556001016141e7565b60008083601f84011261420d57600080fd5b50813567ffffffffffffffff81111561422557600080fd5b6020830191508360208260051b850101111561424057600080fd5b9250929050565b803560ff8116811461425857600080fd5b919050565b60006020828403121561426f57600080fd5b5035919050565b6000806040838503121561428957600080fd5b8235915060208301356001600160a01b03811681146142a757600080fd5b809150509250929050565b600080600080606085870312156142c857600080fd5b84359350602085013567ffffffffffffffff8111156142e657600080fd5b6142f2878288016141fb565b9094509250506040850135801515811461430b57600080fd5b939692955090935050565b60008060006060848603121561432b57600080fd5b8335925060208085013567ffffffffffffffff8082111561434b57600080fd5b818701915087601f83011261435f57600080fd5b81358181111561437157614371614942565b8060051b604051601f19603f8301168101818110858211171561439657614396614942565b604052828152858101935084860182860187018c10156143b557600080fd5b600095505b838610156143d85780358552600195909501949386019386016143ba565b50979a979950505050604095909501359450505050565b6000806040838503121561440257600080fd5b50508035926020909101359150565b6000806000806060858703121561442757600080fd5b8435935060208501359250604085013567ffffffffffffffff81111561444c57600080fd5b614458878288016141fb565b95989497509550505050565b60008060006060848603121561447957600080fd5b505081359360208301359350604090920135919050565b6000806000606084860312156144a557600080fd5b83359250602084013591506144bc60408501614247565b90509250925092565b600080600080608085870312156144db57600080fd5b84359350602085013592506144f260408601614247565b9396929550929360600135925050565b6000806000806080858703121561451857600080fd5b8435935061452860208601614247565b92506144f260408601614247565b600080600080600060a0868803121561454e57600080fd5b8535945061455e60208701614247565b935061456c60408701614247565b94979396509394606081013594506080013592915050565b60006020828403121561459657600080fd5b5051919050565b600081518084526020808501945080840160005b838110156145cd578151875295820195908201906001016145b1565b509495945050505050565b6001600160a01b0394851681529290931660208301526040820152606081019190915260a06080820181905260009082015260c00190565b6001600160a01b03929092168252602082015260400190565b6020808252825182820181905260009190848201906040850190845b8181101561466157835183529284019291840191600101614645565b50909695505050505050565b608081526000614680608083018761459d565b8281036020840152614692818761459d565b604084019590955250506060015292915050565b6040815260006146b9604083018561459d565b90508260208301529392505050565b60208082526018908201527f546f6b656e20696e646578206f7574206f662072616e67650000000000000000604082015260600190565b6020808252601f908201527f537761705574696c733a204661696c656420746f2073656e6420457468657200604082015260600190565b60208082526023908201527f43616e6e6f74207769746864726177206d6f7265207468616e20617661696c61604082015262626c6560e81b606082015260800190565b6020808252600d908201526c1f2628173130b630b731b2a7b360991b604082015260600190565b600082198211156147b3576147b3614916565b500190565b6000826147d557634e487b7160e01b600052601260045260246000fd5b500490565b600181815b808511156148155781600019048211156147fb576147fb614916565b8085161561480857918102915b93841c93908002906147df565b509250929050565b600061184c83836000826148335750600161184f565b816148405750600061184f565b816001811461485657600281146148605761487c565b600191505061184f565b60ff84111561487157614871614916565b50506001821b61184f565b5060208310610133831016604e8410600b841016171561489f575081810a61184f565b6148a983836147da565b80600019048211156148bd576148bd614916565b029392505050565b60008160001904831182151516156148df576148df614916565b500290565b6000828210156148f6576148f6614916565b500390565b600060001982141561490f5761490f614916565b5060010190565b634e487b7160e01b600052601160045260246000fd5b634e487b7160e01b600052603260045260246000fd5b634e487b7160e01b600052604160045260246000fdfea2646970667358221220ff4ea23a6b92e97e1c579cba2ae7555fc057331538a5831d71dc19b60f3012fb64736f6c63430008070033",
  "devdoc": {
    "details": "Contracts relying on this library must initialize SwapUtils.Swap struct then use this library for SwapUtils.Swap struct. Note that this library contains both functions called by users and admins. Admin functions should be protected within contracts using this library.Whenever \"Effective Balance\" is mentioned it refers to the balance projected with underlying price.",
    "kind": "dev",
    "methods": {
      "addLiquidity(SwapUtils.Swap storage,uint256[],uint256)": {
        "params": {
          "amounts": "the amounts of each token to add, in their native precision",
          "minToMint": "the minimum LP tokens adding this amount of liquidity should mint, otherwise revert. Handy for front-running mitigation allowed addresses. If the pool is not in the guarded launch phase, this parameter will be ignored.",
          "self": "Swap struct to read from and write to"
        },
        "returns": {
          "_0": "amount of LP token user received"
        }
      },
      "calculateSwap(SwapUtils.Swap storage,uint8,uint8,uint256)": {
        "params": {
          "dx": "the number of tokens to sell. If the token charges a fee on transfers, use the amount that gets transferred after the fee.",
          "self": "Swap struct to read from",
          "tokenIndexFrom": "the token to sell",
          "tokenIndexTo": "the token to buy"
        },
        "returns": {
          "dy": "the number of tokens the user will get"
        }
      },
      "calculateTokenAmount(SwapUtils.Swap storage,uint256[],bool)": {
        "details": "This shouldn't be used outside frontends for user estimates.",
        "params": {
          "amounts": "an array of token amounts to deposit or withdrawal, corresponding to pooledTokens. The amount should be in each pooled token's native precision. If a token charges a fee on transfers, use the amount that gets transferred after the fee.",
          "deposit": "whether this is a deposit or a withdrawal",
          "self": "Swap struct to read from"
        },
        "returns": {
          "_0": "if deposit was true, total amount of lp token that will be minted and if deposit was false, total amount of lp token that will be burned"
        }
      },
      "calculateWithdrawOneToken(SwapUtils.Swap storage,uint256,uint8)": {
        "params": {
          "self": "Swap struct to read from",
          "tokenAmount": "the amount to withdraw in the pool's precision",
          "tokenIndex": "which token will be withdrawn"
        },
        "returns": {
          "_0": "the amount of token user will receive"
        }
      },
      "donateBalancedFees(SwapUtils.Swap storage,uint256,uint256)": {
        "params": {
          "EthDonation": "amount of ETH to donate into the pool",
          "gEthDonation": "amount of gETH to donate into the pool",
          "self": "Swap struct to deposit fees"
        }
      },
      "getAdminBalance(SwapUtils.Swap storage,uint256)": {
        "params": {
          "index": "Index of the pooled token",
          "self": "Swap struct to read from"
        },
        "returns": {
          "_0": "admin balance in the token's precision"
        }
      },
      "getDebt(SwapUtils.Swap storage)": {
        "returns": {
          "_0": "debt the half of the D StableSwap invariant when debt is needed to be payed."
        }
      },
      "getVirtualPrice(SwapUtils.Swap storage)": {
        "params": {
          "self": "Swap struct to read from"
        },
        "returns": {
          "_0": "the virtual price"
        }
      },
      "removeLiquidity(SwapUtils.Swap storage,uint256,uint256[])": {
        "details": "Liquidity can always be removed, even when the pool is paused.",
        "params": {
          "amount": "the amount of LP tokens to burn",
          "minAmounts": "the minimum amounts of each token in the pool acceptable for this burn. Useful as a front-running mitigation",
          "self": "Swap struct to read from and write to"
        },
        "returns": {
          "_0": "amounts of tokens the user received"
        }
      },
      "removeLiquidityImbalance(SwapUtils.Swap storage,uint256[],uint256)": {
        "params": {
          "amounts": "how much of each token to withdraw",
          "maxBurnAmount": "the max LP token provider is willing to pay to remove liquidity. Useful as a front-running mitigation.",
          "self": "Swap struct to read from and write to"
        },
        "returns": {
          "_0": "actual amount of LP tokens burned in the withdrawal"
        }
      },
      "removeLiquidityOneToken(SwapUtils.Swap storage,uint256,uint8,uint256)": {
        "params": {
          "minAmount": "the minimum amount to withdraw, otherwise revert",
          "self": "Swap struct to read from and write to",
          "tokenAmount": "the amount of the lp tokens to burn",
          "tokenIndex": "the index of the token you want to receive"
        },
        "returns": {
          "_0": "amount chosen token that user received"
        }
      },
      "setAdminFee(SwapUtils.Swap storage,uint256)": {
        "details": "adminFee cannot be higher than 100% of the swap fee",
        "params": {
          "newAdminFee": "new admin fee to be applied on future transactions",
          "self": "Swap struct to update"
        }
      },
      "setSwapFee(SwapUtils.Swap storage,uint256)": {
        "details": "fee cannot be higher than 1% of each swap",
        "params": {
          "newSwapFee": "new swap fee to be applied on future transactions",
          "self": "Swap struct to update"
        }
      },
      "swap(SwapUtils.Swap storage,uint8,uint8,uint256,uint256)": {
        "params": {
          "dx": "the amount of tokens the user wants to sell",
          "minDy": "the min amount the user would like to receive, or revert.",
          "self": "Swap struct to read from and write to",
          "tokenIndexFrom": "the token the user wants to sell",
          "tokenIndexTo": "the token the user wants to buy"
        },
        "returns": {
          "_0": "amount of token user received on swap"
        }
      },
      "withdrawAdminFees(SwapUtils.Swap storage,address)": {
        "params": {
          "self": "Swap struct to withdraw fees from",
          "to": "Address to send the fees to"
        }
      }
    },
    "title": "SwapUtils library",
    "version": 1
  },
  "userdoc": {
    "kind": "user",
    "methods": {
      "addLiquidity(SwapUtils.Swap storage,uint256[],uint256)": {
        "notice": "Add liquidity to the pool"
      },
      "calculateRemoveLiquidity(SwapUtils.Swap storage,uint256)": {
        "notice": "Uses _calculateRemoveLiquidity with Effective Balances, then projects the prices to the token amounts to get Real Balances, before removing them from pool."
      },
      "calculateSwap(SwapUtils.Swap storage,uint8,uint8,uint256)": {
        "notice": "Externally calculates a swap between two tokens."
      },
      "calculateTokenAmount(SwapUtils.Swap storage,uint256[],bool)": {
        "notice": "A simple method to calculate prices from deposits or withdrawals, excluding fees but including slippage. This is helpful as an input into the various \"min\" parameters on calls to fight front-running"
      },
      "calculateWithdrawOneToken(SwapUtils.Swap storage,uint256,uint8)": {
        "notice": "Calculate the dy, the amount of selected token that user receives and the fee of withdrawing in one token"
      },
      "donateBalancedFees(SwapUtils.Swap storage,uint256,uint256)": {
        "notice": "donate ETH and gETH to the pool as fee with respect to derivative price"
      },
      "getAdminBalance(SwapUtils.Swap storage,uint256)": {
        "notice": "return accumulated amount of admin fees of the token with given index"
      },
      "getVirtualPrice(SwapUtils.Swap storage)": {
        "notice": "Get the virtual price, to help calculate profit"
      },
      "removeLiquidity(SwapUtils.Swap storage,uint256,uint256[])": {
        "notice": "Burn LP tokens to remove liquidity from the pool."
      },
      "removeLiquidityImbalance(SwapUtils.Swap storage,uint256[],uint256)": {
        "notice": "Remove liquidity from the pool, weighted differently than the pool's current balances."
      },
      "removeLiquidityOneToken(SwapUtils.Swap storage,uint256,uint8,uint256)": {
        "notice": "Remove liquidity from the pool all in one token."
      },
      "setAdminFee(SwapUtils.Swap storage,uint256)": {
        "notice": "Sets the admin fee"
      },
      "setSwapFee(SwapUtils.Swap storage,uint256)": {
        "notice": "update the swap fee"
      },
      "swap(SwapUtils.Swap storage,uint8,uint8,uint256,uint256)": {
        "notice": "swap two tokens in the pool"
      },
      "withdrawAdminFees(SwapUtils.Swap storage,address)": {
        "notice": "withdraw all admin fees to a given address"
      }
    },
    "notice": "A library to be used within Swap.sol. Contains functions responsible for custody and AMM functionalities with some changes. The main functionality of Withdrawal Pools is allowing the depositors to have instant withdrawals relying on the Oracle Price, with the help of Liquidity Providers. It is important to change the focus point (1-1) of the pricing algorithm with PriceIn and PriceOut functions. Because the underlying price of the staked assets are expected to raise in time. One can see this similar to accomplishing a \"rebasing\" logic, with the help of a trusted price source.",
    "version": 1
  },
  "storageLayout": {
    "storage": [],
    "types": null
  }
}